### ISSUE TITLE
[Question]Rancher Harvester integration failing with context deadline exceeded (Client.Timeout exceeded while awaiting headers)

### ISSUE THREAD

**Issue by Sparkxxx** [harvester/harvester#3182]
On the Rancher cluster we have by default these secrets containing TLS certs:

```
kubectl get secrets --field-selector type=kubernetes.io/tls --all-namespaces
NAMESPACE       NAME                      TYPE                DATA   AGE
cattle-system   cattle-webhook-ca         kubernetes.io/tls   2      144m
cattle-system   cattle-webhook-tls        kubernetes.io/tls   2      144m
cattle-system   rancher-webhook-tls       kubernetes.io/tls   2      144m
cattle-system   serving-cert              kubernetes.io/tls   2      147m
cattle-system   tls-rancher               kubernetes.io/tls   2      147m
cattle-system   tls-rancher-ingress       kubernetes.io/tls   3      144m
cattle-system   tls-rancher-internal      kubernetes.io/tls   2      147m
cattle-system   tls-rancher-internal-ca   kubernetes.io/tls   2      147m
kube-system     k3s-serving               kubernetes.io/tls   2      154m
```

Which one of these secrets contains the CA that has to be added to Harvester -> Settings -> additional-ca, so that it will not fail self-signed certificates with:
```
Get "https://host.domain/v3/import/g4ztdxgv9vbq4vq8fnl28k8mghlrvg5xhbfqcszlvbvdr8v24w44s4_c-m-l2xx5brt.yaml": context deadline exceeded (Client.Timeout exceeded while awaiting headers)
```
Stated in the docs https://docs.harvesterhci.io/v1.1/advanced/settings/#additional-ca  
Do we also have to include the key for the CA crt?

Thank you.

**Comment by futuretea** [comment]
```
Get "https://host.domain/v3/import/g4ztdxgv9vbq4vq8fnl28k8mghlrvg5xhbfqcszlvbvdr8v24w44s4_c-m-l2xx5brt.yaml": context deadline exceeded (Client.Timeout exceeded while awaiting headers)
```
This error looks like a netowork issue.


> Which one of these secrets contains the CA that has to be added to Harvester -> Settings -> additional-ca, so that it will not fail self-signed certificates

You don't need to add additional-ca, because of Harvester already skip the tls insecure verify in https://github.com/harvester/harvester/blob/7c1f4a24062cbb15803eef09974a78b73e57f871/pkg/controller/master/setting/register.go#L54

**Comment by Sparkxxx** [comment]
To answer my own question, the correct Rancher CA to import in Harvester additional-ca is:
```
kubectl -n cattle-system get secret tls-rancher-ingress -o json| jq -r '.data."ca.crt"' | base64 -d
```

With it added I can curl from Harvester CLI without getting any error.

**Comment by Sparkxxx** [comment]
> ```
> Get "https://host.domain/v3/import/g4ztdxgv9vbq4vq8fnl28k8mghlrvg5xhbfqcszlvbvdr8v24w44s4_c-m-l2xx5brt.yaml": context deadline exceeded (Client.Timeout exceeded while awaiting headers)
> ```
> 
> This error looks like a netowork issue.
> 


It surely is a network error (I've also seen another error message too saying that it can't connect to ip 10.200.0.101) but I do not know how to debug it.

My setup is:
1. A single node Harvester with 100GB ram, 32 cores dual CPU, SSD disk, ip 10.200.0.10, vlan200.
2. Cluster Network: mgmt, vlan200, Harvester UI with local DNS vip 10.200.0.100, vipharv.ops.local.
3. Custom Namespace OPS with 2 VM Networks
```
Namespace: ops
  | ops-wan | L2VlanNetwork | mgmt | vlan15 | 
  | ops-infra | L2VlanNetwork | mgmt | vlan200 |
```
4. VM ranchcon.ops.local, Ubuntu with k3s & Rancher in Namespace: ops with single network interface in ops-infra | L2VlanNetwork | mgmt | vlan200 - ip 10.200.0.101

I can ping https://ranchcon.ops.local from harvester cli (curl after adding additional-ca)
I can access  https://ranchcon.ops.local/v3/import/m5pkxgb2vbmvsts4qw8sxxpfgwbzp27f2trq492c7cr8bs6hbphw8b_c-m-f5vjzn4p.yaml from web browser and it's pretty fast after the first req which is 2-3s.

I could see that Timeout: 30 * time.Second in your link. This is triggering the error in Harvester UI since it can't access the ip. 
The question is why since even if the packets leave the harvester interfaces they should be routed correctly at the gateway level anyway.

What more to try (exec into pods and curl/ping from there, which pods)?
Move the VM in a different namespace (default, harvester-public, local)? Is it possible that Harvester can't reach the namespace?

Thank you.

**Comment by futuretea** [comment]
> What more to try (exec into pods and curl/ping from there, which pods)?

You can try to exec into a pod of deployment harvester-system/harvester。

**Comment by Sparkxxx** [comment]
Pod IP
```
harvester-55f7d69c74-45nsj:/var/lib/harvester/harvester # ip a
1: lo: <LOOPBACK,UP,LOWER_UP> mtu 65536 qdisc noqueue state UNKNOWN group default qlen 1000
    link/loopback 00:00:00:00:00:00 brd 00:00:00:00:00:00
    inet 127.0.0.1/8 scope host lo
       valid_lft forever preferred_lft forever
    inet6 ::1/128 scope host
       valid_lft forever preferred_lft forever
3: eth0@if30: <BROADCAST,MULTICAST,UP,LOWER_UP> mtu 1450 qdisc noqueue state UP group default
    link/ether 66:a2:ae:ae:48:3f brd ff:ff:ff:ff:ff:ff link-netnsid 0
    inet 10.52.0.132/32 scope global eth0
       valid_lft forever preferred_lft forever
    inet6 fe80::64a2:aeff:feae:483f/64 scope link
       valid_lft forever preferred_lft forever
```

Traceroute to nodes works except for ip 10.200.0.101
```
harvester-55f7d69c74-45nsj:/var/lib/harvester/harvester # traceroute 10.200.0.10
traceroute to 10.200.0.10 (10.200.0.10), 30 hops max, 60 byte packets
 1  10-200-0-10.kubernetes.default.svc.cluster.local (10.200.0.10)  0.593 ms  0.511 ms  0.462 ms
harvester-55f7d69c74-45nsj:/var/lib/harvester/harvester # traceroute 10.200.0.100
traceroute to 10.200.0.100 (10.200.0.100), 30 hops max, 60 byte packets
 1  ingress-expose.kube-system.svc.cluster.local (10.200.0.100)  0.068 ms  0.022 ms  0.019 ms
harvester-55f7d69c74-45nsj:/var/lib/harvester/harvester # traceroute 10.200.0.254
traceroute to 10.200.0.254 (10.200.0.254), 30 hops max, 60 byte packets
 1  10-200-0-10.kubernetes.default.svc.cluster.local (10.200.0.10)  0.069 ms  0.023 ms  0.015 ms
 2  10.200.0.254 (10.200.0.254)  0.299 ms  0.492 ms  0.516 ms
harvester-55f7d69c74-45nsj:/var/lib/harvester/harvester # traceroute 10.200.0.101
traceroute to 10.200.0.101 (10.200.0.101), 30 hops max, 60 byte packets
 1  10-200-0-10.kubernetes.default.svc.cluster.local (10.200.0.10)  0.067 ms  0.018 ms  0.023 ms
 2  * * *
 3  * * *
.... it never completes
```

What I think is happening is that because I have chosen vlan200 for harvester node and cluster vip and because I created the same VMnetwork (L2VlanNetwork vlan200) in a new namespace (ops) it looks like the packets never leave the server interfaces to reach the gateway and come back and we have some kind of local/internal loop that is blocked.

Conclusion:
Packets from a namespace can't reach the other namespace even on the same vlan, there's something happening on the routing level I think?

**Comment by Sparkxxx** [comment]
After more digging:
- Traffic sent from harvester pod is reaching the rancher server.
- Rancher server replies. 
- Returning traffic is not reaching the harvester pod although it is sent by the rancher server (NAT not working?).


```
harvester-55f7d69c74-45nsj:/var/lib/harvester/harvester # ping ranchcon.ops.local
PING ranchcon.ops.local (10.230.0.1) 56(84) bytes of data.

--- ranchcon.ops.local ping statistics ---
11 packets transmitted, 0 received, 100% packet loss, time 10225ms


sparkx@ranchcon:~$ sudo tcpdump -n dst host 10.200.0.10 or src host 10.200.0.10
tcpdump: verbose output suppressed, use -v[v]... for full protocol decode
listening on enp1s0, link-type EN10MB (Ethernet), snapshot length 262144 bytes
15:57:01.734942 IP 10.200.0.10 > 10.230.0.1: ICMP echo request, id 41745, seq 1, length 64
15:57:01.735024 IP 10.230.0.1 > 10.200.0.10: ICMP echo reply, id 41745, seq 1, length 64
15:57:02.744496 IP 10.200.0.10 > 10.230.0.1: ICMP echo request, id 41745, seq 2, length 64
15:57:02.744594 IP 10.230.0.1 > 10.200.0.10: ICMP echo reply, id 41745, seq 2, length 64
15:57:03.772399 IP 10.200.0.10 > 10.230.0.1: ICMP echo request, id 41745, seq 3, length 64
15:57:03.772488 IP 10.230.0.1 > 10.200.0.10: ICMP echo reply, id 41745, seq 3, length 64
15:57:04.792266 IP 10.200.0.10 > 10.230.0.1: ICMP echo request, id 41745, seq 4, length 64
15:57:04.792315 IP 10.230.0.1 > 10.200.0.10: ICMP echo reply, id 41745, seq 4, length 64


harvester-55f7d69c74-45nsj:/var/lib/harvester/harvester # ping ranchcon.ops.local
PING ranchcon.ops.local (10.230.0.1) 56(84) bytes of data.
^Z
[1]+  Stopped                 ping ranchcon.ops.local
harvester-55f7d69c74-45nsj:/var/lib/harvester/harvester # bg
[1]+ ping ranchcon.ops.local &
harvester-55f7d69c74-45nsj:/var/lib/harvester/harvester # tcpdump src 10.230.0.1 or dst 10.230.0.1
tcpdump: verbose output suppressed, use -v or -vv for full protocol decode
listening on eth0, link-type EN10MB (Ethernet), capture size 262144 bytes
16:00:41.014538 IP harvester-55f7d69c74-45nsj > ranchcon.ops.local: ICMP echo request, id 13, seq 11, length 64
16:00:42.038535 IP harvester-55f7d69c74-45nsj > ranchcon.ops.local: ICMP echo request, id 13, seq 12, length 64
16:00:43.066532 IP harvester-55f7d69c74-45nsj > ranchcon.ops.local: ICMP echo request, id 13, seq 13, length 64
16:00:44.090508 IP harvester-55f7d69c74-45nsj > ranchcon.ops.local: ICMP echo request, id 13, seq 14, length 64
16:00:45.110557 IP harvester-55f7d69c74-45nsj > ranchcon.ops.local: ICMP echo request, id 13, seq 15, length 64

24 packets captured
24 packets received by filter
0 packets dropped by kernel
harvester-55f7d69c74-45nsj:/var/lib/harvester/harvester # fg
ping ranchcon.ops.local
^C
--- ranchcon.ops.local ping statistics ---
44 packets transmitted, 0 received, 100% packet loss, time 46749ms

harvester-55f7d69c74-45nsj:/var/lib/harvester/harvester # traceroute ranchcon.ops.local
traceroute to ranchcon.ops.local (10.230.0.1), 30 hops max, 60 byte packets
 1  10-200-0-10.kubernetes.default.svc.cluster.local (10.200.0.10)  0.066 ms  0.026 ms  0.017 ms
 2  10.200.0.254 (10.200.0.254)  0.386 ms  0.490 ms  0.480 ms
 3  * * *
 4  * * *

```

Any idea what could block it on the way?
