### ISSUE TITLE
[BUG] Unstable connectivity to guest cluster VIP

### ISSUE THREAD

**Issue by janeczku** [harvester/harvester#1790]
**Describe the bug**

Connections to the guest cluster VIP addresses (service type loadBalancer) are failing frequently (e.g. 1 out of 3 connection attempts fails). tcpdump shows that return packets from the VM interfaces are lost on the harvester-br0 interface.

**To Reproduce**

1. Install a 3 node harvester cluster with each physical server having two network interfaces (see config-create.yaml below)
2. First interface is configured as "harvester-mgmt" interface and connected to an access port on the network switch ("Management LAN", e.g. VLAN 10)
3. Second interface is configured as "harvester-vlan" interface and connected to a trunk port on the network switch.
4. Setup a "user network" in the physical network, e.g. VLAN 65, with a working DHCP service and ensure connectivity to this VLAN from the management LAN.
5. Configure `harvester-vlan` as the VLAN interface in Harvester settings
6. Create a VLAN network in Harvester, specifying the VLAN ID of the user network.
7. Configure a VIP Pool in Harvester, specifying a network range in the "Management LAN"
8. Provision an RKE2 cluster with at least 5 worker nodes and select the previously created VLAN network
9. Ensure that the worker node VMs are distributed across all 3 Harvester nodes (at least one worker on each physical node!)
9. Deploy nginx test pod in the guest cluster and configure a service type loadBalancer using IPAM->Pool
10. From another machine that has connectivity to the Management LAN, execute `curl --connect-timeout 5 http://<VIP>` 10 times in sequence

**Expected behavior**

All 10 curl commands succeed

**Actual behavior**

Multiple executions fail with time out. The number of failed attempts correlates with the number of guest cluster VMs scheduled on the Harvester node that announces the VIP.

**Environment:**
 - Harvester ISO version:  1.0.0
 - Baremetal

**Additional context**

Following the packet path with tcpdump shows that the curl command only works when the packets are DNAT'ed from the Harvester node owning the VIP ("VIP node") to another Harvester node. When the packets instead are DNAT'ed to a VM on the same node then the SYN-ACK returned from the VM is lost on the `harvester-br0` so that the connection is never established.

Here is an example of failed connection. Test was running `curl http://<VIP>` from a machine connected to the `harvester-mgmt` LAN.

**tcpdump on the guest VM veth interface `veth87f82dfc` on the Harvester node announcing the VIP (`donna`)**

You can see the SYN packet from the curl client is arriving on the VM and the ACK is sent back. But it is not received on client-side, so repeated connection attempts occur.

Below, the `10.65.0.130` etc.  IP addresses are the IP addresses of the guest cluster VMs (on VLAN 65) and port `30424` is the node port for the loadBalancer service. We basically follow the packet after the destination has been rewritten (DNAT) from the VIP address to the VM addresses.

```
donna:/home/rancher # tcpdump -i veth87f82dfc host 10.65.0.130 or 10.65.0.131 or 10.65.0.128 or 10.65.0.132 and port 30424

listening on veth87f82dfc, link-type EN10MB (Ethernet), capture size 262144 bytes
02:03:11.423253 IP donna.demo.com.27644 > 10.65.0.128.30424: Flags [S], seq 2111687448, win 29200, options [mss 1460,sackOK,TS val 2191479786 ecr 0,nop,wscale 7], length 0
02:03:11.423534 IP 10.65.0.128.30424 > donna.demo.com.27644: Flags [S.], seq 984631573, ack 2111687449, win 64308, options [mss 1410,sackOK,TS val 4139010272 ecr 2191479786,nop,wscale 7], length 0
02:03:12.419782 IP donna.demo.com.27644 > 10.65.0.128.30424: Flags [S], seq 2111687448, win 29200, options [mss 1460,sackOK,TS val 2191480036 ecr 0,nop,wscale 7], length 0
02:03:12.420106 IP 10.65.0.128.30424 > donna.demo.com.27644: Flags [S.], seq 984631573, ack 2111687449, win 64308, options [mss 1410,sackOK,TS val 4139011268 ecr 2191479786,nop,wscale 7], length 0
02:03:13.426114 IP 10.65.0.128.30424 > donna.demo.com.27644: Flags [S.], seq 984631573, ack 2111687449, win 64308, options [mss 1410,sackOK,TS val 4139012274 ecr 2191479786,nop,wscale 7], length 0
02:03:14.423689 IP donna.demo.com.27644 > 10.65.0.128.30424: Flags [S], seq 2111687448, win 29200, options [mss 1460,sackOK,TS val 2191480537 ecr 0,nop,wscale 7], length 0
02:03:14.423977 IP 10.65.0.128.30424 > donna.demo.com.27644: Flags [S.], seq 984631573, ack 2111687449, win 64308, options [mss 1410,sackOK,TS val 4139013272 ecr 2191479786,nop,wscale 7], length 0
02:03:16.434151 IP 10.65.0.128.30424 > donna.demo.com.27644: Flags [S.], seq 984631573, ack 2111687449, win 64308, options [mss 1410,sackOK,TS val 4139015282 ecr 2191479786,nop,wscale 7], length 0
```` 

On the same harvester node while listening on the `harvester-mgmt` and `harvester-vlan` interface we can only see the SYN packets from the external client but not the ACK from the VM. Same picture on the `harvester-br0`.
This indicates the packets leaving the guest VM are dropped somewhere in the Harvester node network stack.

```
donna:/home/rancher # tcpdump -i harvester-mgmt host 10.65.0.130 or 10.65.0.131 or 10.65.0.128 or 10.65.0.132 and port 30424

listening on harvester-mgmt, link-type EN10MB (Ethernet), capture size 262144 bytes

22:10:59.025061 IP donna.demo.com.20369 > 10.65.0.131.30424: Flags [S], seq 3887109834, win 29200, options [mss 1460,sackOK,TS val 2187996687 ecr 0,nop,wscale 7], length 0
22:11:00.022608 IP donna.demo.com.20369 > 10.65.0.131.30424: Flags [S], seq 3887109834, win 29200, options [mss 1460,sackOK,TS val 2187996937 ecr 0,nop,wscale 7], length 0
22:11:02.026642 IP donna.demo.com.20369 > 10.65.0.131.30424: Flags [S], seq 3887109834, win 29200, options [mss 1460,sackOK,TS val 2187997438 ecr 0,nop,wscale 7], length 0
22:11:06.034691 IP donna.demo.com.20369 > 10.65.0.131.30424: Flags [S], seq 3887109834, win 29200, options [mss 1460,sackOK,TS val 2187998440 ecr 0,nop,wscale 7], length 0

donna:/home/rancher # tcpdump -i harvester-vlan host 10.65.0.130 or 10.65.0.131 or 10.65.0.128 or 10.65.0.132 and port 30424

listening on harvester-vlan, link-type EN10MB (Ethernet), capture size 262144 bytes

22:05:23.799075 IP donna.demo.com.65287 > 10.65.0.128.30424: Flags [S], seq 597501491, win 29200, options [mss 1460,sackOK,TS val 2187912881 ecr 0,nop,wscale 7], length 0
22:05:24.798942 IP donna.demo.com.65287 > 10.65.0.128.30424: Flags [S], seq 597501491, win 29200, options [mss 1460,sackOK,TS val 2187913131 ecr 0,nop,wscale 7], length 0
22:05:26.803146 IP donna.demo.com.65287 > 10.65.0.128.30424: Flags [S], seq 597501491, win 29200, options [mss 1460,sackOK,TS val 2187913632 ecr 0,nop,wscale 7], length 0
22:05:30.811129 IP donna.demo.com.65287 > 10.65.0.128.30424: Flags [S], seq 597501491, win 29200, options [mss 1460,sackOK,TS val 2187914634 ecr 0,nop,wscale 7], length 0
```

VLAN configuration of the `harvester-br0`:

```
donna:/home/rancher # bridge vlan show
port	vlan ids
harvester-vlan	 1 PVID Egress Untagged
	 20
	 65
	 66
harvester-br0	 1 PVID Egress Untagged
vethf0888c84	 1 Egress Untagged
	 65 PVID Egress Untagged
vethe805d08c	 1 Egress Untagged
	 65 PVID Egress Untagged
veth87f82dfc	 1 Egress Untagged
	 65 PVID Egress Untagged
```

Create-config.yaml:

```
token: -REDACTED-
os:
  hostname: harvey.-REDACTED-.com
  ssh_authorized_keys:
  - ssh-rsa -REDACTED-
  password: -REDACTED-
install:
  mode: create
  networks:
    harvester-mgmt:       # (Mandatory) The management bond name.
      interfaces:
      - name: eno1
      - name: ens6f3
      ip: 192.168.200.141
      subnet_mask: 255.255.255.0
      default_route: true
      gateway: 192.168.200.1
      method: static
      bond_options:
        mode: balance-tlb
        miimon: 100
    harvester-vlan:       # (Optional) The VLAN network bond name. If VLAN NIC names vary from
      interfaces:         # host to host, consider creating a bonding device. Users can then select
      - name: eno2        # `harvester-vlan` as the VLAN network NIC in the Harvester GUI.
      method: none
      bond_options:
        mode: balance-tlb
        miimon: 100
  device: /dev/sda
  iso_url: http://192.168.200.19/harvester/harvester-v0.3.0-amd64.iso
  vip: 192.168.200.144       # The VIP to access the Harvester GUI. Make sure the IP is free to use.
  vip_mode: static        # Or dhcp, check configuration file for more information.
```

**Comment by janeczku** [comment]
Additional information:

There is no problem pinging the VIP from the client in the same (or routed) network:

```
proxy23:/etc/haproxy # ping 192.168.200.216
PING 192.168.200.216 (192.168.200.216) 56(84) bytes of data.
64 bytes from 192.168.200.216: icmp_seq=1 ttl=63 time=0.671 ms
64 bytes from 192.168.200.216: icmp_seq=2 ttl=63 time=1.05 ms
64 bytes from 192.168.200.216: icmp_seq=3 ttl=63 time=0.949 ms
64 bytes from 192.168.200.216: icmp_seq=4 ttl=63 time=1.13 ms
64 bytes from 192.168.200.216: icmp_seq=5 ttl=63 time=0.810 ms
^C
--- 192.168.200.216 ping statistics ---
5 packets transmitted, 5 received, 0% packet loss, time 4030ms
rtt min/avg/max/mdev = 0.671/0.925/1.138/0.169 ms
```

**Comment by yaocw2020** [comment]
> Additional information:
> 
> There is no problem pinging the VIP from the client in the same (or routed) network:
> 
> ```
> proxy23:/etc/haproxy # ping 192.168.200.216
> PING 192.168.200.216 (192.168.200.216) 56(84) bytes of data.
> 64 bytes from 192.168.200.216: icmp_seq=1 ttl=63 time=0.671 ms
> 64 bytes from 192.168.200.216: icmp_seq=2 ttl=63 time=1.05 ms
> 64 bytes from 192.168.200.216: icmp_seq=3 ttl=63 time=0.949 ms
> 64 bytes from 192.168.200.216: icmp_seq=4 ttl=63 time=1.13 ms
> 64 bytes from 192.168.200.216: icmp_seq=5 ttl=63 time=0.810 ms
> ^C
> --- 192.168.200.216 ping statistics ---
> 5 packets transmitted, 5 received, 0% packet loss, time 4030ms
> rtt min/avg/max/mdev = 0.671/0.925/1.138/0.169 ms
> ```

Does it ok to ping the host 10.65.0.130 or 10.65.0.131 or 10.65.0.128 or 10.65.0.132 from the harvester host?

**Comment by janeczku** [comment]
> Does it ok to ping the host 10.65.0.130 or 10.65.0.131 or 10.65.0.128 or 10.65.0.132 from the harvester host?

yes, pinging the VM IP addresses from harvester host works fine.

**Comment by yaocw2020** [comment]
For testing:
- Set up a Harvester with one host, enable VLAN, and create a VLAN network.
- Import the Harvester into Rancher and create an RKE2 in the VLAN network with the Harvester cloud provider through the Harvester node driver.
- Deploy an Nginx deployment and create the related load balancer service.
- Access the service(using curl command) from the Harvester Host.

Cause the modification affects the whole Harvester network, it needs more **regression testing** for the management and VLAN network. Thanks!

**Comment by noahgildersleeve** [comment]
Tested in rancher with version `da382a8` off of `v2.6-head` and Harvester `master-1a861fc1-head`
 with following steps


> For testing:
> 
> * Set up a Harvester with one host, enable VLAN, and create a VLAN network.
> * Import the Harvester into Rancher and create an RKE2 in the VLAN network with the Harvester cloud provider through the Harvester node driver.
> * Deploy an Nginx deployment and create the related load balancer service.
> * Access the service(using curl command) from the Harvester Host.
> 
> Cause the modification affects the whole Harvester network, it needs more **regression testing** for the management and VLAN network. Thanks!
![Screenshot from 2022-02-02 13-40-04](https://user-images.githubusercontent.com/83787952/152241881-170eedf9-7764-42ef-a802-f0857ca3f7fd.png)
