### ISSUE TITLE
[BUG] VLAN1 leaks to VM

### ISSUE THREAD

**Issue by mcerveny** [harvester/harvester#8816]
### Describe the Bug

I built "Virtual Machine Networks" VLAN100 and It was assigned to VM (ubuntu24). I communicate over VLAN100 from/to VM but also see VLAN1 broadcast packets in VM.

### To Reproduce

1) build "Virtual Machine Networks" (VLAN100) and assign to VM
2) run ping to nonexistent IP from router to VLAN1 and VLAN100 to generate ARP broadcasts (VLAN1 10.33.1.* and VLAN100 10.33.100.*)
`ping 10.33.1.111 & ping 10.33.100.111 &`
3) look for ARP packets in VM (both VLAN1 and VLAN100 are present).
```
root@ubuntu24:/home/user# tcpdump -n arp
tcpdump: verbose output suppressed, use -v[v]... for full protocol decode
listening on enp1s0, link-type EN10MB (Ethernet), snapshot length 262144 bytes
18:08:57.945819 ARP, Request who-has 10.33.100.111 tell 10.33.100.254, length 46
18:08:58.886736 ARP, Request who-has 10.33.1.111 tell 10.33.1.253, length 46
18:08:58.983706 ARP, Request who-has 10.33.100.111 tell 10.33.100.254, length 46
18:08:59.943752 ARP, Request who-has 10.33.1.111 tell 10.33.1.253, length 46
...
```
4) check bridge config on host where VM is running (see VLAN1 on veth)
```
node3:/home/rancher # bridge vlan
port              vlan-id  
mgmt-br           1 PVID Egress Untagged
mgmt-bo           1 PVID Egress Untagged
                  100
veth08575789      1 Egress Untagged
                  100 PVID Egress Untagged
```
5) remove VLAN1 from veth
```
node3:/home/rancher # bridge vlan del vid 1 dev veth08575789
node3:/home/rancher # bridge vlan
port              vlan-id  
mgmt-br           1 PVID Egress Untagged
mgmt-bo           1 PVID Egress Untagged
                  100
veth08575789      100 PVID Egress Untagged
```
6)  look for ARP packets in VM (only VLAN100 ARP is present)
```
root@ubuntu24:/home/user# tcpdump -n arp
tcpdump: verbose output suppressed, use -v[v]... for full protocol decode
listening on enp1s0, link-type EN10MB (Ethernet), snapshot length 262144 bytes
18:47:51.537415 ARP, Request who-has 10.33.100.111 tell 10.33.100.254, length 46
18:47:53.467943 ARP, Request who-has 10.33.100.111 tell 10.33.100.254, length 46
18:47:54.497337 ARP, Request who-has 10.33.100.111 tell 10.33.100.254, length 46
18:47:55.537434 ARP, Request who-has 10.33.100.111 tell 10.33.100.254, length 46
```

### Expected Behavior

No VLAN1 packets.

### Support Bundle for Troubleshooting

.

### Environment

- Harvester version: v1.6.0-rc5

**Comment by RegisWeduLabs** [comment]
Very similar to https://github.com/harvester/harvester/issues/8067

**Comment by tjjh89017** [comment]
Well, this is a legacy stuff in CNI bridge plugin.

I sent this PR after I left Harvester team.
https://github.com/containernetworking/plugins/pull/829
I originally wanted to remove this legacy behavior in 829 at the same time (remove vid 1)
but, maintainers thought that behavior should be kept for a while because some users relied on that "incorrect behavior".
So our consensus was "keep that for a while, and put deprecated later"
But I don't have time to fix that.
So, that is CNI issues, maybe Harvester team should check Bridge CNI again.

Thanks

Please check this comment as well: https://github.com/containernetworking/plugins/pull/829#issuecomment-1514476105
Better to read the whole thread to understand more about this.

**Comment by tjjh89017** [comment]
So this issue is different from #8067 .
It's more about Bridge CNI issue.

**Comment by innobead** [comment]
cc @harvester/network

**Comment by tjjh89017** [comment]
This should be fixed by https://github.com/containernetworking/plugins/pull/1181
If Harvester's bridge CNI is up-to-date. (with v1.8.0)

**Comment by rrajendran17** [comment]
documented https://github.com/harvester/docs/pull/934

**Comment by TachunLin** [comment]
On latest Harveter v1.8.0 master,
* We have the chance to use existing ipxe-example with some adjustment on the pxe_server to simulate test environment contain both vlan1 and vlan100 (192.168.101.0/24)

  <img width="1352" height="730" alt="Image" src="https://github.com/user-attachments/assets/459dc2c1-7b19-4ed2-9449-d09fb3f22c18" />

* Assign vlan101 to the vm
  <img width="1600" height="791" alt="Image" src="https://github.com/user-attachments/assets/1340724b-749f-4909-9cf3-330670739f75" />

As per discussed with @rrajendran17 , 
* we can check if `bridge vlan show` on the host has just the output without `1 egress untagged`

  ```
  harvester-node-0:~ # bridge link show
  10: mgmt-bo: <BROADCAST,MULTICAST,MASTER,UP,LOWER_UP> mtu 1500 master mgmt-br state forwarding priority 32 cost 100 
  103: cn-bo: <BROADCAST,MULTICAST,MASTER,UP,LOWER_UP> mtu 1500 master cn-br state forwarding priority 32 cost 5 
  112: vethd8dae531@ens6: <BROADCAST,MULTICAST,UP,LOWER_UP> mtu 1500 master cn-br state forwarding priority 32 cost 2
  ```


Following is the step to configure vlan101 I learned from @starbops guidance. 

<details><summary> Configure vlan101 on pxe_server </summary>

  1. ssh to pxe server `$ vagrant ssh pxe_server` and change to root
  2. Add vlan 101 DHCP ip range in `/etc/dhcp/dhcpd.conf`

  ```
  subnet 192.168.101.0 netmask 255.255.255.0 {
      range 192.168.101.100 192.168.101.200;
      option domain-name-servers 192.168.0.254, 8.8.8.8;
  }
  ```
  ```
  ddns-update-style none;
  
  # option domain-name "example.org";
  include "/etc/dhcp/ipxe.conf";
  option arch code 93 = unsigned integer 16;
  option user-class code 77 = string;
  
  default-lease-time 600;
  max-lease-time 7200;
  authoritative;
  log-facility local7;
  
  subnet 192.168.0.0 netmask 255.255.255.0 {
      range 192.168.0.50 192.168.0.130;
      option domain-name-servers 192.168.0.254, 8.8.8.8;
          option routers 192.168.0.254;
          next-server 192.168.0.254;
  
     if exists user-class and option user-class = "iPXE" {
          filename "http://192.168.0.254/harvester/${net1/mac}";
      } elsif option arch != 00:00 {
          filename "ipxe/ipxe.efi";
      } else {
          filename "ipxe/undionly.kpxe";
      }
  }
  
  subnet 192.168.101.0 netmask 255.255.255.0 {
      range 192.168.101.100 192.168.101.200;
      option domain-name-servers 192.168.0.254, 8.8.8.8;
  }
  ```


  3. Add eth1.101 vlan

  ```
  $ ip link add link eth1 name eth1.101 type vlan id 101
  ```

  4. Assign IP to eth1.101 interface

  ```
  ip addr add 192.168.101.254/24 brd 192.168.101.255 dev eth1.101
  ```

  5. Bring up eth1.101 network

  ```
  ip link set up eth1.101
  ```

  6. Restart DHCP service

  ```
  $ systemctl restart isc-dhcp-server.service
  ```

  7. Check vlan interface ip status: `ip a`

  ```
  4: eth1.101@eth1: <BROADCAST,MULTICAST,UP,LOWER_UP> mtu 1500 qdisc noqueue state UP group default qlen 1000
      link/ether 52:54:00:5a:bd:cf brd ff:ff:ff:ff:ff:ff
      inet 192.168.101.254/24 brd 192.168.101.255 scope global eth1.101
         valid_lft forever preferred_lft forever
  ```

  8. Add `eth1.101` listening interface in `/etc/default/isc-dhcp-server`

  ```
  # On what interfaces should the DHCP server (dhcpd) serve DHCP requests?
  #       Separate multiple interfaces with spaces, e.g. "eth0 eth1".
  INTERFACESv4="eth1 eth1.101"
  ```

  9. Restart DHCP service `$ systemctl restart isc-dhcp-server.service`

  10. Back to Harvester, create a cluster network `cn`
  11. Create a network config `nc` and set an interface
  12. Create a network named vlan 101 with id 101 (use `nc`)
  13. Use Auto route

  <img width="1341" height="661" alt="Image" src="https://github.com/user-attachments/assets/a73fa905-5c9e-4dc8-b232-ca026a1b3503" />

</details>


We can evaluate whether this environment is applicable to verify this issue next week.

**Comment by TachunLin** [comment]
@rrajendran17 ,
I tried to follow the issue description steps and your suggestion to verify this issue.

Please check the following result and feedback whether this issue have been fixed on the test environment with latest v1.8.0 master. 

If the environment is not applicable, I can discuss with you later to find the suitable solution. Thanks. 


1.  Check the network configuration on router (pxe_server)
  ```
  root@pxe-server:~# ip a
  1: lo: <LOOPBACK,UP,LOWER_UP> mtu 65536 qdisc noqueue state UNKNOWN group default qlen 1000
      link/loopback 00:00:00:00:00:00 brd 00:00:00:00:00:00
      inet 127.0.0.1/8 scope host lo
         valid_lft forever preferred_lft forever
  2: eth0: <BROADCAST,MULTICAST,UP,LOWER_UP> mtu 1500 qdisc pfifo_fast state UP group default qlen 1000
      link/ether 52:54:00:ff:bb:09 brd ff:ff:ff:ff:ff:ff
      altname enp0s5
      altname ens5
      inet 192.168.121.94/24 brd 192.168.121.255 scope global dynamic eth0
         valid_lft 3481sec preferred_lft 3481sec
  3: eth1: <BROADCAST,MULTICAST,UP,LOWER_UP> mtu 1500 qdisc pfifo_fast state UP group default qlen 1000
      link/ether 52:54:00:84:5f:98 brd ff:ff:ff:ff:ff:ff
      altname enp0s6
      altname ens6
      inet 192.168.0.254/24 brd 192.168.0.255 scope global eth1
         valid_lft forever preferred_lft forever
  4: eth1.101@eth1: <BROADCAST,MULTICAST,UP,LOWER_UP> mtu 1500 qdisc noqueue state UP group default qlen 1000
      link/ether 52:54:00:84:5f:98 brd ff:ff:ff:ff:ff:ff
      inet 192.168.101.254/24 brd 192.168.101.255 scope global eth1.101
         valid_lft forever preferred_lft forever
  
  ```

2. ping from router and check arp packet on vm
   - Ping the non-exists IP from router
    ```
    root@pxe-server:~# ping -c3 192.168.0.102
    PING 192.168.0.102 (192.168.0.102) 56(84) bytes of data.
    From 192.168.0.254 icmp_seq=1 Destination Host Unreachable
    From 192.168.0.254 icmp_seq=2 Destination Host Unreachable
    From 192.168.0.254 icmp_seq=3 Destination Host Unreachable
    
    --- 192.168.0.102 ping statistics ---
    3 packets transmitted, 0 received, +3 errors, 100% packet loss, time 2045ms
    pipe 3
    root@pxe-server:~# ping -c3 192.168.101.100
    PING 192.168.101.100 (192.168.101.100) 56(84) bytes of data.
    From 192.168.101.254 icmp_seq=1 Destination Host Unreachable
    From 192.168.101.254 icmp_seq=2 Destination Host Unreachable
    From 192.168.101.254 icmp_seq=3 Destination Host Unreachable
    
    --- 192.168.101.100 ping statistics ---
    3 packets transmitted, 0 received, +3 errors, 100% packet loss, time 2026ms
    pipe 3
    ```
3. Look for ARP packets on VM
   - only VLAN 101 packet exists
    <img width="628" height="121" alt="Image" src="https://github.com/user-attachments/assets/b5cdf1d1-5f33-4d39-89aa-a102b169de32" />

4. check bridge config on host (node-0) where VM is running

  ```
  harvester-node-0:~ # bridge vlan
  port              vlan-id  
  mgmt-br           1 PVID Egress Untagged
  mgmt-bo           1 PVID Egress Untagged
  cn-bo             1 PVID Egress Untagged
                    101
  cn-br             1 PVID Egress Untagged
  vethd8dae531      101 PVID Egress Untagged
  ```

5. Check the "bridge link show" has just the output without "1 egress untagged"

  ```
  harvester-node-0:~ # bridge link show
  10: mgmt-bo: <BROADCAST,MULTICAST,MASTER,UP,LOWER_UP> mtu 1500 master mgmt-br state forwarding priority 32 cost 100 
  103: cn-bo: <BROADCAST,MULTICAST,MASTER,UP,LOWER_UP> mtu 1500 master cn-br state forwarding priority 32 cost 5 
  112: vethd8dae531@ens6: <BROADCAST,MULTICAST,UP,LOWER_UP> mtu 1500 master cn-br state forwarding priority 32 cost 2
  ```

**Comment by rrajendran17** [comment]
> [@rrajendran17](https://github.com/rrajendran17) , I tried to follow the issue description steps and your suggestion to verify this issue.
> 
> Please check the following result and feedback whether this issue have been fixed on the test environment with latest v1.8.0 master.
> 
> If the environment is not applicable, I can discuss with you later to find the suitable solution. Thanks.
> 
>     1. Check the network configuration on router (pxe_server)
> 
> 
> ```
> root@pxe-server:~# ip a
> 1: lo: <LOOPBACK,UP,LOWER_UP> mtu 65536 qdisc noqueue state UNKNOWN group default qlen 1000
>     link/loopback 00:00:00:00:00:00 brd 00:00:00:00:00:00
>     inet 127.0.0.1/8 scope host lo
>        valid_lft forever preferred_lft forever
> 2: eth0: <BROADCAST,MULTICAST,UP,LOWER_UP> mtu 1500 qdisc pfifo_fast state UP group default qlen 1000
>     link/ether 52:54:00:ff:bb:09 brd ff:ff:ff:ff:ff:ff
>     altname enp0s5
>     altname ens5
>     inet 192.168.121.94/24 brd 192.168.121.255 scope global dynamic eth0
>        valid_lft 3481sec preferred_lft 3481sec
> 3: eth1: <BROADCAST,MULTICAST,UP,LOWER_UP> mtu 1500 qdisc pfifo_fast state UP group default qlen 1000
>     link/ether 52:54:00:84:5f:98 brd ff:ff:ff:ff:ff:ff
>     altname enp0s6
>     altname ens6
>     inet 192.168.0.254/24 brd 192.168.0.255 scope global eth1
>        valid_lft forever preferred_lft forever
> 4: eth1.101@eth1: <BROADCAST,MULTICAST,UP,LOWER_UP> mtu 1500 qdisc noqueue state UP group default qlen 1000
>     link/ether 52:54:00:84:5f:98 brd ff:ff:ff:ff:ff:ff
>     inet 192.168.101.254/24 brd 192.168.101.255 scope global eth1.101
>        valid_lft forever preferred_lft forever
> ```
> 
>     2. ping from router and check arp packet on vm
>        
>        * Ping the non-exists IP from router
>        
>        ```
>        root@pxe-server:~# ping -c3 192.168.0.102
>        PING 192.168.0.102 (192.168.0.102) 56(84) bytes of data.
>        From 192.168.0.254 icmp_seq=1 Destination Host Unreachable
>        From 192.168.0.254 icmp_seq=2 Destination Host Unreachable
>        From 192.168.0.254 icmp_seq=3 Destination Host Unreachable
>        
>        --- 192.168.0.102 ping statistics ---
>        3 packets transmitted, 0 received, +3 errors, 100% packet loss, time 2045ms
>        pipe 3
>        root@pxe-server:~# ping -c3 192.168.101.100
>        PING 192.168.101.100 (192.168.101.100) 56(84) bytes of data.
>        From 192.168.101.254 icmp_seq=1 Destination Host Unreachable
>        From 192.168.101.254 icmp_seq=2 Destination Host Unreachable
>        From 192.168.101.254 icmp_seq=3 Destination Host Unreachable
>        
>        --- 192.168.101.100 ping statistics ---
>        3 packets transmitted, 0 received, +3 errors, 100% packet loss, time 2026ms
>        pipe 3
>        ```
> 
>     3. Look for ARP packets on VM
>        
>        * only VLAN 101 packet exists
>        
>         <img alt="Image" width="628" height="121" src="https://private-user-images.githubusercontent.com/29251855/537494527-b5cdf1d1-5f33-4d39-89aa-a102b169de32.png?jwt=eyJ0eXAiOiJKV1QiLCJhbGciOiJIUzI1NiJ9.eyJpc3MiOiJnaXRodWIuY29tIiwiYXVkIjoicmF3LmdpdGh1YnVzZXJjb250ZW50LmNvbSIsImtleSI6ImtleTUiLCJleHAiOjE3Njg4NDEzMTUsIm5iZiI6MTc2ODg0MTAxNSwicGF0aCI6Ii8yOTI1MTg1NS81Mzc0OTQ1MjctYjVjZGYxZDEtNWYzMy00ZDM5LTg5YWEtYTEwMmIxNjlkZTMyLnBuZz9YLUFtei1BbGdvcml0aG09QVdTNC1ITUFDLVNIQTI1NiZYLUFtei1DcmVkZW50aWFsPUFLSUFWQ09EWUxTQTUzUFFLNFpBJTJGMjAyNjAxMTklMkZ1cy1lYXN0LTElMkZzMyUyRmF3czRfcmVxdWVzdCZYLUFtei1EYXRlPTIwMjYwMTE5VDE2NDMzNVomWC1BbXotRXhwaXJlcz0zMDAmWC1BbXotU2lnbmF0dXJlPTJkNTExOTJjMTZiNDE3M2QyOTU2MTBiZGMwZDdkYzI4ZmYzYjU3Y2NkMTUzM2E2MjE0MDY0M2MzYmRhNDVkMTcmWC1BbXotU2lnbmVkSGVhZGVycz1ob3N0In0.GxH4qXudhREOL1BvaqaRlHeA3sUVqkmDE4ypc6z6HPY">
> 
>     4. check bridge config on host (node-0) where VM is running
> 
> 
> ```
> harvester-node-0:~ # bridge vlan
> port              vlan-id  
> mgmt-br           1 PVID Egress Untagged
> mgmt-bo           1 PVID Egress Untagged
> cn-bo             1 PVID Egress Untagged
>                   101
> cn-br             1 PVID Egress Untagged
> vethd8dae531      101 PVID Egress Untagged
> ```
> 
>     5. Check the "bridge link show" has just the output without "1 egress untagged"
> 
> 
> ```
> harvester-node-0:~ # bridge link show
> 10: mgmt-bo: <BROADCAST,MULTICAST,MASTER,UP,LOWER_UP> mtu 1500 master mgmt-br state forwarding priority 32 cost 100 
> 103: cn-bo: <BROADCAST,MULTICAST,MASTER,UP,LOWER_UP> mtu 1500 master cn-br state forwarding priority 32 cost 5 
> 112: vethd8dae531@ens6: <BROADCAST,MULTICAST,UP,LOWER_UP> mtu 1500 master cn-br state forwarding priority 32 cost 2
> ```

@TachunLin This looks perfect!!! Thanks for recreating the description steps.

**Comment by TachunLin** [comment]
Thanks @rrajendran17 for the confirmation.  Finalize the following test result.

Verified **fixed** on `master-0ba41d14-head` (26/01/16). Close this issue

### Result
<details><summary>$\color{green}{\textsf{PASS}}$ No vlan1 packet leak to VM, only the existing vlan network traffic $~~$</summary>

1.  Check the network configuration on router (pxe_server)
  ```
  root@pxe-server:~# ip a
  1: lo: <LOOPBACK,UP,LOWER_UP> mtu 65536 qdisc noqueue state UNKNOWN group default qlen 1000
      link/loopback 00:00:00:00:00:00 brd 00:00:00:00:00:00
      inet 127.0.0.1/8 scope host lo
         valid_lft forever preferred_lft forever
  2: eth0: <BROADCAST,MULTICAST,UP,LOWER_UP> mtu 1500 qdisc pfifo_fast state UP group default qlen 1000
      link/ether 52:54:00:ff:bb:09 brd ff:ff:ff:ff:ff:ff
      altname enp0s5
      altname ens5
      inet 192.168.121.94/24 brd 192.168.121.255 scope global dynamic eth0
         valid_lft 3481sec preferred_lft 3481sec
  3: eth1: <BROADCAST,MULTICAST,UP,LOWER_UP> mtu 1500 qdisc pfifo_fast state UP group default qlen 1000
      link/ether 52:54:00:84:5f:98 brd ff:ff:ff:ff:ff:ff
      altname enp0s6
      altname ens6
      inet 192.168.0.254/24 brd 192.168.0.255 scope global eth1
         valid_lft forever preferred_lft forever
  4: eth1.101@eth1: <BROADCAST,MULTICAST,UP,LOWER_UP> mtu 1500 qdisc noqueue state UP group default qlen 1000
      link/ether 52:54:00:84:5f:98 brd ff:ff:ff:ff:ff:ff
      inet 192.168.101.254/24 brd 192.168.101.255 scope global eth1.101
         valid_lft forever preferred_lft forever
  
  ```

2. ping from router and check arp packet on vm
   - Ping the non-exists IP from router
    ```
    root@pxe-server:~# ping -c3 192.168.0.102
    PING 192.168.0.102 (192.168.0.102) 56(84) bytes of data.
    From 192.168.0.254 icmp_seq=1 Destination Host Unreachable
    From 192.168.0.254 icmp_seq=2 Destination Host Unreachable
    From 192.168.0.254 icmp_seq=3 Destination Host Unreachable
    
    --- 192.168.0.102 ping statistics ---
    3 packets transmitted, 0 received, +3 errors, 100% packet loss, time 2045ms
    pipe 3
    root@pxe-server:~# ping -c3 192.168.101.100
    PING 192.168.101.100 (192.168.101.100) 56(84) bytes of data.
    From 192.168.101.254 icmp_seq=1 Destination Host Unreachable
    From 192.168.101.254 icmp_seq=2 Destination Host Unreachable
    From 192.168.101.254 icmp_seq=3 Destination Host Unreachable
    
    --- 192.168.101.100 ping statistics ---
    3 packets transmitted, 0 received, +3 errors, 100% packet loss, time 2026ms
    pipe 3
    ```
3. Look for ARP packets on VM
   - only VLAN 101 packet exists
    <img width="628" height="121" alt="Image" src="https://github.com/user-attachments/assets/b5cdf1d1-5f33-4d39-89aa-a102b169de32" />

4. check bridge config on host (node-0) where VM is running

  ```
  harvester-node-0:~ # bridge vlan
  port              vlan-id  
  mgmt-br           1 PVID Egress Untagged
  mgmt-bo           1 PVID Egress Untagged
  cn-bo             1 PVID Egress Untagged
                    101
  cn-br             1 PVID Egress Untagged
  vethd8dae531      101 PVID Egress Untagged
  ```

5. Check the "bridge link show" has just the output without "1 egress untagged"

  ```
  harvester-node-0:~ # bridge link show
  10: mgmt-bo: <BROADCAST,MULTICAST,MASTER,UP,LOWER_UP> mtu 1500 master mgmt-br state forwarding priority 32 cost 100 
  103: cn-bo: <BROADCAST,MULTICAST,MASTER,UP,LOWER_UP> mtu 1500 master cn-br state forwarding priority 32 cost 5 
  112: vethd8dae531@ens6: <BROADCAST,MULTICAST,UP,LOWER_UP> mtu 1500 master cn-br state forwarding priority 32 cost 2
  ```
</details>

### Test Information
* Test Environment: Single node harvester on kvm machine
* Harvester version: `master-0ba41d14-head`

### Verify Steps

<details><summary> Test environment setup: configure vlan101 on pxe_server </summary>

  1. Use ipxe-examples to provision a single node Harvester
  2. ssh to pxe server `$ vagrant ssh pxe_server` and change to root
  3. Add vlan 101 DHCP ip range in `/etc/dhcp/dhcpd.conf`
  ```
  subnet 192.168.101.0 netmask 255.255.255.0 {
      range 192.168.101.100 192.168.101.200;
      option domain-name-servers 192.168.0.254, 8.8.8.8;
  }
  ```
  ```
  ddns-update-style none;
  
  # option domain-name "example.org";
  include "/etc/dhcp/ipxe.conf";
  option arch code 93 = unsigned integer 16;
  option user-class code 77 = string;
  
  default-lease-time 600;
  max-lease-time 7200;
  authoritative;
  log-facility local7;
  
  subnet 192.168.0.0 netmask 255.255.255.0 {
      range 192.168.0.50 192.168.0.130;
      option domain-name-servers 192.168.0.254, 8.8.8.8;
          option routers 192.168.0.254;
          next-server 192.168.0.254;
  
     if exists user-class and option user-class = "iPXE" {
          filename "http://192.168.0.254/harvester/${net1/mac}";
      } elsif option arch != 00:00 {
          filename "ipxe/ipxe.efi";
      } else {
          filename "ipxe/undionly.kpxe";
      }
  }
  
  subnet 192.168.101.0 netmask 255.255.255.0 {
      range 192.168.101.100 192.168.101.200;
      option domain-name-servers 192.168.0.254, 8.8.8.8;
  }
  ```


  3. Add eth1.101 vlan

  ```
  $ ip link add link eth1 name eth1.101 type vlan id 101
  ```

  4. Assign IP to eth1.101 interface

  ```
  ip addr add 192.168.101.254/24 brd 192.168.101.255 dev eth1.101
  ```

  5. Bring up eth1.101 network

  ```
  ip link set up eth1.101
  ```

  6. Restart DHCP service

  ```
  $ systemctl restart isc-dhcp-server.service
  ```

  7. Check vlan interface ip status: `ip a`

  ```
  4: eth1.101@eth1: <BROADCAST,MULTICAST,UP,LOWER_UP> mtu 1500 qdisc noqueue state UP group default qlen 1000
      link/ether 52:54:00:5a:bd:cf brd ff:ff:ff:ff:ff:ff
      inet 192.168.101.254/24 brd 192.168.101.255 scope global eth1.101
         valid_lft forever preferred_lft forever
  ```

  8. Add `eth1.101` listening interface in `/etc/default/isc-dhcp-server`

  ```
  # On what interfaces should the DHCP server (dhcpd) serve DHCP requests?
  #       Separate multiple interfaces with spaces, e.g. "eth0 eth1".
  INTERFACESv4="eth1 eth1.101"
  ```

  9. Restart DHCP service `$ systemctl restart isc-dhcp-server.service`

  10. Back to Harvester, create a cluster network `cn`
  11. Create a network config `nc` and set an interface
  12. Create a network named vlan 101 with id 101 (use `nc`)
  13. Use Auto route

  <img width="1341" height="661" alt="Image" src="https://github.com/user-attachments/assets/a73fa905-5c9e-4dc8-b232-ca026a1b3503" />

</details>

<details><summary> No vlan1 packet leak to VM, only the existing vlan network traffic </summary>

  1. ssh to the pxe_server 
  2. ping the non-exist IP for the vlan 1 in vlan 101 subnet scope

  ```
  $ ping 192.168.0.102
  $ ping 192.168.101.102
  ```

  3.  Look for ARP packets on VM

  ```
  $ tcpdump -n arp
  ```


  4. Check only the vlan 101 subnet package received (!92.168.101.x)
  5. ssh to the harvester node where the vm created on
  6. Check the `bridge vlan show` output
  7. Check the output should not have "1 egress untagged". 




</details>
