### ISSUE TITLE
[BUG] Unable to access Node IP addresses over HTTPS on VM router in Harvester cluster v1.1.1

### ISSUE THREAD

**Issue by yaocw2020** [harvester/harvester#3960]
**Describe the bug**

In the Harvester cluster whose management network has a VLAN ID, the VM will be unable to access the host port or node port with the host IP where the VM is running.

The customer is experiencing issues accessing Node addresses over HTTPS on a VM acting as a router on a harvester cluster. The customer has tried troubleshooting steps, such as checking MTUs and firewall rules but has not resolved the issue. The customer also mentioned that the issue only started in v1.1.1. The customer needs to resolve the issue as soon as possible. 
This issue only happens when the VM is running on the node.
Example:
VM1 is running inside Node1. The VM1 can ping and ssh the Node1 but cannot https to the node address. The VM1 can access the other nodes without issues through ping, ssh, and https. 
If the customer moves VM1 to Node2, The VM1 can ping and ssh the Node2 but cannot https to the node address.

**To Reproduce**
- Create a cluster with the management network on VLAN 1001. 
- Add a VM network with VLAN 1001 to communicate from the VMs to the node.
- Attempt to access HTTPS on port 443 on the hosts or the VIP address using the VM as a router.

**Expected behavior**

The customer cannot access HTTPS on the Node address when a VM runs inside the node. To the other nodes, the HTTPS communication works fine.

**Support bundle**

**Environment**
 - Harvester ISO version:  Harvester 1.1.1
 - Underlying Infrastructure (e.g. Baremetal with Dell PowerEdge R630): Baremetal with Dell PowerEdge R630

**Additional context**

**Comment by yaocw2020** [comment]
Workaround: Execute the following command in harvester nodes.
```
sysctl -w net.bridge.bridge-nf-call-iptables=0
```
After restarting nodes, the command should be executed again.

**Comment by iosifnicolae2** [comment]
@yaocw2020 why do we have to disable bridge-nf-call-iptables? isn't this a security risk?

**Comment by iosifnicolae2** [comment]
might be related to https://rancher-users.slack.com/archives/C01GKHKAG0K/p1692691256324529

**Comment by connorkuehl** [comment]
I'm not able to sufficiently reproduce this in our lab and was wondering if any members of the community would be willing to collect some diagnostic info to help me troubleshoot the root cause to help develop a fix.

On the Harvester node that the VM tries to reach over HTTPS, disable the workaround by restoring the bridge-nf-call-iptables sysctl to 1:

```
# sysctl -w net.bridge.bridge-nf-call-iptables=1
```

Then, add tracing rules (replace $NODE_VIP with the node's VIP or HTTPS endpoint the issue reproduces with, and you can replace --dport 6443 with whatever port number the VM is trying to reach; also replace $VM_IP with the VM's IP address)

```
# iptables -t raw -A PREROUTING -p tcp --destination $NODE_VIP --dport 6443 -j TRACE
# iptables -t raw -A OUTPUT -p tcp --destination $NODE_VIP --dport 6443 -j TRACE
# iptables -t raw -A PREROUTING -p tcp --destination $VM_IP -j TRACE
# iptables -t raw -A OUTPUT -p tcp --destination $VM_IP -j TRACE
```

Now, inside their VM that is trying to reach the node it is on over HTTPS, try to reach it (again, replace NODE_VIP and 6443 accordingly):

```
$ curl --insecure https://$node_vip:6443/
```

Back to the Harvester node, there should now be iptables tracelogs in the kernel logs:

```
# dmesg -T > kernel.log
# iptables-save > iptables.txt
```

| :exclamation:  | Please attach the kernel.log and iptables.txt output for review. Alternatively, send them to `harvester-support-bundle@suse.com` and reference this GitHub issue. |
| - | - |

To reverse the modifications to the Harvester node and restore the workaround (replace $NODE_VIP and 6443 as well as VM_IP with their respective values):

```
# iptables -t raw -D PREROUTING -p tcp --destination $NODE_VIP --dport 6443 -j TRACE
# iptables -t raw -D OUTPUT -p tcp --destination $NODE_VIP --dport 6443 -j TRACE
# iptables -t raw -D PREROUTING -p tcp --destination $VM_IP -j TRACE
# iptables -t raw -D OUTPUT -p tcp --destination $VM_IP -j TRACE
# sysctl -w net.bridge.bridge-nf-call-iptables=0
```

**Comment by mingshuoqiu** [comment]
after some experiments on customer's testbed, the cause is pretty much the same as issue#4359 https://github.com/harvester/harvester/issues/4359.
The tcpdump from the downstream nodes for `curl -k` to VIP. The http(s) packet fail to be forwarded from the `mgmt-br` to the pod with the http service.
```
05:14:32.556491 vethf219c7e5 P   ifindex 60 3e:75:17:d4:db:ab ethertype IPv4 (0x0800), length 80: 10.100.1.13.45190 > 139.178.89.35.80: Flags [S], seq 3099079053, win 64240, options [mss 1460,sackOK,TS val 294234997 ecr 0,nop,wscale 7], length 0
05:14:32.556506 mgmt-br In  ifindex 4 3e:75:81:00:03:e8 ethertype IPv4 (0x0800), length 84: IP13 (invalid)
``` 

After correctly untag the packet, the packet flow seems to be correct. The packet from 10.100.1.13 to VIP will be SNAT/DNAT to 10.52.2.0 and 10.52.0.29. The ACK to the http also correctly convert back to 145.40.90.158 to 10.100.1.13. 
```
05:56:53.746783 vethf219c7e5 P   ifindex 60 3e:75:17:d4:db:ab ethertype IPv4 (0x0800), length 80: 10.100.1.13.60844 > 145.40.90.158.80: Flags [S], seq 800135625, win 64240, options [mss 1460,sackOK,TS val 353479517 ecr 0,nop,wscale 7], length 0
05:56:53.746803 mgmt-br In  ifindex 4 3e:75:17:d4:db:ab ethertype IPv4 (0x0800), length 80: 10.100.1.13.60844 > 10.52.0.29.80: Flags [S], seq 800135625, win 64240, options [mss 1460,sackOK,TS val 353479517 ecr 0,nop,wscale 7], length 0
05:56:53.746820 flannel.1 Out ifindex 11 a2:6d:c3:4c:09:20 ethertype IPv4 (0x0800), length 80: 10.52.2.0.37035 > 10.52.0.29.80: Flags [S], seq 800135625, win 64240, options [mss 1460,sackOK,TS val 353479517 ecr 0,nop,wscale 7], length 0
05:56:53.747092 flannel.1 In  ifindex 11 46:99:9e:8a:4c:ba ethertype IPv4 (0x0800), length 80: 10.52.0.29.80 > 10.52.2.0.37035: Flags [S.], seq 671964721, ack 800135626, win 64308, options [mss 1410,sackOK,TS val 331341449 ecr 353479517,nop,wscale 7], length 0
05:56:53.747109 mgmt-br Out ifindex 4 10:70:fd:86:eb:f2 ethertype IPv4 (0x0800), length 80: 145.40.90.158.80 > 10.100.1.13.60844: Flags [S.], seq 671964721, ack 800135626, win 64308, options [mss 1410,sackOK,TS val 331341449 ecr 353479517,nop,wscale 7], length 0
05:56:53.747113 mgmt-bo Out ifindex 5 10:70:fd:86:eb:f2 ethertype IPv4 (0x0800), length 80: 145.40.90.158.80 > 10.100.1.13.60844: Flags [S.], seq 671964721, ack 800135626, win 64308, options [mss 1410,sackOK,TS val 331341449 ecr 353479517,nop,wscale 7], length 0
05:56:53.747117 enp1s0f0np0 Out ifindex 2 10:70:fd:86:eb:f2 ethertype IPv4 (0x0800), length 80: 145.40.90.158.80 > 10.100.1.13.60844: Flags [S.], seq 671964721, ack 800135626, win 64308, options [mss 1410,sackOK,TS val 331341449 ecr 353479517,nop,wscale 7], length 0
```

However, the downstream node doesn't seem to receive the ACK packet. I believe the ACK packet should go to the dhcpd VM (router) first, then sent back to the downstream VM. Since there's no tcpdump on the VM. I need to find out where the packet goes.

**Comment by mingshuoqiu** [comment]
Do the `ping` traffic flow for comparison
```
10:42:50.291340 vethcc2eab56 P   ifindex 69 3e:75:17:d4:db:ab ethertype IPv4 (0x0800), length 104: 10.100.1.13 > 139.178.70.55: ICMP echo request, id 10, seq 1, length 64
10:42:50.291398 vethaa4698be Out ifindex 50 3e:75:17:d4:db:ab ethertype IPv4 (0x0800), length 104: 10.100.1.13 > 139.178.70.55: ICMP echo request, id 10, seq 1, length 64
10:42:50.291402 mgmt-br P   ifindex 4 3e:75:81:00:03:e8 ethertype IPv4 (0x0800), length 108: IP13 (invalid)
10:42:50.291684 calia0c43ffb637 In  ifindex 49 2a:dd:db:e6:60:37 ethertype IPv4 (0x0800), length 104: 10.52.1.39 > 139.178.70.55: ICMP echo request, id 10, seq 1, length 64
10:42:50.291729 calia0c43ffb637 Out ifindex 49 ee:ee:ee:ee:ee:ee ethertype IPv4 (0x0800), length 104: 139.178.70.55 > 10.52.1.39: ICMP echo reply, id 10, seq 1, length 64
10:42:50.291888 vethaa4698be P   ifindex 50 da:46:88:c9:66:f6 ethertype IPv4 (0x0800), length 104: 139.178.70.55 > 10.100.1.13: ICMP echo reply, id 10, seq 1, length 64
10:42:50.291906 vethcc2eab56 Out ifindex 69 da:46:88:c9:66:f6 ethertype IPv4 (0x0800), length 104: 139.178.70.55 > 10.100.1.13: ICMP echo reply, id 10, seq 1, length 64
```
The src ip address of ping will be converted from `10.100.1.13` to `10.52.1.39`. And the ping reply will goes back to `10.52.1.39` which is then forwarded to `vethaa4698be`, the interface that `router` node is bound to. The router then forward it back to the downstream VM.
Unlike the http(s) traffic, the src ip address remains the same `10.100.1.13` and of course the default route is taken to route the packet via `mgmt-br` and `mgmt-br`. The router VM has no chance receive the packet.  

Will need to check which `iptables` rule is applied for ICMP to convert the src IP address as the next step.

**Comment by mingshuoqiu** [comment]
I can simply reproduce with 2 VMs, 1 VM as a router and the other VM route vi the 1nd VM.
disable net.bridge.bridge-nf-call-iptables can workaround the issue.
The packet should flow between `veth` interfaces which belongs to the router VM, but it goes to the outbond uplink interface of the Host.
There's should be some iptables rule which is not applied correctly.

**Comment by mingshuoqiu** [comment]
The successful icmp packet flow as below. `veth5a4d806b` --> `veth728b32f4` (router VM) --> `mgmt-br` --> `cali086e8302e59` (pod) --> `veth728b32f4` (router VM) --> `veth5a4d806b`
```
13:18:32.564932 veth5a4d806b P   ifindex 73 5e:01:b0:d6:af:cb ethertype IPv4 (0x0800), length 104: 10.100.0.10 > 172.24.1.92: ICMP echo request, id 11, seq 1, length 64
13:18:32.564956 veth728b32f4 Out ifindex 71 5e:01:b0:d6:af:cb ethertype IPv4 (0x0800), length 104: 10.100.0.10 > 172.24.1.92: ICMP echo request, id 11, seq 1, length 64
13:18:32.564958 mgmt-br P   ifindex 3 5e:01:b0:d6:af:cb ethertype IPv4 (0x0800), length 104: 10.100.0.10 > 172.24.1.92: ICMP echo request, id 11, seq 1, length 64
13:18:32.565121 cali086e8302e59 In  ifindex 70 42:3b:81:8d:05:d3 ethertype IPv4 (0x0800), length 104: 10.52.0.145 > 172.24.1.92: ICMP echo request, id 11, seq 1, length 64
13:18:32.565141 cali086e8302e59 Out ifindex 70 ee:ee:ee:ee:ee:ee ethertype IPv4 (0x0800), length 104: 172.24.1.92 > 10.52.0.145: ICMP echo reply, id 11, seq 1, length 64
13:18:32.565189 veth728b32f4 P   ifindex 71 12:38:94:b4:26:ac ethertype IPv4 (0x0800), length 104: 172.24.1.92 > 10.100.0.10: ICMP echo reply, id 11, seq 1, length 64
13:18:32.565196 veth5a4d806b Out ifindex 73 12:38:94:b4:26:ac ethertype IPv4 (0x0800), length 104: 172.24.1.92 > 10.100.0.10: ICMP echo reply, id 11, seq 1, length 64
13:18:32.565198 mgmt-br P   ifindex 3 12:38:94:b4:26:ac ethertype IPv4 (0x0800), length 104: 172.24.1.92 > 10.100.0.10: ICMP echo reply, id 11, seq 1, length 64
```

The problematic http request. `veth5a4d806b` --> `mgmt-br` --> `cali52fc792576c` --> `mgmt-br`. There's no way back to `veth5a4d806b` since the destination VIP will lead to default route and go to `mgmt-bo` then uplink interface to external network.

The http request with `net.bridge.bridge-nf-call-iptables=0`
`veth5a4d806b` --> `veth728b32f4` (router VM) --> `mgmt-br` --> `cali086e8302e59` --> `cali52fc792576c` --> `veth728b32f4` (router VM) --> `veth5a4d806b`. In this case, since the `iptables` is not involved, the packet is not DNAT directly from 172.24.1.92 to 10.52.0.93, but simply forwarded to the router VM by the destination MAC belongs to router.
```
04:30:00.432956 veth5a4d806b P   ifindex 73 5e:01:b0:d6:af:cb ethertype IPv4 (0x0800), length 80: 10.100.0.10.36392 > 172.24.1.92.80: Flags [S], seq 1696852086, win 64240, options [mss 1460,sackOK,TS val 3355394475 ecr 0,nop,wscale 7], length 0
04:30:00.432961 veth728b32f4 Out ifindex 71 5e:01:b0:d6:af:cb ethertype IPv4 (0x0800), length 80: 10.100.0.10.36392 > 172.24.1.92.80: Flags [S], seq 1696852086, win 64240, options [mss 1460,sackOK,TS val 3355394475 ecr 0,nop,wscale 7], length 0
04:30:00.432964 mgmt-br P   ifindex 3 5e:01:81:00:03:e8 ethertype IPv4 (0x0800), length 84: IP10 (invalid)
04:30:00.433279 cali086e8302e59 In  ifindex 70 42:3b:81:8d:05:d3 ethertype IPv4 (0x0800), length 80: 10.52.0.145.36392 > 172.24.1.92.80: Flags [S], seq 1696852086, win 64240, options [mss 1460,sackOK,TS val 3355394475 ecr 0,nop,wscale 7], length 0
04:30:00.433314 cali52fc792576c Out ifindex 15 ee:ee:ee:ee:ee:ee ethertype IPv4 (0x0800), length 80: 172.24.1.90.46390 > 10.52.0.93.80: Flags [S], seq 1696852086, win 64240, options [mss 1460,sackOK,TS val 3355394475 ecr 0,nop,wscale 7], length 0
04:30:00.433334 cali52fc792576c In  ifindex 15 5e:7d:1b:03:53:ab ethertype IPv4 (0x0800), length 80: 10.52.0.93.80 > 172.24.1.90.46390: Flags [S.], seq 1921673182, ack 1696852087, win 64308, options [mss 1410,sackOK,TS val 1269364239 ecr 3355394475,nop,wscale 7], length 0
04:30:00.433342 cali086e8302e59 Out ifindex 70 ee:ee:ee:ee:ee:ee ethertype IPv4 (0x0800), length 80: 172.24.1.92.80 > 10.52.0.145.36392: Flags [S.], seq 1921673182, ack 1696852087, win 64308, options [mss 1410,sackOK,TS val 1269364239 ecr 3355394475,nop,wscale 7], length 0
04:30:00.433435 veth728b32f4 P   ifindex 71 12:38:94:b4:26:ac ethertype IPv4 (0x0800), length 80: 172.24.1.92.80 > 10.100.0.10.36392: Flags [S.], seq 1921673182, ack 1696852087, win 64308, options [mss 1410,sackOK,TS val 1269364239 ecr 3355394475,nop,wscale 7], length 0
04:30:00.433439 veth5a4d806b Out ifindex 73 12:38:94:b4:26:ac ethertype IPv4 (0x0800), length 80: 172.24.1.92.80 > 10.100.0.10.36392: Flags [S.], seq 1921673182, ack 1696852087, win 64308, options [mss 1410,sackOK,TS val 1269364239 ecr 3355394475,nop,wscale 7], length 0
```

That's said, the iptables rules introduced by `net.bridge.bridge-nf-call-iptables` will cause confusion in this case. The host's iptables rule does not know the packet generated behind another router should be leave as-is first. It takes place too early and compromise the whole routing path.

Thus...disabling  `net.bridge.bridge-nf-call-iptables` should be the simplest way to fix it.....

**Comment by mingshuoqiu** [comment]
Need the https://github.com/harvester/network-controller-harvester/pull/83 to be approved. We may need to evaluate the risk first.

**Comment by yaocw2020** [comment]
I have written a document before to explain the case. Please refer to [Harvester-SNAT-problem.md](https://gist.github.com/yaocw2020/c135c9dc313334d52739eac48a16e664#file-harvester-snat-problem-md). @mingshuoqiu @iosifnicolae2 @connorkuehl

**Comment by mingshuoqiu** [comment]
The solution in https://github.com/harvester/network-controller-harvester/pull/119 
 doesn't fix the issue and introduce another https://github.com/harvester/harvester/issues/6747. Need to fix it for the issue.

**Comment by TachunLin** [comment]
As per discussed, we have the following test plan

#### Environment:
1. Multiple nodes Harvester cluster (not mandatory to have vlan on management network)

#### Test scenarios:
1. Create virtual machine `vm1` on `node1` with management network, try to access port 443 and 80 on `node1` from `vm1`
2. `vm1` should still can access port 443 and 80 on other nodes
3. Migrate `vm1` to `node2`, try to access 443 and 80 on `node2` from `vm1` 
4. After migration `vm1` can still access port on other nodes
5. Reboot the current node where vm1 located on it, check can access specific port on `node1` after reboot.
6. Upgrade from v1.3.2 to v1.4-head, and check test scenarios 1 - 4

**Comment by TachunLin** [comment]
Verified **failed** on `v1.4-d57f2aec-head` (24/11/25). Move to implement

### Result
<details><summary>$\color{green}{\textsf{PASS}}$ Access <strong>node2</strong> port 443 and 80 from <strong>vm1</strong>, where vm1 originally located on <strong>node2</strong> $~~$</summary>

* Originally located in node2
  ![image](https://github.com/user-attachments/assets/c9b114e0-226a-4ef4-91f7-675f97200c1a)
  ![image](https://github.com/user-attachments/assets/96a14356-600e-4233-9981-bce411499cc7)

* Can access port 443 and 80 on node2
  ```
  opensuse@vm1:~> curl 10.115.252.33:443
  <html>
  <head><title>400 The plain HTTP request was sent to HTTPS port</title></head>
  <body>
  <center><h1>400 Bad Request</h1></center>
  <center>The plain HTTP request was sent to HTTPS port</center>
  <hr><center>nginx</center>
  </body>
  </html>
  opensuse@vm1:~> curl 10.115.252.33:80
  <a href="https://10.115.252.33/">Found</a>.
  
  ```

 </details>

<details><summary>$\color{green}{\textsf{PASS}}$ Access <strong>node1</strong> port 443 and 80 from <strong>vm1</strong>, where vm1 originally located on <strong>node2</strong> $~~$</summary>

* Can access port 443 and 80 on node1
  ```
  opensuse@vm1:~> curl 10.115.252.28:443
  <html>
  <head><title>400 The plain HTTP request was sent to HTTPS port</title></head>
  <body>
  <center><h1>400 Bad Request</h1></center>
  <center>The plain HTTP request was sent to HTTPS port</center>
  <hr><center>nginx</center>
  </body>
  </html>
  opensuse@vm1:~> curl 10.115.252.28:80
  <a href="https://10.115.252.28/">Found</a>.
  ```

 </details>

<details><summary>$\color{red}{\textsf{Failed}}$ Migrate <strong>vm1</strong> to <strong>node1</strong>, can't access <strong>node1</strong> port 443 and 80 $~~$</summary>

* Migrate from node2 to node1
  ![image](https://github.com/user-attachments/assets/3a41271d-cdd2-4df9-b8ef-cb50144b4ecd)
  ![image](https://github.com/user-attachments/assets/5afefd97-3f25-4cff-a0f2-69310f3738e1)


* After vm1 with vlan network 2021 and migrate to `node1`, failed to access port 443 and 80 on `node1`

  ```
  opensuse@vm1:~> curl 10.115.252.28:443
  ^C
  opensuse@vm1:~> curl 10.115.252.28:80
  ^C
  
  ```

* Support bundle
[supportbundle_a2edf2e7-bc28-467e-87bc-944ade545d31_2024-11-25T15-27-08Z.zip](https://github.com/user-attachments/files/17905154/supportbundle_a2edf2e7-bc28-467e-87bc-944ade545d31_2024-11-25T15-27-08Z.zip)

 </details>

<details><summary>$\color{green}{\textsf{PASS}}$ Migrate <strong>vm1</strong> to <strong>node1</strong>, and access <strong>node2</strong> port 443 and 80 $~~$</summary>


* Can access port 443 and 80 on node2

  ```
  opensuse@vm1:~> curl 10.115.252.33:443
  <html>
  <head><title>400 The plain HTTP request was sent to HTTPS port</title></head>
  <body>
  <center><h1>400 Bad Request</h1></center>
  <center>The plain HTTP request was sent to HTTPS port</center>
  <hr><center>nginx</center>
  </body>
  </html>
  opensuse@vm1:~> curl 10.115.252.33:80
  <a href="https://10.115.252.33/">Found</a>.
  ```

 </details>


<details><summary>$\color{red}{\textsf{Failed}}$ After rebooting node machine, can't access <strong>current</strong> node's port 443 and 80 $~~$</summary>

* Currently vm2 located on node2

  ![image](https://github.com/user-attachments/assets/da84ce00-b76a-4d69-90d4-9a9d445944a9)


* After reboot, vm2 would move to node1

  ![image](https://github.com/user-attachments/assets/c12b2ac3-8a60-4cb6-9dc6-b643ff22fb2b)


* Can't access port 443 and 80 on `node1` from `vm1`

  ```
  opensuse@vm2:~> curl 10.115.252.28:443
  ^C
  opensuse@vm2:~> curl 10.115.252.28:80
  ^C
  ```

* Support bundle
[supportbundle_a2edf2e7-bc28-467e-87bc-944ade545d31_2024-11-25T15-27-08Z.zip](https://github.com/user-attachments/files/17905154/supportbundle_a2edf2e7-bc28-467e-87bc-944ade545d31_2024-11-25T15-27-08Z.zip)


 </details>


<details><summary>$\color{green}{\textsf{PASS}}$ After rebooting node machine, can access <strong>other</strong> node's port 443 and 80 $~~$</summary>


* Can access port 443 and 80 on `node2` from `vm1`

  ```
  opensuse@vm1:~> curl 10.115.252.33:443
  <html>
  <head><title>400 The plain HTTP request was sent to HTTPS port</title></head>
  <body>
  <center><h1>400 Bad Request</h1></center>
  <center>The plain HTTP request was sent to HTTPS port</center>
  <hr><center>nginx</center>
  </body>
  </html>
  opensuse@vm1:~> curl 10.115.252.33:80
  <a href="https://10.115.252.33/">Found</a>.
  ```

 </details>
 
<details><summary>$\color{green}{\textsf{PASS}}$ After upgrade to v1.4-head, can access the current node's port 443 and 80 $~~$</summary>

* On v1.3.2, create a vm with vlan network 2021, can't access port 443 and 80 on the current node 
  ![image](https://github.com/user-attachments/assets/8b191b9d-9cb4-4ab3-8231-375f4999c7ff)

  ```
  opensuse@vm132:~> curl 10.115.252.33:443
  ^C
  opensuse@vm132:~> curl 10.115.252.33:80
  ```

* After successfully upgrade to v1.4-head
![image](https://github.com/user-attachments/assets/d38beb10-d9ed-42da-88bb-bc20227d3ad8)

* Can access port 443 and 80 on the current `node1` from `vm1`
```
opensuse@vm132:~> curl 10.115.252.28:443
<html>
<head><title>400 The plain HTTP request was sent to HTTPS port</title></head>
<body>
<center><h1>400 Bad Request</h1></center>
<center>The plain HTTP request was sent to HTTPS port</center>
<hr><center>nginx</center>
</body>
</html>
opensuse@vm132:~> curl 10.115.252.28:80
<a href="https://10.115.252.28/">Found</a>.


```
 </details>

<details><summary>$\color{green}{\textsf{PASS}}$ After upgrade to v1.4-head, create a new `vm140` can access the current node's port 443 and 80 $~~$</summary>



* After successfully upgrade to v1.4-head


* Create a new VM `vm140`

  ![image](https://github.com/user-attachments/assets/d53167ef-7a5f-4d60-9119-4f49a8394966)



* Can access port 443 and 80 on the current `node1` from `vm140`

  ```
  opensuse@vm140:~> curl 10.115.252.33:443
  <html>
  <head><title>400 The plain HTTP request was sent to HTTPS port</title></head>
  <body>
  <center><h1>400 Bad Request</h1></center>
  <center>The plain HTTP request was sent to HTTPS port</center>
  <hr><center>nginx</center>
  </body>
  </html>
  opensuse@vm140:~> curl 10.115.252.33:80
  <a href="https://10.115.252.33/">Found</a>.
  ```


 </details>


### Test Information
* Test Environment: Two nodes bare-metal machines
* VLAN id: 2021
* Harvester version: `v1.4-d57f2aec-head` (24/11/25)

### Verify Steps
<details><summary>Access node port 443 and 80 from vm on the same node </summary>

  1. Prepare two nodes Harvester which management interface set to VLAN ID 
  2. Created two nodes Harvester 
    ![image](https://github.com/user-attachments/assets/cb1f532c-3f07-4035-9b87-046514528a7b)

  3. Create a vm network `vlan2021` with vlan id 2021
  
  ![image](https://github.com/user-attachments/assets/b6d1a2ec-9160-4bda-9b63-0e37cd25f317)
  ![image](https://github.com/user-attachments/assets/a56f38e6-fa20-4a0d-93c8-cf835c2c974f)

  4. Create vm1 on management interface or vlan2021 network
  ![image](https://github.com/user-attachments/assets/dfde1362-4060-4ce7-82af-50494ab2cfbc)
  ![image](https://github.com/user-attachments/assets/fed1ef6b-bcad-4ad2-86dc-3cc684bf1040)


  5. Check which node the vm located on (e.g node2)
  
  ![image](https://github.com/user-attachments/assets/8350c3cd-45ff-4eac-8e6a-002ec00210c0)

  6. ssh to vm1 
  7. Access node 2 port 443 and 80 with curl command
  ```
  $ curl node-ip:443
  $ curl node-ip:80
  ```
  8. Access node 1 port 443 and 80 with curl command
  9. Check can get response from port 443 and 80 
</details>

<details><summary>After migrate vm, access node port 443 and 80 from vm on the same node </summary>

  1. Prepare two nodes Harvester which management interface set to VLAN ID 
  2. Created two nodes Harvester 
    ![image](https://github.com/user-attachments/assets/cb1f532c-3f07-4035-9b87-046514528a7b)

  3.  Create vm1 on management interface
  ![image](https://github.com/user-attachments/assets/dfde1362-4060-4ce7-82af-50494ab2cfbc)

  4. Check which node the vm located on (e.g node2)
  5. Migrate vm1 to node1
  6. ssh to vm1 
  7. Access node 1 port 443 and 80 with curl command
  ```
  $ curl node-ip:443
  $ curl node-ip:80
  ```
  8. Access node 2 port 443 and 80 with curl command
  10. Check can get response from port 443 and 80 
</details>


<details><summary>Reboot node, access node port 443 and 80 from vm on the same node </summary>

  1. Prepare two nodes Harvester which management interface set to VLAN ID 
  2. Created two nodes Harvester 
    ![image](https://github.com/user-attachments/assets/cb1f532c-3f07-4035-9b87-046514528a7b)

  3.  Create vm1 on management interface
  ![image](https://github.com/user-attachments/assets/dfde1362-4060-4ce7-82af-50494ab2cfbc)

  4. Check which node the vm located on (e.g node2)
  5. Reboot node2 machine
  6. ssh to vm1 after reboot complete
  7. Access node 2 port 443 and 80 with curl command
  ```
  $ curl node-ip:443
  $ curl node-ip:80
  ```
  8. Access node 1 port 443 and 80 with curl command
  9. Check can get response from port 443 and 80 
</details>


<details><summary>Upgrade to v1.4-head, can access node port 443 and 80 from vm on the same node </summary>

  1. Prepare two nodes Harvester which management interface set to VLAN ID 
  2. Created two nodes Harvester v1.3.2
    ![image](https://github.com/user-attachments/assets/cb1f532c-3f07-4035-9b87-046514528a7b)

  3. Create a new cluster network vlan2021 and set to vlan id 2021 
  4. Create `vm132` on the vm network vlan2021 interface
  ![image](https://github.com/user-attachments/assets/6c49a48f-d344-40a4-8ac8-3465661feb17)

  5. Check which node the vm located on (e.g node2)
  6. Check should failed to access port 443 and 80 from vm1 node2
  7. Upgrade from v1.3.2 to v1.4-head
  8. After upgrade complete, ssh to `vm132` 
  9. Access node 2 port 443 and 80 with curl command
  ```
  $ curl node-ip:443
  $ curl node-ip:80
  ```
  11. Access node 1 port 443 and 80 with curl command
  12. Check can get response from port 443 and 80
  13. Create a new vm140 on node1
  14.  ssh to the vm140
  15.  Access node 1 port 443 and 80 with curl command
  16. Check can get response from port 443 and 80
</details>

**Comment by mingshuoqiu** [comment]
The `net.bridge.bridge-nf-call-iptables` will be toggled back to 1 after restart `rke2`. Need to monitor and toggle it back

**Comment by innobead** [comment]
> The `net.bridge.bridge-nf-call-iptables` will be toggled back to 1 after restart `rke2`. Need to monitor and toggle it back

Failed - Migrate vm1 to node1, can't access node1 port 443 and 80 
Failed - After rebooting node machine, can't access current node's port 443 and 80 

@mingshuoqiu there are two failed cases here. The second is related to node reboot. How about the first failed case?

**Comment by bk201** [comment]
@mingshuoqiu Is the failed case also caused by rke2 restart?
> (Failed) Migrate vm1 to node1, can't access node1 port 443 and 80

**Comment by mingshuoqiu** [comment]
Just confirmed that the VM migration (caused by reboot and manual operation) is caused by the RKE2 restart. It will be fixed by https://github.com/harvester/harvester-installer/pull/884

**Comment by TachunLin** [comment]
Close this issue since we can track the rke2 restart behavior in issue #7041
