### ISSUE TITLE
[BUG] Cannot access Harvester VIP (UI/API) from within Harvester VM 

### ISSUE THREAD

**Issue by ganawaj** [harvester/harvester#5757]
**Describe the bug**
The Harvester VIP doesn't return HTTP/S requests for the API or UI from any VM within harvester. 

**To Reproduce**
This is a single node cluster (10.4.0.51) with a VIP (10.4.0.50). I've create a L2VLAN VM Network (vlan404) attached to the default mgmt Cluster Network. 

When a new VM is created in this VM Network, or any, I can ping the VIP but cannot access the API from within it. 

```
*   Trying 10.4.0.50:80...
* connect to 10.4.0.50 port 80 failed: Connection timed out
* Failed to connect to 10.4.0.50 port 80 after 131181 ms: Connection timed out
* Closing connection 0
curl: (28) Failed to connect to 10.4.0.50 port 80 after 131181 ms: Connection timed out
```

From the host, I see traffic is reaching it, but nothing is returned back. 
```
sudo tcpdump -i any | grep 10.4.4.141
...
22:15:41.373535 veth18cedfbd P   IP 10.4.4.141.53916 > 10.4.0.50.http: Flags [S], seq 4071732315, win 64240, options [mss 1460,sackOK,TS val 2754766861 ecr 0,nop,wscale 7], length 0
22:15:43.389515 veth18cedfbd P   IP 10.4.4.141.53916 > 10.4.0.50.http: Flags [S], seq 4071732315, win 64240, options [mss 1460,sackOK,TS val 2754768877 ecr 0,nop,wscale 7], length 0
...
```

This is what ICMP looks like, no issues. I also have no issues using SSH to the VIP or host from within the VM. 
```
22:07:11.798616 veth18cedfbd P   IP 10.4.4.141 > 10.4.0.50: ICMP echo request, id 2, seq 1, length 64
22:07:11.798674 eno3  In  IP 10.4.4.141 > 10.4.0.50: ICMP echo request, id 2, seq 1, length 64
22:07:11.798675 mgmt-bo In  IP 10.4.4.141 > 10.4.0.50: ICMP echo request, id 2, seq 1, length 64
22:07:11.798683 mgmt-br In  IP 10.4.4.141 > 10.4.0.50: ICMP echo request, id 2, seq 1, length 64
22:07:11.798714 mgmt-br Out IP 10.4.0.50 > 10.4.4.141: ICMP echo reply, id 2, seq 1, length 64
22:07:11.798716 mgmt-bo Out IP 10.4.0.50 > 10.4.4.141: ICMP echo reply, id 2, seq 1, length 64
22:07:11.798718 eno3  Out IP 10.4.0.50 > 10.4.4.141: ICMP echo reply, id 2, seq 1, length 64
```

**Expected behavior**

**Support bundle**

[supportbundle_120512d8-5d97-44bf-a20a-a67dc621f722_2024-05-07T22-11-05Z.zip](https://github.com/harvester/harvester/files/15241590/supportbundle_120512d8-5d97-44bf-a20a-a67dc621f722_2024-05-07T22-11-05Z.zip)

**Environment**
 - Harvester ISO version: 
 - Underlying Infrastructure: Single baremetal host, no VLAN on default mgmt interface.

**Comment by ganawaj** [comment]
Closing this issue becuase it was either fixed in 1.3.1 or my configuration was broken - it's no longer an issue.
