### ISSUE TITLE
[FEATURE] Support Layer 3 connectivity on user defined cluster network to act as underlay

### ISSUE THREAD

**Issue by rrajendran17** [harvester/harvester#7834]
**Is your enhancement request related to a problem? Please describe.**

When using kubeovn, underlay Layer 3 connectivity is required for communication between VMs running on different nodes.
**Currently Harvester has IP addresses configured only on mgmt interfaces, so kubeovn uses the mgmt-bo as underlay for communication between VMs running on different nodes.
Using same physical nic/nics part of mgmt-bo for VM traffic will impose traffic overhead as there is no segregation of VM traffic on a separate physical link.**

**Describe the solution you'd like**
Allow configuration of IP Addresses on user configured cluster networks and utilising them as underlay for Layer 3 connectivity between nodes when using kubeovn

1.Create a cluster network
2.Create a vlanconfig spanning all nodes and select uplink
3.Allow users to provide ip range for underlay for the cluster network.
4.IP addresses must be assigned from the ip range to all the nodes in the cluster.
5.Allow users to select the user configured cluster network for the VM attached NAD and tweak kubeovn to use the user selected cluster network when using vxlan or communication between VMs running on different nodes.
(This has to be tested for feasibility)

By default br-int ovs bridge using mgmt-bo is used as ovs bridge for underlay connectivity

With this enhancement/feature, ovs bridge must be created for every user defined cluster network and vswitches/VMs lports must be attached to these ovs bridges based on the cluster network user defines for the NAD/subnet

**Comment by rrajendran17** [comment]
How to achieve an underlay on different interface other than mgmt when using vxlan with kubeovn

```
1.Create a cluster network cluster-1 and network config under it
2.Create a vm network 2013 under cluster-1
3.Create vlan L3 interface on all the 3 nodes in the cluster
vxlan-dev-1:

sudo ip link add link cluster-1-bo name br.2013 type vlan id 2013
sudo ip link set br.2013 up
sudo ip address add 10.115.18.10/21 dev br.2013


vxlan-dev-2

sudo ip link add link cluster-1-bo name br.2013 type vlan id 2013
sudo ip link set br.2013 up
sudo ip address add 10.115.18.11/21 dev br.2013

vxlan-dev-3


sudo ip link add link cluster-1-bo name br.2013 type vlan id 2013
sudo ip link set br.2013 up
sudo ip address add 10.115.18.12/21 dev br.2013

4.Verify ping is successful between all three nodes using the new underlay ip address
  10.115.16.0/21 network

5.Modify the following node annotations on all 3 nodes in the cluster to use the new underlay interface

ovn.kubernetes.io/tunnel_interface: br.2013

6.login into the ovs pod running on each node and check "ovs-vsctl show" which shows br-int, the default ovs bridge has vxlan remote end points pointing to new underlay IPs.
vxlan-dev-1:/kube-ovn$ ovs-vsctl show
d9687ea7-7ca2-4c7b-9278-c1e8a9160d32
    Bridge br-int
        fail_mode: secure
        datapath_type: system
        Port ovn0
            Interface ovn0
                type: internal
        Port ovn-3c2f05-0
            Interface ovn-3c2f05-0
                type: vxlan
                options: {csum="true", key=flow, remote_ip="10.115.18.12"}
        Port br-int
            Interface br-int
                type: internal
        Port ovn-433f32-0
            Interface ovn-433f32-0
                type: vxlan
                options: {csum="true", key=flow, remote_ip="10.115.18.11"}
        Port "14960_37a8eec_h"
            Interface "14960_37a8eec_h"
        Port mirror0
            Interface mirror0
                type: internal
    ovs_version: "3.3.4"


nobody@vxlan-dev-2:/kube-ovn$ ovs-vsctl show
50f8078c-6453-480c-abd9-6adfaaa237ad
    Bridge br-int
        fail_mode: secure
        datapath_type: system
        Port ovn0
            Interface ovn0
                type: internal
        Port mirror0
            Interface mirror0
                type: internal
        Port br-int
            Interface br-int
                type: internal
        Port ovn-1c5e11-0
            Interface ovn-1c5e11-0
                type: vxlan
                options: {csum="true", key=flow, remote_ip="10.115.18.10"}
        Port "2fe53_37a8eec_h"
            Interface "2fe53_37a8eec_h"
        Port ovn-3c2f05-0
            Interface ovn-3c2f05-0
                type: vxlan
                options: {csum="true", key=flow, remote_ip="10.115.18.12"}
    ovs_version: "3.3.4"

7.Create two VMs in subnet attached to a vswitch using kubeovn and ping between them
   The following packet captures shows that it is using the new underlay network for vxlan.
00:31:19.224550 IP 10.115.18.10.60237 > 10.115.18.11.vxlan: VXLAN, flags [I] (0x08), vni 12293
IP 172.20.10.13 > 172.20.10.3: ICMP echo request, id 2, seq 1, length 64
        0x0000:  8cdc d4b5 7e41 8cdc d4b5 ec09 8100 07dd
        0x0010:  0800 4500 0086 f592 4000 4011 0bda 0a73
        0x0020:  120a 0a73 120b eb4d 12b5 0072 397e 0800
        0x0030:  0000 0030 0500 b2a2 ca78 2b02 2ee5 3879 
        0x0040:  7ce7 0800 4500 0054 d126 4000 4001 fd49
        0x0050:  ac14 0a0d ac14 0a03 0800 36e2 0002 0001
        0x0060:  56fb 1b68 0000 0000 83e4 0c00 0000 0000
        0x0070:  1011 1213 1415 1617 1819 1a1b 1c1d 1e1f 
        0x0080:  2021 2223 2425 2627 2829 2a2b 2c2d 2e2f
        0x0090:  3031 3233 3435 3637 
00:31:19.225792 IP 10.115.18.11.56845 > 10.115.18.10.vxlan: VXLAN, flags [I] (0x08), vni 40965
IP 172.20.10.3 > 172.20.10.13: ICMP echo reply, id 2, seq 1, length 64
        0x0000:  8cdc d4b5 ec09 8cdc d4b5 7e41 8100 07dd 
        0x0010:  0800 4500 0086 3cc0 4000 4011 c4ac 0a73
        0x0020:  120b 0a73 120a de0d 12b5 0072 3349 0800
        0x0030:  0000 00a0 0500 2ee5 3879 7ce7 b2a2 ca78
        0x0040:  2b02 0800 4500 0054 5e97 0000 4001 afd9
        0x0050:  ac14 0a03 ac14 0a0d 0000 3ee2 0002 0001 
        0x0060:  56fb 1b68 0000 0000 83e4 0c00 0000 0000
        0x0070:  1011 1213 1415 1617 1819 1a1b 1c1d 1e1f
        0x0080:  2021 2223 2425 2627 2829 2a2b 2c2d 2e2f
        0x0090:  3031 3233 3435 3637 
```

**Comment by rrajendran17** [comment]
We can add a generic feature to harvester, where user could select yes/no under NAD/VM Network in UI to create a L3 interface on the Harvester node and if selected yes, network controller can create a vlan L3 interface on the host attaching to the cluster network and assign ip address from the allocated CIDR from that vlan.This should also be updated to the /oem/90_custom.yaml to persist across reboots

**Comment by rrajendran17** [comment]
```
Steps to create a pure underlay:

Usecase: By using kubeovn, traffic between VMs within the cluster will always be encapsulated.
                so to adhere to usecase where traffic must be just plain IP, kubeovn has a concept of provider and vlan networks.

Provider Network - creates a new ovs bridge and adds the physical port to the bridge
                
apiVersion: kubeovn.io/v1
kind: ProviderNetwork
metadata:
  name: pn1
spec:
  defaultInterface: eno50

Vlan Network: The vlan id by VM Networks attached to the provider network

apiVersion: kubeovn.io/v1
kind: Vlan
metadata:
  name: vlan2013
spec:
  id: 2013
  provider: pn1

Subnet: Subnets are virtual switches used by VMs which maps the above vlan network

apiVersion: kubeovn.io/v1
kind: Subnet
metadata:
   name: subnetvlan
spec:
   protocol: IPv4
   provider: vswitch6.default.ovn
   cidrBlock: 10.115.16.0/21
   gateway: 10.115.23.254
   disableGatewayCheck: true
   excludeIps:
   - 10.115.16.1
   - 10.115.23.254
   vlan: vlan2013

Network Attachment definition: Used by VMs with type kube-ovn to attach interfaces.
vswitch6 created for subnet "subnetvlan" to use

kubectl get provider-network
NAME   DEFAULTINTERFACE   READY
pn1    eno50              true

vxlan-dev-1:~ # kubectl get vlan
NAME    ID    PROVIDER
vlan1   0     pn1


kubectl get subnet subnetvlan -o yaml
apiVersion: kubeovn.io/v1
kind: Subnet
metadata:
  annotations:
    kubectl.kubernetes.io/last-applied-configuration: |
      {"apiVersion":"kubeovn.io/v1","kind":"Subnet","metadata":{"annotations":{},"name":"subnetvlan"},"spec":{"cidrBlock":"10.115.18.0/21","gateway":"10.115.23.254","protocol":"IPv4","provider":"vswitch6.default.ovn","vlan":"vlan1"}}
  creationTimestamp: "2025-05-08T17:25:00Z"
  finalizers:
  - kubeovn.io/kube-ovn-controller
  generation: 2
  name: subnetvlan
  resourceVersion: "55666366"
  uid: cf51c480-5edb-4698-b065-9d637baafa73
spec:
  cidrBlock: 10.115.16.0/21
  default: false
  enableLb: true
  excludeIps:
  - 10.115.23.254
  gateway: 10.115.23.254
  gatewayNode: ""
  gatewayType: distributed
  natOutgoing: false
  private: false
  protocol: IPv4
  provider: vswitch6.default.ovn
  vlan: vlan1
  vpc: ovn-cluster

vxlan-dev-2:/kube-ovn$ ovs-vsctl show
50f8078c-6453-480c-abd9-6adfaaa237ad
    Bridge br-pn1
        Port br-pn1
            Interface br-pn1
                type: internal
        Port eno50
            trunks: [0]
            Interface eno50
    Bridge br-int
        fail_mode: secure
        datapath_type: system
        Port ovn0
            Interface ovn0
                type: internal
        Port ovn-1c5e11-0
            Interface ovn-1c5e11-0
                type: vxlan
                options: {csum="true", key=flow, remote_ip="10.115.18.10"}
        Port mirror0
            Interface mirror0
                type: internal
        Port br-int
            Interface br-int
                type: internal
        Port "2fe53_37a8eec_h"
            Interface "2fe53_37a8eec_h"
        Port ovn-3c2f05-0
            Interface ovn-3c2f05-0
                type: vxlan
                options: {csum="true", key=flow, remote_ip="10.115.18.12"}
    ovs_version: "3.3.4"


vxlan-dev-1:/kube-ovn$ ovs-vsctl show
d9687ea7-7ca2-4c7b-9278-c1e8a9160d32
    Bridge br-pn1
        Port br-pn1
            Interface br-pn1
                type: internal
        Port eno50
            trunks: [0]
            Interface eno50
    Bridge br-int
        fail_mode: secure
        datapath_type: system
        Port ovn-3c2f05-0
            Interface ovn-3c2f05-0
                type: vxlan
                options: {csum="true", key=flow, remote_ip="10.115.18.12"}
        Port ovn0
            Interface ovn0
                type: internal
        Port br-int
            Interface br-int
                type: internal
        Port "14960_37a8eec_h"
            Interface "14960_37a8eec_h"
        Port ovn-433f32-0
            Interface ovn-433f32-0
                type: vxlan
                options: {csum="true", key=flow, remote_ip="10.115.18.11"}
        Port mirror0
            Interface mirror0
                type: internal
    ovs_version: "3.3.4"


After creating a VMs - patch ports are created between br-int where VM interfaces are attached to the new ovs bridge created by provider network


vxlan-dev-2:/kube-ovn$ ovs-vsctl show
50f8078c-6453-480c-abd9-6adfaaa237ad
    Bridge br-pn1
        Port br-pn1
            Interface br-pn1
                type: internal
        Port patch-localnet.subnetvlan-to-br-int
            Interface patch-localnet.subnetvlan-to-br-int
                type: patch
                options: {peer=patch-br-int-to-localnet.subnetvlan}
        Port eno50
            trunks: [0, 2013]
            Interface eno50
    Bridge br-int
        fail_mode: secure
        datapath_type: system
        Port ovn0
            Interface ovn0
                type: internal
        Port ovn-1c5e11-0
            Interface ovn-1c5e11-0
                type: vxlan
                options: {csum="true", key=flow, remote_ip="10.115.18.10"}
        Port mirror0
            Interface mirror0
                type: internal
        Port br-int
            Interface br-int
                type: internal
        Port patch-br-int-to-localnet.subnetvlan
            Interface patch-br-int-to-localnet.subnetvlan
                type: patch
                options: {peer=patch-localnet.subnetvlan-to-br-int}
        Port "2fe53_37a8eec_h"
            Interface "2fe53_37a8eec_h"
        Port "1751d_37a8eec_h"
            Interface "1751d_37a8eec_h"
        Port ovn-3c2f05-0
            Interface ovn-3c2f05-0
                type: vxlan
                options: {csum="true", key=flow, remote_ip="10.115.18.12"}
    ovs_version: "3.3.4"

vxlan-dev-1:/kube-ovn$ ovs-vsctl show
d9687ea7-7ca2-4c7b-9278-c1e8a9160d32
    Bridge br-pn1
        Port eno50
            trunks: [0, 2013]
            Interface eno50
        Port br-pn1
            Interface br-pn1
                type: internal
        Port patch-localnet.subnetvlan-to-br-int
            Interface patch-localnet.subnetvlan-to-br-int
                type: patch
                options: {peer=patch-br-int-to-localnet.subnetvlan}
    Bridge br-int
        fail_mode: secure
        datapath_type: system
        Port ovn-3c2f05-0
            Interface ovn-3c2f05-0
                type: vxlan
                options: {csum="true", key=flow, remote_ip="10.115.18.12"}
        Port ovn0
            Interface ovn0
                type: internal
        Port patch-br-int-to-localnet.subnetvlan
            Interface patch-br-int-to-localnet.subnetvlan
                type: patch
                options: {peer=patch-localnet.subnetvlan-to-br-int}
        Port "8f424_37a8eec_h"
            Interface "8f424_37a8eec_h"
        Port br-int
            Interface br-int
                type: internal
        Port "14960_37a8eec_h"
            Interface "14960_37a8eec_h"
        Port ovn-433f32-0
            Interface ovn-433f32-0
                type: vxlan
                options: {csum="true", key=flow, remote_ip="10.115.18.11"}
        Port mirror0
            Interface mirror0
                type: internal
    ovs_version: "3.3.4"
nobody@vxlan-dev-1:/kube-ovn$ 

Packet capture on eno50 carries plain IP packet and not encapsulated.

18:43:04.881107 IP 10.115.16.3 > 10.115.16.2: ICMP echo request, id 1, seq 7, length 64
        0x0000:  02b3 918e bb6f d219 fdbd 0e87 8100 07dd
        0x0010:  0800 4500 0054 ffa3 4000 4001 061b 0a73
        0x0020:  1003 0a73 1002 0800 1892 0001 0007 38fb
        0x0030:  1c68 0000 0000 c52f 0600 0000 0000 1011
        0x0040:  1213 1415 1617 1819 1a1b 1c1d 1e1f 2021
        0x0050:  2223 2425 2627 2829 2a2b 2c2d 2e2f 3031
        0x0060:  3233 3435 3637
18:43:04.881381 IP 10.115.16.2 > 10.115.16.3: ICMP echo reply, id 1, seq 7, length 64
        0x0000:  d219 fdbd 0e87 02b3 918e bb6f 8100 07dd
        0x0010:  0800 4500 0054 0748 0000 4001 3e77 0a73
        0x0020:  1002 0a73 1003 0000 2092 0001 0007 38fb
        0x0030:  1c68 0000 0000 c52f 0600 0000 0000 1011
        0x0040:  1213 1415 1617 1819 1a1b 1c1d 1e1f 2021
        0x0050:  2223 2425 2627 2829 2a2b 2c2d 2e2f 3031
        0x0060:  3233 3435 3637

```

**Comment by w13915984028** [comment]
@rrajendran17 It is a great idea to re-use the current L2 network to set up the VxLan IP connectivity on each node, beside the above examples, a few other extensions are also required:

(1) Static/fixed IP setting, each endpoint is set a static IP to simplify the VxLan config.
(2) Plain IP network, in case like node from a third-party provider, the node will have a second nic, which can config an IP, but no VID.

Are those also planned? thanks.

**Comment by rrajendran17** [comment]
> [@rrajendran17](https://github.com/rrajendran17) It is a great idea to re-use the current L2 network to set up the VxLan IP connectivity on each node, beside the above examples, a few other extensions are also required:
> 
> (1) Static/fixed IP setting, each endpoint is set a static IP to simplify the VxLan config. (2) Plain IP network, in case like node from a third-party provider, the node will have a second nic, which can config an IP, but no VID.
> 
> Are those also planned? thanks.

@w13915984028 Thanks for your inputs.
Yes I think we could provide the flexibility to users via UI to configure or chose between static or DHCP, with or without vlan id.
I will come up with a HEP detailing the scenarios for review.

**Comment by laralar** [comment]
Would the Managed DHCP Allocations work for these L3 assignments ?
https://docs.harvesterhci.io/v1.5/advanced/addons/managed-dhcp

**Comment by rrajendran17** [comment]
I believe since managed dhcp feature is closely tied to VMs, we cannot use it for L3 assignments on Hosts.
@starbops can confirm this.

**Comment by starbops** [comment]
The Managed DHCP add-on is for VMs running on the VM networks backed by our current network controller implementation. Since those VM networks are merely L2 networks and we don't provide L3 capability to them, the Managed DHCP add-on has room to chime in in terms of IP address allocation.

I believe the scope of this GH issue is to bring the Kube-OVN integration work to a more versatile configuration, namely to allow those overlay networks to run on underlay networks other than the default management one. Since Kube-OVN already has a certain degree of IP allocation functionality, I guess that the Managed DHCP add-on will not provide much help. We'll keep an eye on it. Thanks for asking! @laralar

**Comment by tjjh89017** [comment]
> sudo ip link add link cluster-1-bo name br.2013 type vlan id 2013

Hi @rrajendran17 
Only one thing here, you should create VLAN interface from `cluster-1-br`, rather than `cluster-1-bo`
`cluster-1-bo` 's master is bridge already, it should not have any L3 feature on it.
If you need, you should do that in bridge itself just like mgmt-br.XXX
Otherwise, your packet flow in the kernel will be weird.

And also that may hijack all vlanXXX traffic into `cluster-1-bo.XXX` and not send them to the bridge, if there is any VM in vlanXXX, it might be a problem.

By the way, if you are trying to tcpdump or debug those things, please make sure you prevent promiscuous mode.
That definitely affect the network behavior a lot.
`tcpdump -p` with `-p`, will be a good idea.

Thanks

**Comment by rrajendran17** [comment]
This changes work on top of https://github.com/harvester/harvester/issues/8101 implementation.Will add details to the HEP of #8101

**Comment by rrajendran17** [comment]
HEP in Review https://github.com/harvester/harvester/pull/9335

**Comment by rrajendran17** [comment]
Please refer user stories and Testplan from https://github.com/harvester/harvester/blob/master/enhancements/20260304-support-user-underlay-selection.mdd for testing

**Comment by rrajendran17** [comment]
Testplan:

Creating an underlay interface and vxlan tunnel:

1.Create hostnetworkconfig with underlay true, there will be a l3 interface created and ip address configured( you can check using ip addr show)
2.Check the node annotations (kubectl get node <node-name> -o yaml)  you can check for "ovn.kubernetes.io/tunnel_interface" will be set to the interface name you have created now.
3.kubectl get pods -n kube-system | grep ovn and login into the ovs pod (kubectl exec -it <ovs...> -n kube-system -- /bin/bash
4.execute the following command "ovs-vsctl show" and it will display remote_ip, it wil point to ips configured on rest of the two nodes.(similary check on all 3 nodes)
5.ping between the ips 

Verify VM traffic over the new underlay:

1.Make sure to have kubeovn operator/addon enabled.
2.Create a VM Network with type "overlay" 
3.Create a subnet and use the overlay network created in step 2
4.Create a VM and attach to overlay network created in step 2
5.Create a VM and attach to overlay network created in step 2
6.Make sure to run those VMs on two separate nodes.
7.Ping between the VMs must be successful

Verify underlay cluster network on overlay VM Network:
1. Check if overlay network reflects the cluster network name of what is configured as underlay.

Verify Fallback:

1.Delete the hostnetworkconfig or edit the config and make underlay as false
2.The tunnel_interface on the node annotation should fall back to your harvester host mgmt interface (example if harvester host installed with mgmt.2021 for example)
and repeat step 3 to 5 (the ips will be ip on the mgmt.2021 interface)

Webhook validations:

- Webhook must reject the HostNetworkConfig with cluster network not spanning all nodes in the cluster.
  (select a cluster network for hostnetworkconfig which has vlanconfig not spanning all nodes in the cluster)
- Webhook must reject the update on HostNetworkConfig as underlay as true if another underlay already exists.
- Webhook must reject updating HostNetworkConfig used as underlay if VMs or VMIs present for overlay networks.

**Comment by WebberHuang1118** [comment]
@rrajendran17, after this ticket is addressed, will we be able to provide a Service with an IP in the storage network CIDR range, or do we need another ticket to track that requirement?

This would be the long-term solution for the share manager NFS mount point flipping issue described in [issue #10047](https://github.com/harvester/harvester/issues/10047).

cc @Vicente-Cheng @starbops

**Comment by rrajendran17** [comment]
> [@rrajendran17](https://github.com/rrajendran17), after this ticket is addressed, will we be able to provide a Service with an IP in the storage network CIDR range, or do we need another ticket to track that requirement?
> 
> This would be the long-term solution for the share manager NFS mount point flipping issue described in [issue #10047](https://github.com/harvester/harvester/issues/10047).
> 
> cc [@Vicente-Cheng](https://github.com/Vicente-Cheng) [@starbops](https://github.com/starbops)

@WebberHuang1118 The original issue which supports L3configuration on Harvester host is https://github.com/harvester/harvester/issues/8101.As per my understanding of issue #10047 we require an ipaddress for the sharemanager pod.But issue https://github.com/harvester/harvester/issues/8101 facilitates user to create an L3 interface on Harvester host and assign ipaddress to it and this could be used to connect to third-party/external storage for VMs to use storage via external network.
Also its better to create a new ticket for L3 network covering storage cases specifically so that we could add specific usecases and validate this extensively from storage point of view.

**Comment by asc5543** [comment]
## Test result
Test PASS

## Environment
* Harvester ISO version: `v1.8.0-rc4`
* Underlying Infrastructure (e.g. Baremetal with Dell PowerEdge R630): `3 node via Baremetal`

## Test Scenario
### Preparation
1. <details> <summary> Install Harvester with v1.8.0. </summary>

    <img width="1914" height="995" alt="Image" src="https://github.com/user-attachments/assets/36fa378d-2e63-4741-898b-607294a6196e" />

   </details>

1. <details> <summary> Create a cluster network</summary>

    <img width="1914" height="995" alt="Image" src="https://github.com/user-attachments/assets/976774f7-003a-4203-87c1-5ce2f80ef5b0" />

   </details>

1. <details>
   <summary> Enable kubeovn operator/addon.
   </summary>

    <img width="1914" height="995" alt="Image" src="https://github.com/user-attachments/assets/ae906336-ae86-427b-99c3-3d15ee0279e5" />

   </details>

### Creating an underlay interface and vxlan tunnel
1. <details> <summary> ✔ Create hostnetworkconfig with underlay true, there will be a l3 interface created and ip address configured( you can check using ip addr show) </summary>

    ```
    apiVersion: network.harvesterhci.io/v1beta1
    kind: HostNetworkConfig
    metadata:
      name: hostnetworkconfig1
    spec:
      underlay: true
      clusterNetwork: br-1
      vlanID: 2012
      mode: static
      ips:
        hp-119-tink-system: 192.168.1.10/24
        hp-121-tink-system: 192.168.1.11/24
        hp-131-tink-system: 192.168.1.12/24
    ```

    ```
    # kubectl create -f networkconfig.yaml 
    hostnetworkconfig.network.harvesterhci.io/hostnetworkconfig1 created

    # ip addr show
    100: br-1-br.2012@br-1-br: <BROADCAST,MULTICAST,UP,LOWER_UP> mtu 1500 qdisc noqueue state UP group default 
        link/ether aa:51:8c:a2:e6:43 brd ff:ff:ff:ff:ff:ff
        inet 192.168.1.10/24 brd 192.168.1.255 scope global br-1-br.2012
           valid_lft forever preferred_lft forever
    27: br-1-br.2012@br-1-br: <BROADCAST,MULTICAST,UP,LOWER_UP> mtu 1500 qdisc noqueue state UP group default 
        link/ether 6e:f7:01:15:9c:27 brd ff:ff:ff:ff:ff:ff
        inet 192.168.1.11/24 brd 192.168.1.255 scope global br-1-br.2012
           valid_lft forever preferred_lft forever
    33: br-1-br.2012@br-1-br: <BROADCAST,MULTICAST,UP,LOWER_UP> mtu 1500 qdisc noqueue state UP group default 
        link/ether 32:8f:39:eb:39:2c brd ff:ff:ff:ff:ff:ff
        inet 192.168.1.12/24 brd 192.168.1.255 scope global br-1-br.2012
           valid_lft forever preferred_lft forever
    ```

   </details>

1. <details> <summary> ✔ Check the node annotations (kubectl get node -o yaml) you can check for "ovn.kubernetes.io/tunnel_interface" will be set to the interface name you have created now. </summary>

    ```
    apiVersion: v1
    items:
    - apiVersion: v1
      kind: Node
      metadata:
        annotations:
          ...
          ovn.kubernetes.io/tunnel_interface: br-1-br.2012
          rke2.io/encryption-config-hash: start-fb4caf275b477e7e7817f69a5f04db8740a00da3372557efc8caa5b7be3dddb3
          rke2.io/hostname: hp-119-tink-system
          rke2.io/internal-ip: 10.115.252.82
    - apiVersion: v1
      kind: Node
      metadata:
        annotations:
          ...
          ovn.kubernetes.io/tunnel_interface: br-1-br.2012
          rke2.io/encryption-config-hash: start-fb4caf275b477e7e7817f69a5f04db8740a00da3372557efc8caa5b7be3dddb3
          rke2.io/hostname: hp-121-tink-system
          rke2.io/internal-ip: 10.115.252.83
    - apiVersion: v1
      kind: Node
      metadata:
        annotations:
          ...
          ovn.kubernetes.io/tunnel_interface: br-1-br.2012
          rke2.io/encryption-config-hash: start-fb4caf275b477e7e7817f69a5f04db8740a00da3372557efc8caa5b7be3dddb3
          rke2.io/hostname: hp-131-tink-system
          rke2.io/internal-ip: 10.115.252.88
    ```

   </details>

1. <details> <summary> ✔ kubectl get pods -n kube-system | grep ovn and login into the ovs pod (kubectl exec -it <ovs...> -n kube-system -- /bin/bash </summary>

    ```
    # kubectl exec -it ovs-ovn-k2tfl -n kube-system -- /bin/bash
    Defaulted container "openvswitch" out of: openvswitch, hostpath-init (init)
    nobody@hp-131-tink-system:/kube-ovn$ 

    # kubectl exec -it ovs-ovn-sb668 -n kube-system -- /bin/bash
    Defaulted container "openvswitch" out of: openvswitch, hostpath-init (init)
    nobody@hp-121-tink-system:/kube-ovn$
    
    # kubectl exec -it ovs-ovn-9hl6s -n kube-system -- /bin/bash
    Defaulted container "openvswitch" out of: openvswitch, hostpath-init (init)
    nobody@hp-119-tink-system:/kube-ovn$
    ```

   </details>

1. <details> <summary> ✔ execute the following command "ovs-vsctl show" and it will display remote_ip, it wil point to ips configured on rest of the two nodes.(similary check on all 3 nodes) </summary>

    ```
    $ ovs-vsctl show
    0fe623f8-16fc-461b-b4f7-2dabe0bcd1eb
        Bridge br-int
            fail_mode: secure
            datapath_type: system
            Port ovn-383db5-0
                Interface ovn-383db5-0
                    type: vxlan
                    options: {csum="true", key=flow, local_ip="192.168.1.12", remote_ip="192.168.1.11"}
            Port ovn-365e0e-0
                Interface ovn-365e0e-0
                    type: vxlan
                    options: {csum="true", key=flow, local_ip="192.168.1.12", remote_ip="192.168.1.10"}
            Port mirror0
                Interface mirror0
                    type: internal
            Port br-int
                Interface br-int
                    type: internal
            Port ovn0
                Interface ovn0
                    type: internal
        ovs_version: "3.5.3"
    
    $ ovs-vsctl show
    135958f6-2b0e-4dcf-8ca5-b157a9de8c34
        Bridge br-int
            fail_mode: secure
            datapath_type: system
            Port br-int
                Interface br-int
                    type: internal
            Port ovn-cca8d7-0
                Interface ovn-cca8d7-0
                    type: vxlan
                    options: {csum="true", key=flow, local_ip="192.168.1.10", remote_ip="192.168.1.12"}
            Port ovn-383db5-0
                Interface ovn-383db5-0
                    type: vxlan
                    options: {csum="true", key=flow, local_ip="192.168.1.10", remote_ip="192.168.1.11"}
            Port mirror0
                Interface mirror0
                    type: internal
            Port ovn0
                Interface ovn0
                    type: internal
        ovs_version: "3.5.3"
    
    $ ovs-vsctl show
    e936f0bd-f01f-4b30-a686-9fc987e5cca1
        Bridge br-int
            fail_mode: secure
            datapath_type: system
            Port br-int
                Interface br-int
                    type: internal
            Port ovn0
                Interface ovn0
                    type: internal
            Port mirror0
                Interface mirror0
                    type: internal
            Port ovn-365e0e-0
                Interface ovn-365e0e-0
                    type: vxlan
                    options: {csum="true", key=flow, local_ip="192.168.1.11", remote_ip="192.168.1.10"}
            Port ovn-cca8d7-0
                Interface ovn-cca8d7-0
                    type: vxlan
                    options: {csum="true", key=flow, local_ip="192.168.1.11", remote_ip="192.168.1.12"}
        ovs_version: "3.5.3"
    ```

   </details>

1. <details> <summary> ✔ ping between the ips </summary>

    ```
    hp-119-tink-system:~ # ping 192.168.1.11
    PING 192.168.1.11 (192.168.1.11) 56(84) bytes of data.
    64 bytes from 192.168.1.11: icmp_seq=1 ttl=64 time=0.324 ms
    64 bytes from 192.168.1.11: icmp_seq=2 ttl=64 time=0.147 ms
    64 bytes from 192.168.1.11: icmp_seq=3 ttl=64 time=0.157 ms
    64 bytes from 192.168.1.11: icmp_seq=4 ttl=64 time=0.139 ms
    --- 192.168.1.11 ping statistics ---
    4 packets transmitted, 4 received, 0% packet loss, time 3051ms
    rtt min/avg/max/mdev = 0.139/0.191/0.324/0.076 ms
    hp-119-tink-system:~ # ping 192.168.1.12
    PING 192.168.1.12 (192.168.1.12) 56(84) bytes of data.
    64 bytes from 192.168.1.12: icmp_seq=1 ttl=64 time=0.325 ms
    64 bytes from 192.168.1.12: icmp_seq=2 ttl=64 time=0.167 ms
    --- 192.168.1.12 ping statistics ---
    2 packets transmitted, 2 received, 0% packet loss, time 1020ms
    rtt min/avg/max/mdev = 0.167/0.246/0.325/0.079 ms
    
    hp-121-tink-system:~ # ping 192.168.1.10
    PING 192.168.1.10 (192.168.1.10) 56(84) bytes of data.
    64 bytes from 192.168.1.10: icmp_seq=1 ttl=64 time=0.174 ms
    64 bytes from 192.168.1.10: icmp_seq=2 ttl=64 time=0.154 ms
    --- 192.168.1.10 ping statistics ---
    2 packets transmitted, 2 received, 0% packet loss, time 1039ms
    rtt min/avg/max/mdev = 0.154/0.164/0.174/0.010 ms
    hp-121-tink-system:~ # ping 192.168.1.12
    PING 192.168.1.12 (192.168.1.12) 56(84) bytes of data.
    64 bytes from 192.168.1.12: icmp_seq=1 ttl=64 time=0.352 ms
    64 bytes from 192.168.1.12: icmp_seq=2 ttl=64 time=0.196 ms
    --- 192.168.1.12 ping statistics ---
    2 packets transmitted, 2 received, 0% packet loss, time 1050ms
    rtt min/avg/max/mdev = 0.196/0.274/0.352/0.078 ms
    
    hp-131-tink-system:~ # ping 192.168.1.10
    PING 192.168.1.10 (192.168.1.10) 56(84) bytes of data.
    64 bytes from 192.168.1.10: icmp_seq=1 ttl=64 time=0.197 ms
    64 bytes from 192.168.1.10: icmp_seq=2 ttl=64 time=0.120 ms
    --- 192.168.1.10 ping statistics ---
    2 packets transmitted, 2 received, 0% packet loss, time 1055ms
    rtt min/avg/max/mdev = 0.120/0.158/0.197/0.038 ms
    hp-131-tink-system:~ # ping 192.168.1.11
    PING 192.168.1.11 (192.168.1.11) 56(84) bytes of data.
    64 bytes from 192.168.1.11: icmp_seq=1 ttl=64 time=0.186 ms
    64 bytes from 192.168.1.11: icmp_seq=2 ttl=64 time=0.166 ms
    --- 192.168.1.11 ping statistics ---
    2 packets transmitted, 2 received, 0% packet loss, time 1061ms
    rtt min/avg/max/mdev = 0.166/0.176/0.186/0.010 ms
    ```

   </details>

### Verify VM traffic over the new underlay
1. <details>
   <summary> ✔ Make sure to have kubeovn operator/addon enabled.
   </summary>

    <img width="1914" height="995" alt="Image" src="https://github.com/user-attachments/assets/ae906336-ae86-427b-99c3-3d15ee0279e5" />

   </details>

1. <details>
   <summary> ✔ Create a VM Network with type "overlay"
   </summary>
  
    <img width="1914" height="995" alt="Image" src="https://github.com/user-attachments/assets/9a1fdfab-f3d8-4c18-bc67-b4317be537f8" />
    <img width="1914" height="995" alt="Image" src="https://github.com/user-attachments/assets/f2a8fd94-211b-4f39-be16-5b4c95ecfde4" />

   </details>

1. <details>
   <summary> ✔ Create a subnet and use the overlay network created in step 2
   </summary>

    <img width="1914" height="995" alt="Image" src="https://github.com/user-attachments/assets/d3443fe1-0c37-4c32-9a35-bfc83aa29f91" />
    <img width="1914" height="995" alt="Image" src="https://github.com/user-attachments/assets/270f4d92-04ef-48db-8990-7db2bccd0094" />

   </details>

1. <details>
   <summary> ✔ Create 2 VMs and attach to overlay network created in step 2, and make sure them are in different nodes
   </summary>

    <img width="1914" height="995" alt="Image" src="https://github.com/user-attachments/assets/ac35de10-6634-417c-b088-8af2456a6ca5" />

   </details>

1. <details>
   <summary> ✔ Ping between the VMs must be successful
   </summary>

    <img width="1914" height="995" alt="Image" src="https://github.com/user-attachments/assets/95be722e-63bb-493e-b99a-3e97d46f83ca" />

   </details>

### Verify underlay cluster network on overlay VM Network
1. <details>
   <summary> ✔ Check if overlay network reflects the cluster network name of what is configured as underlay.
   </summary>

    ```
    apiVersion: network.harvesterhci.io/v1beta1
    kind: HostNetworkConfig
    metadata:
      creationTimestamp: "2026-03-30T07:20:28Z"
      finalizers:
      - wrangler.cattle.io/harvester-network-hostnetworkconfig-controller
      generation: 1
      name: hostnetworkconfig1
      resourceVersion: "169000"
      uid: 45eb8d85-d2c5-4d58-9007-d0a031dc4809
    spec:
      clusterNetwork: br-1
      ips:
        hp-119-tink-system: 192.168.1.10/24
        hp-121-tink-system: 192.168.1.11/24
        hp-131-tink-system: 192.168.1.12/24
      mode: static
      underlay: true
      vlanID: 2012
    status:
      nodeStatus:
        hp-119-tink-system:
          clusterNetwork: br-1
          conditions:
          - message: ""
            status: "True"
            type: ready
          mode: static
          vlanID: 2012
        hp-121-tink-system:
          clusterNetwork: br-1
          conditions:
          - message: ""
            status: "True"
            type: ready
          mode: static
          vlanID: 2012
        hp-131-tink-system:
          clusterNetwork: br-1
          conditions:
          - message: ""
            status: "True"
            type: ready
          mode: static
          vlanID: 2012
    ```

   </details>

### Verify Fallback
1. <details>
   <summary> ✔ Delete the hostnetworkconfig or edit the config and make underlay as false
   </summary>
  
    ```
    apiVersion: network.harvesterhci.io/v1beta1
    kind: HostNetworkConfig
    metadata:
      name: hostnetworkconfig1
    spec:
      underlay: false
      clusterNetwork: br-1
      vlanID: 2012
      mode: static
      ips:
        hp-119-tink-system: 192.168.1.10/24
        hp-121-tink-system: 192.168.1.11/24
        hp-131-tink-system: 192.168.1.12/24
    
    
    # kubectl apply -f networkconfig.yaml 
    Warning: resource hostnetworkconfigs/hostnetworkconfig1 is missing the kubectl.kubernetes.io/last-applied-configuration annotation which is required by kubectl apply. kubectl apply should only be used on resources created declaratively by either kubectl create --save-config or kubectl apply. The missing annotation will be patched automatically.
    hostnetworkconfig.network.harvesterhci.io/hostnetworkconfig1 configured
    ```


   </details>

1. <details>
   <summary> ✔ The tunnel_interface on the node annotation should fall back to your harvester host mgmt interface (example if harvester host installed with mgmt.2021 for example)
   </summary>


    ```
          ovn.kubernetes.io/port_name: node-hp-119-tink-system
          ovn.kubernetes.io/tunnel_interface: mgmt-br.2021
    
    
          ovn.kubernetes.io/port_name: node-hp-121-tink-system
          ovn.kubernetes.io/tunnel_interface: mgmt-br.2021
    
          ovn.kubernetes.io/port_name: node-hp-131-tink-system
          ovn.kubernetes.io/tunnel_interface: mgmt-br.2021
    ```

   </details>

1. <details> <summary> ✔ kubectl get pods -n kube-system | grep ovn and login into the ovs pod (kubectl exec -it <ovs...> -n kube-system -- /bin/bash </summary>

    ```
    # kubectl exec -it ovs-ovn-k2tfl -n kube-system -- /bin/bash
    Defaulted container "openvswitch" out of: openvswitch, hostpath-init (init)
    nobody@hp-131-tink-system:/kube-ovn$ 
    
    # kubectl exec -it ovs-ovn-sb668 -n kube-system -- /bin/bash
    Defaulted container "openvswitch" out of: openvswitch, hostpath-init (init)
    nobody@hp-121-tink-system:/kube-ovn$
    
    # kubectl exec -it ovs-ovn-9hl6s -n kube-system -- /bin/bash
    Defaulted container "openvswitch" out of: openvswitch, hostpath-init (init)
    nobody@hp-119-tink-system:/kube-ovn$
    ```

   </details>

1. <details> <summary> ✔ execute the following command "ovs-vsctl show" and it will display remote_ip, it wil point to ips configured on rest of the two nodes.(similary check on all 3 nodes) </summary>

    ```
    $ ovs-vsctl show
    e936f0bd-f01f-4b30-a686-9fc987e5cca1
        Bridge br-int
            fail_mode: secure
            datapath_type: system
            Port br-int
                Interface br-int
                    type: internal
            Port ovn0
                Interface ovn0
                    type: internal
            Port ovn-cca8d7-0
                Interface ovn-cca8d7-0
                    type: vxlan
                    options: {csum="true", key=flow, local_ip="10.115.252.83", remote_ip="10.115.252.88"}
            Port mirror0
                Interface mirror0
                    type: internal
            Port ovn-365e0e-0
                Interface ovn-365e0e-0
                    type: vxlan
                    options: {csum="true", key=flow, local_ip="10.115.252.83", remote_ip="10.115.252.82"}
        ovs_version: "3.5.3"
    
    $ ovs-vsctl show
    135958f6-2b0e-4dcf-8ca5-b157a9de8c34
        Bridge br-int
            fail_mode: secure
            datapath_type: system
            Port br-int
                Interface br-int
                    type: internal
            Port mirror0
                Interface mirror0
                    type: internal
            Port ovn0
                Interface ovn0
                    type: internal
            Port ovn-383db5-0
                Interface ovn-383db5-0
                    type: vxlan
                    options: {csum="true", key=flow, local_ip="10.115.252.82", remote_ip="10.115.252.83"}
            Port ovn-cca8d7-0
                Interface ovn-cca8d7-0
                    type: vxlan
                    options: {csum="true", key=flow, local_ip="10.115.252.82", remote_ip="10.115.252.88"}
        ovs_version: "3.5.3"
    
    $ ovs-vsctl show
    0fe623f8-16fc-461b-b4f7-2dabe0bcd1eb
        Bridge br-int
            fail_mode: secure
            datapath_type: system
            Port ovn-365e0e-0
                Interface ovn-365e0e-0
                    type: vxlan
                    options: {csum="true", key=flow, local_ip="10.115.252.88", remote_ip="10.115.252.82"}
            Port mirror0
                Interface mirror0
                    type: internal
            Port ovn-383db5-0
                Interface ovn-383db5-0
                    type: vxlan
                    options: {csum="true", key=flow, local_ip="10.115.252.88", remote_ip="10.115.252.83"}
            Port br-int
                Interface br-int
                    type: internal
            Port ovn0
                Interface ovn0
                    type: internal
        ovs_version: "3.5.3"
    ```


   </details>

1. <details> <summary> ✔ ping between the ips </summary>

    ```
    hp-119-tink-system:~ # ping 10.115.252.83
    PING 10.115.252.83 (10.115.252.83) 56(84) bytes of data.
    64 bytes from 10.115.252.83: icmp_seq=1 ttl=64 time=0.187 ms
    64 bytes from 10.115.252.83: icmp_seq=2 ttl=64 time=0.133 ms
    64 bytes from 10.115.252.83: icmp_seq=3 ttl=64 time=0.122 ms
    ^C
    --- 10.115.252.83 ping statistics ---
    3 packets transmitted, 3 received, 0% packet loss, time 2082ms
    rtt min/avg/max/mdev = 0.122/0.147/0.187/0.028 ms
    hp-119-tink-system:~ # ping 10.115.252.88
    PING 10.115.252.88 (10.115.252.88) 56(84) bytes of data.
    64 bytes from 10.115.252.88: icmp_seq=1 ttl=64 time=0.194 ms
    64 bytes from 10.115.252.88: icmp_seq=2 ttl=64 time=0.184 ms
    64 bytes from 10.115.252.88: icmp_seq=3 ttl=64 time=0.174 ms
    ^C
    --- 10.115.252.88 ping statistics ---
    3 packets transmitted, 3 received, 0% packet loss, time 2033ms
    rtt min/avg/max/mdev = 0.174/0.184/0.194/0.008 ms
    
    hp-121-tink-system:~ # ping 10.115.252.88
    PING 10.115.252.88 (10.115.252.88) 56(84) bytes of data.
    64 bytes from 10.115.252.88: icmp_seq=1 ttl=64 time=0.181 ms
    64 bytes from 10.115.252.88: icmp_seq=2 ttl=64 time=0.186 ms
    ^C
    --- 10.115.252.88 ping statistics ---
    2 packets transmitted, 2 received, 0% packet loss, time 1046ms
    rtt min/avg/max/mdev = 0.181/0.183/0.186/0.002 ms
    hp-121-tink-system:~ # ping 10.115.252.82
    PING 10.115.252.82 (10.115.252.82) 56(84) bytes of data.
    64 bytes from 10.115.252.82: icmp_seq=1 ttl=64 time=0.162 ms
    64 bytes from 10.115.252.82: icmp_seq=2 ttl=64 time=0.093 ms
    ^C
    --- 10.115.252.82 ping statistics ---
    2 packets transmitted, 2 received, 0% packet loss, time 1009ms
    rtt min/avg/max/mdev = 0.093/0.127/0.162/0.034 ms
    
    hp-131-tink-system:~ # ping 10.115.252.82
    PING 10.115.252.82 (10.115.252.82) 56(84) bytes of data.
    64 bytes from 10.115.252.82: icmp_seq=1 ttl=64 time=0.188 ms
    64 bytes from 10.115.252.82: icmp_seq=2 ttl=64 time=0.163 ms
    ^C
    --- 10.115.252.82 ping statistics ---
    2 packets transmitted, 2 received, 0% packet loss, time 1029ms
    rtt min/avg/max/mdev = 0.163/0.175/0.188/0.012 ms
    hp-131-tink-system:~ # ping 10.115.252.83
    PING 10.115.252.83 (10.115.252.83) 56(84) bytes of data.
    64 bytes from 10.115.252.83: icmp_seq=1 ttl=64 time=0.224 ms
    64 bytes from 10.115.252.83: icmp_seq=2 ttl=64 time=0.136 ms
    ^C
    --- 10.115.252.83 ping statistics ---
    2 packets transmitted, 2 received, 0% packet loss, time 1053ms
    rtt min/avg/max/mdev = 0.136/0.180/0.224/0.044 ms
    ```

   </details>

### Webhook validations
1. <details>
   <summary> ✔ Webhook must reject the HostNetworkConfig with cluster network not spanning all nodes in the cluster. (select a cluster network for hostnetworkconfig which has vlanconfig not spanning all nodes in the cluster)
   </summary>

    ```
    # kubectl create -f lessnodeconfig.yaml 
    Error from server (InternalError): error when creating "lessnodeconfig.yaml": admission webhook "validator.harvester-system.harvester-network-webhook" denied the request: Internal error occurred: can't create hostnetworkConfig badnetworkconfig because static IP not found for node hp-131-tink-system
    ```

   </details>

1. <details>
   <summary> ✔ Webhook must reject the update on HostNetworkConfig as underlay as true if another underlay already exists.
   </summary>

    ```
    # kubectl create -f networkconfig2.yaml 
    Error from server (InternalError): error when creating "networkconfig2.yaml": admission webhook "validator.harvester-system.harvester-network-webhook" denied the request: Internal error occurred: can't create hostnetworkConfig hostnetworkconfig2 because hostnetworkconfig hostnetworkconfig1 already exists for cluster network br-1 vlanid 2012 with underlay enabled
    ```

   </details>

1. <details>
   <summary> ✔ Webhook must reject updating HostNetworkConfig used as underlay if VMs or VMIs present for overlay networks.
   </summary>

    ```
    # kubectl apply -f networkconfig.yaml 
    Warning: resource hostnetworkconfigs/hostnetworkconfig1 is missing the kubectl.kubernetes.io/last-applied-configuration annotation which is required by kubectl apply. kubectl apply should only be used on resources created declaratively by either kubectl create --save-config or kubectl apply. The missing annotation will be patched automatically.
    Error from server (InternalError): error when applying patch:
    {"metadata":{"annotations":{"kubectl.kubernetes.io/last-applied-configuration":"{\"apiVersion\":\"network.harvesterhci.io/v1beta1\",\"kind\":\"HostNetworkConfig\",\"metadata\":{\"annotations\":{},\"name\":\"hostnetworkconfig1\"},\"spec\":{\"clusterNetwork\":\"br-1\",\"ips\":{\"hp-119-tink-system\":\"192.168.1.10/24\",\"hp-121-tink-system\":\"192.168.1.11/24\",\"hp-131-tink-system\":\"192.168.1.12/24\"},\"mode\":\"static\",\"underlay\":false,\"vlanID\":2012}}\n"}},"spec":{"underlay":false}}
    to:
    Resource: "network.harvesterhci.io/v1beta1, Resource=hostnetworkconfigs", GroupVersionKind: "network.harvesterhci.io/v1beta1, Kind=HostNetworkConfig"
    Name: "hostnetworkconfig1", Namespace: ""
    for: "networkconfig.yaml": error when patching "networkconfig.yaml": admission webhook "validator.harvester-system.harvester-network-webhook" denied the request: Internal error occurred: can't update hostnetworkConfig hostnetworkconfig1 because it's still used by VM(s) default/vm-2, default/vm-1 which must remove the related networks and interfaces
    ```

   </details>
