### ISSUE TITLE
[Not-a-BUG] VM Network Connectivity Failure Due to Bridge Learning on Uplink Port - caused by external device loop

### ISSUE THREAD

**Issue by vishrm** [harvester/harvester#9735]
### Describe the Bug

Virtual Machines deployed on Harvester v1.6.0 with VLAN networks fail to obtain network connectivity. VMs remain unreachable

**Root Cause:**

 Linux bridge MAC learning is incorrectly enabled on the uplink bond interface (mgmt-bo), causing the bridge to learn VM MAC addresses from both ingress (correct) and egress (incorrect) directions. This creates constantly flipping FDB (Forwarding Database) entries that prevent ARP replies from being forwarded to VMs.
Symptoms:

- VM boots successfully with correct IP configuration
- Ping to gateway fails with "Destination Host Unreachable"
- ARP table shows gateway as "INCOMPLETE"
- Issue is 100% reproducible across all nodes

### To Reproduce

**- Bridge learning enabled on uplink:**

```
harvester-bmnode-2:/home/rancher # bridge -d link show dev mgmt-bo
7: mgmt-bo: <BROADCAST,MULTICAST,MASTER,UP,LOWER_UP> mtu 9000 master mgmt-br
    learning on  ← BUG: Should be OFF for uplink ports
```

**- FDB constantly flipping between correct and wrong interface:**

```
harvester-bmnode-2:/home/rancher # bridge monitor fdb | grep e2:31:a5:69:a8:8a

e2:31:a5:69:a8:8a dev vethd577a6d3 vlan 3526 master mgmt-br  ← Correct (VM's veth)
e2:31:a5:69:a8:8a dev mgmt-bo vlan 3526 master mgmt-br       ← Wrong (uplink)
e2:31:a5:69:a8:8a dev vethd577a6d3 vlan 3526 master mgmt-br  ← Correct
e2:31:a5:69:a8:8a dev mgmt-bo vlan 3526 master mgmt-br       ← Wrong
```

**- tcpdump proves ARP replies reach bridge but aren't forwarded to VM:**

**At bridge level - replies ARE arriving:**
```
harvester-bmnode-2:/home/rancher # tcpdump -i mgmt-br -n 'vlan 3526 and host 10.26.78.102'

00:15:14.002185 ARP, Request who-has 10.26.78.1 tell 10.26.78.102
00:15:14.002555 ARP, Reply 10.26.78.1 is-at 20:20:00:00:00:aa  ← REPLY RECEIVED
00:15:15.026642 ARP, Request who-has 10.26.78.1 tell 10.26.78.102
00:15:15.027060 ARP, Reply 10.26.78.1 is-at 20:20:00:00:00:aa  ← REPLY RECEIVED
```
**At VM's veth interface - replies NOT forwarded:**
```
harvester-bmnode-2:/home/rancher # tcpdump -i vethd577a6d3 -n 'host 10.26.78.102'

00:15:11.955006 ARP, Request who-has 10.26.78.1 tell 10.26.78.102
00:15:12.978184 ARP, Request who-has 10.26.78.1 tell 10.26.78.102
(only requests - NO REPLIES)

```

- **VM MAC learned on wrong interface:**

```
harvester-bmnode-2:/home/rancher # bridge fdb show br mgmt-br | grep e2:31:a5:69:a8:8a
e2:31:a5:69:a8:8a dev mgmt-bo vlan 3526 master mgmt-br  ← WRONG (should be on vethd577a6d3)
```

- **100% reproducible on all nodes:**

**Tested on second node with different VM**
```
harvester-bmnode-3:/home/rancher # bridge monitor fdb | grep 06:6b:7f:d9:40:ee

06:6b:7f:d9:40:ee dev vethdc256959 vlan 3526 master mgmt-br
06:6b:7f:d9:40:ee dev mgmt-bo vlan 3526 master mgmt-br
(same flipping behavior)
```

**Why This Happens:**

**Outbound (VM → Gateway):**
- Packet enters bridge from vethd577a6d3 (VM's veth) → Bridge learns: MAC → vethd577a6d3 ✅
- Packet exits bridge to mgmt-bo (uplink) → Bridge ALSO learns: MAC → mgmt-bo ❌
- Last write wins - FDB now points to wrong interface

**Return (Gateway → VM):**
- Reply arrives via mgmt-bo → Bridge checks FDB: "Where is VM MAC?"
- FDB says: "On mgmt-bo" (wrong!)
- Bridge logic: "Can't forward to same port packet arrived on"
- **Packet dropped** ❌

**Network Flow Diagram:**
VM → vethd577a6d3 → mgmt-br → mgmt-bo → Physical Network → Gateway
                      ↓           ↓
                 Learns MAC   ALSO learns MAC (BUG!)
                 (correct)       (wrong)

Gateway → Physical Network → mgmt-bo → mgmt-br 
                                         ↓
                                    FDB lookup: MAC on mgmt-bo (wrong!)
                                         ↓
                                    Can't forward to same port
                                         ↓
                                    PACKET DROPPED ❌

### Expected Behavior

**- VM deploys with VLAN network and static IP**
**- VM boots within 2-3 minutes**
**- Network connectivity works immediately (within 30 seconds of boot)**
**- ARP resolves correctly:**

```
root@test-vm:~# ip neigh show
   10.26.78.1 dev enp1s0 lladdr 20:20:00:00:00:aa REACHABLE
```

- **Ping works on first attempt:**

```
root@test-vm:~# ping -c 3 10.26.78.1
   64 bytes from 10.26.78.1: icmp_seq=1 ttl=64 time=0.4 ms
   64 bytes from 10.26.78.1: icmp_seq=2 ttl=64 time=0.3 ms
   64 bytes from 10.26.78.1: icmp_seq=3 ttl=64 time=0.3 ms
```

- **Bridge FDB shows VM MAC on correct interface (veth):**

`e2:31:a5:69:a8:8a dev vethd577a6d3 vlan 3526 master mgmt-br
`

- **FDB entry is stable (no flipping)**

This is standard bridge behavior - uplink/trunk ports should NOT have MAC learning enabled, only VM-facing access ports should learn MAC addresses. This is how enterprise switches (Cisco, Juniper, Arista) and other virtualization platforms (OpenStack Neutron, VMware) configure bridges.

### Support Bundle for Troubleshooting

bundle

### Environment

- **Harvester Version: v1.6.0
- Kubernetes: v1.33.3+rke2r1
- Rancher: v2.12.0
- Network Controller: rancher/harvester-network-controller:v1.6.0
- Multus CNI: v4.2.1-build20250627
- CNI Plugins: v1.7.1-build20250611
- Infrastructure: Baremetal (Cisco UCS C220 M6S)**

**Network:**

- **Physical NICs: 2x 25GbE Intel E810-XXV (ens1f0, ens1f1)
- Bond: mgmt-bo (mode=balance-rr)      NO LACP
- Bridge: mgmt-br (VLAN-aware)
- Switch: Cisco Nexus (trunk ports, no lacp)
- VM Network: VLAN 3526 (10.26.78.0/24)**

### Additional context

kubectl get net-attach-def vmnet -n infralab -o yaml                                                                       
apiVersion: k8s.cni.cncf.io/v1
kind: NetworkAttachmentDefinition
metadata:
  annotations:
    network.harvesterhci.io/route: '{"mode":"manual","cidr":"10.26.78.0/24","gateway":"10.26.78.1","connectivity":"true"}'
  creationTimestamp: "2025-12-13T08:37:31Z"
  finalizers:
  - wrangler.cattle.io/harvester-network-nad-controller
  - wrangler.cattle.io/harvester-network-manager-nad-controller
  generation: 1
  labels:
    network.harvesterhci.io/clusternetwork: mgmt
    network.harvesterhci.io/ready: "true"
    network.harvesterhci.io/type: L2VlanNetwork
    network.harvesterhci.io/vlan-id: "3526"
  name: vmnet
  namespace: infralab
  resourceVersion: "1324266"
  uid: d65bc007-7bb0-40c4-b145-315f70fd6ce8
spec:
  config: '{"cniVersion":"0.3.1","name":"vmnet","type":"bridge","bridge":"mgmt-br","promiscMode":true,"vlan":3526,"ipam":{}}'

### Workaround and Mitigation

**Immediate Workaround (Temporary)**
**On each Harvester node, run:**
`bridge link set dev mgmt-bo learning off
`
**Verify fix applied:**
```
bridge -d link show dev mgmt-bo | grep learning
# Should show: learning off
```
**Result:** All VMs start working within 5-10 seconds.
**Limitation:** This fix is lost after node reboot.

**Comment by w13915984028** [comment]
cc @rrajendran17

**Comment by w13915984028** [comment]
@vishrm Thanks for reporting.

Usually, when a VM is attached to the bridage via veth pair, the MAC of VM should not be learned from uplink (mgmt-bo) unless there is kind of loop.

Could you run command like `tcpdump -e -i vethd577a6d3 -n 'host 10.26.78.102'` to print the L2 head as well, to see if both vlan 3526 and vlan 1 are there, thanks.

Also, could you also try to run single-VM on your cluster, and check if the VM can ping/reach external continuously?

**Comment by vishrm** [comment]
@w13915984028 here is the request outputs, i have deployed new VM on other node still same issue

VM ip : 10.27.78.103 MAC 62:43:b0:6c:af:4b

1.  **tcpdump with Ethernet Headers**


```
tcpdump -e -i veth6d8f73d8 -n 'host 10.26.78.103'


**Output:**

09:16:36.525318 62:43:b0:6c:af:4b > ff:ff:ff:ff:ff:ff, ethertype ARP (0x0806), length 42: Request who-has 10.26.78.1 tell 10.26.78.103
09:16:37.549811 62:43:b0:6c:af:4b > ff:ff:ff:ff:ff:ff, ethertype ARP (0x0806), length 42: Request who-has 10.26.78.1 tell 10.26.78.103
09:16:38.573353 62:43:b0:6c:af:4b > ff:ff:ff:ff:ff:ff, ethertype ARP (0x0806), length 42: Request who-has 10.26.78.1 tell 10.26.78.103
(only requests - NO replies visible)
```
**Analysis:**

- Traffic at veth is untagged (ethertype ARP, no 802.1Q tag)
- Only ARP requests visible
- ARP replies NOT reaching veth interface


**Comparison at bridge level:**

```
tcpdump -i mgmt-br -n 'vlan 3526 and host 10.26.78.103'

09:12:12.333749 ARP, Reply 10.26.78.1 is-at 20:20:00:00:00:aa  ← Replies ARE at bridge
09:12:13.359279 ARP, Reply 10.26.78.1 is-at 20:20:00:00:00:aa
09:12:14.381799 ARP, Reply 10.26.78.1 is-at 20:20:00:00:00:aa


tcpdump -i mgmt-br -n 'vlan 3526 and host 10.26.78.103'
tcpdump: verbose output suppressed, use -v[v]... for full protocol decode
listening on mgmt-br, link-type EN10MB (Ethernet), snapshot length 262144 bytes
09:12:12.333334 ARP, Request who-has 10.26.78.1 tell 10.26.78.103, length 28
09:12:12.333351 ARP, Request who-has 10.26.78.1 tell 10.26.78.103, length 46
09:12:12.333749 ARP, Reply 10.26.78.1 is-at 20:20:00:00:00:aa, length 46
09:12:13.358936 ARP, Request who-has 10.26.78.1 tell 10.26.78.103, length 28
09:12:13.358960 ARP, Request who-has 10.26.78.1 tell 10.26.78.103, length 46
09:12:13.359279 ARP, Reply 10.26.78.1 is-at 20:20:00:00:00:aa, length 46
09:12:14.381356 ARP, Request who-has 10.26.78.1 tell 10.26.78.103, length 28
09:12:14.381379 ARP, Request who-has 10.26.78.1 tell 10.26.78.103, length 46
09:12:14.381799 ARP, Reply 10.26.78.1 is-at 20:20:00:00:00:aa, length 46
09:12:15.405326 ARP, Request who-has 10.26.78.1 tell 10.26.78.103, length 28
09:12:15.405352 ARP, Request who-has 10.26.78.1 tell 10.26.78.103, length 46
09:12:15.405678 ARP, Reply 10.26.78.1 is-at 20:20:00:00:00:aa, length 46
09:12:16.430919 ARP, Request who-has 10.26.78.1 tell 10.26.78.103, length 28
09:12:16.430944 ARP, Request who-has 10.26.78.1 tell 10.26.78.103, length 46
09:12:16.431380 ARP, Reply 10.26.78.1 is-at 20:20:00:00:00:aa, length 46
09:12:17.453344 ARP, Request who-has 10.26.78.1 tell 10.26.78.103, length 28
09:12:17.453372 ARP, Request who-has 10.26.78.1 tell 10.26.78.103, length 46
09:12:17.453677 ARP, Reply 10.26.78.1 is-at 20:20:00:00:00:aa, length 46

```

- This confirms: Bridge receives replies but doesn't forward them to veth.

2.  **VLAN Configuration**


```
bridge vlan show


**Ouput:**

port              vlan-id
mgmt-br           1 PVID Egress Untagged
                  3525
mgmt-bo           1 PVID Egress Untagged
                  3525
                  3526
veth6d8f73d8      1 Egress Untagged
                  3526 PVID Egress Untagged
```
**Findings:**

- VLAN 1 is configured with PVID on bridge ports
- VLAN 3526 traffic is untagged at veth level (PVID + Egress Untagged)
- Bridge adds/removes VLAN tags based on PVID configuration

3. **VLAN 1 Traffic Check**

```
tcpdump -i veth6d8f73d8 -e -n vlan 1


**Output:**
0 packets captured
0 packets received by filter
```
Result: No active VLAN 1 traffic, despite VLAN 1 being configured.

4. **FDB State and Flipping**

```
**Current FDB:**
bridge fdb show br mgmt-br | grep 62:43:b0:6c:af:4b
62:43:b0:6c:af:4b dev mgmt-bo vlan 3526 master mgmt-br  ← Wrong interface
Live monitoring:
bridge monitor fdb

62:43:b0:6c:af:4b dev veth6d8f73d8 vlan 3526 master mgmt-br  ← Correct
62:43:b0:6c:af:4b dev mgmt-bo vlan 3526 master mgmt-br       ← Wrong
62:43:b0:6c:af:4b dev veth6d8f73d8 vlan 3526 master mgmt-br  ← Correct
62:43:b0:6c:af:4b dev mgmt-bo vlan 3526 master mgmt-br       ← Wrong
(continues flipping)
```

5. **VM side:**

```
root@vm-test:/home/ubuntu# ip route
default via 10.26.78.1 dev enp1s0 proto static 
10.26.78.0/24 dev enp1s0 proto kernel scope link src 10.26.78.103 

root@vm-test:/home/ubuntu# ip link
1: lo: <LOOPBACK,UP,LOWER_UP> mtu 65536 qdisc noqueue state UNKNOWN mode DEFAULT group default qlen 1000
    link/loopback 00:00:00:00:00:00 brd 00:00:00:00:00:00
2: enp1s0: <BROADCAST,MULTICAST,UP,LOWER_UP> mtu 1500 qdisc fq_codel state UP mode DEFAULT group default qlen 1000
    link/ether 62:43:b0:6c:af:4b brd ff:ff:ff:ff:ff:ff

root@vm-test:/home/ubuntu# ip addr
1: lo: <LOOPBACK,UP,LOWER_UP> mtu 65536 qdisc noqueue state UNKNOWN group default qlen 1000
    link/loopback 00:00:00:00:00:00 brd 00:00:00:00:00:00
    inet 127.0.0.1/8 scope host lo
       valid_lft forever preferred_lft forever
    inet6 ::1/128 scope host noprefixroute 
       valid_lft forever preferred_lft forever
2: enp1s0: <BROADCAST,MULTICAST,UP,LOWER_UP> mtu 1500 qdisc fq_codel state UP group default qlen 1000
    link/ether 62:43:b0:6c:af:4b brd ff:ff:ff:ff:ff:ff
    inet 10.26.78.103/24 brd 10.26.78.255 scope global enp1s0
       valid_lft forever preferred_lft forever
    inet6 fe80::6043:b0ff:fe6c:af4b/64 scope link 
       valid_lft forever preferred_lft forever

root@vm-test:/home/ubuntu# tcpdump -i enp1s0 ARP
tcpdump: can't parse filter expression: syntax error
root@vm-test:/home/ubuntu# tcpdump -i enp1s0 arp
tcpdump: verbose output suppressed, use -v[v]... for full protocol decode
listening on enp1s0, link-type EN10MB (Ethernet), snapshot length 262144 bytes
09:27:40.980169 ARP, Request who-has 10.26.78.1 tell 10.26.78.103, length 28
09:27:40.980368 ARP, Request who-has 10.26.78.1 tell 10.26.78.103, length 46
09:27:42.002297 ARP, Request who-has 10.26.78.1 tell 10.26.78.103, length 28
09:27:42.002490 ARP, Request who-has 10.26.78.1 tell 10.26.78.103, length 46
09:27:43.026289 ARP, Request who-has 10.26.78.1 tell 10.26.78.103, length 28
09:27:43.026437 ARP, Request who-has 10.26.78.1 tell 10.26.78.103, length 46
09:27:44.050820 ARP, Request who-has 10.26.78.1 tell 10.26.78.103, length 28
09:27:44.051024 ARP, Request who-has 10.26.78.1 tell 10.26.78.103, length 46
09:27:45.074318 ARP, Request who-has 10.26.78.1 tell 10.26.78.103, length 28
09:27:45.074540 ARP, Request who-has 10.26.78.1 tell 10.26.78.103, length 46
09:27:46.098287 ARP, Request who-has 10.26.78.1 tell 10.26.78.103, length 28
09:27:46.098484 ARP, Request who-has 10.26.78.1 tell 10.26.78.103, length 46
09:27:47.122727 ARP, Request who-has 10.26.78.1 tell 10.26.78.103, length 28
09:27:47.122899 ARP, Request who-has 10.26.78.1 tell 10.26.78.103, length 46
09:27:48.146293 ARP, Request who-has 10.26.78.1 tell 10.26.78.103, length 28
09:27:48.146464 ARP, Request who-has 10.26.78.1 tell 10.26.78.103, length 46
09:27:58.386289 ARP, Request who-has 10.26.78.1 tell 10.26.78.103, length 28
09:27:58.386482 ARP, Request who-has 10.26.78.1 tell 10.26.78.103, length 46
09:27:59.410799 ARP, Request who-has 10.26.78.1 tell 10.26.78.103, length 28
09:27:59.411003 ARP, Request who-has 10.26.78.1 tell 10.26.78.103, length 46



```

**Comment by w13915984028** [comment]
The ARP requests have two size 28, 46, which means one is un-tagged and another is tagged, it is a bit tricky

run below `tcpdump -i mgmt-br -e -n 'host 10.26.78.103'`

```
tcpdump -i mgmt-br -n -e 'host 10.26.78.103'
tcpdump: verbose output suppressed, use -v[v]... for full protocol decode
listening on mgmt-br, link-type EN10MB (Ethernet), snapshot length 262144 bytes
09:12:12.333334 ARP, Request who-has 10.26.78.1 tell 10.26.78.103, length 28
09:12:12.333351 ARP, Request who-has 10.26.78.1 tell 10.26.78.103, length 46
```

**Comment by vishrm** [comment]
@w13915984028 

```
tcpdump -i mgmt-br -e -n 'host 10.26.78.103'
tcpdump: verbose output suppressed, use -v[v]... for full protocol decode
listening on mgmt-br, link-type EN10MB (Ethernet), snapshot length 262144 bytes
09:44:44.078990 62:43:b0:6c:af:4b > ff:ff:ff:ff:ff:ff, ethertype 802.1Q (0x8100), length 46: vlan 3526, p 0, ethertype ARP (0x0806), Request who-has 10.26.78.1 tell 10.26.78.103, length 28
09:44:44.079033 62:43:b0:6c:af:4b > ff:ff:ff:ff:ff:ff, ethertype 802.1Q (0x8100), length 64: vlan 3526, p 0, ethertype ARP (0x0806), Request who-has 10.26.78.1 tell 10.26.78.103, length 46
09:44:44.079293 20:20:00:00:00:aa > 62:43:b0:6c:af:4b, ethertype 802.1Q (0x8100), length 64: vlan 3526, p 6, ethertype ARP (0x0806), Reply 10.26.78.1 is-at 20:20:00:00:00:aa, length 46
09:44:45.101762 62:43:b0:6c:af:4b > ff:ff:ff:ff:ff:ff, ethertype 802.1Q (0x8100), length 46: vlan 3526, p 0, ethertype ARP (0x0806), Request who-has 10.26.78.1 tell 10.26.78.103, length 28
09:44:45.101808 62:43:b0:6c:af:4b > ff:ff:ff:ff:ff:ff, ethertype 802.1Q (0x8100), length 64: vlan 3526, p 0, ethertype ARP (0x0806), Request who-has 10.26.78.1 tell 10.26.78.103, length 46
09:44:45.102135 20:20:00:00:00:aa > 62:43:b0:6c:af:4b, ethertype 802.1Q (0x8100), length 64: vlan 3526, p 6, ethertype ARP (0x0806), Reply 10.26.78.1 is-at 20:20:00:00:00:aa, length 46
09:44:46.125758 62:43:b0:6c:af:4b > ff:ff:ff:ff:ff:ff, ethertype 802.1Q (0x8100), length 46: vlan 3526, p 0, ethertype ARP (0x0806), Request who-has 10.26.78.1 tell 10.26.78.103, length 28
09:44:46.125800 62:43:b0:6c:af:4b > ff:ff:ff:ff:ff:ff, ethertype 802.1Q (0x8100), length 64: vlan 3526, p 0, ethertype ARP (0x0806), Request who-has 10.26.78.1 tell 10.26.78.103, length 46
09:44:46.126464 20:20:00:00:00:aa > 62:43:b0:6c:af:4b, ethertype 802.1Q (0x8100), length 64: vlan 3526, p 6, ethertype ARP (0x0806), Reply 10.26.78.1 is-at 20:20:00:00:00:aa, length 46
09:44:47.150264 62:43:b0:6c:af:4b > ff:ff:ff:ff:ff:ff, ethertype 802.1Q (0x8100), length 46: vlan 3526, p 0, ethertype ARP (0x0806), Request who-has 10.26.78.1 tell 10.26.78.103, length 28
09:44:47.150305 62:43:b0:6c:af:4b > ff:ff:ff:ff:ff:ff, ethertype 802.1Q (0x8100), length 64: vlan 3526, p 0, ethertype ARP (0x0806), Request who-has 10.26.78.1 tell 10.26.78.103, length 46
09:44:47.150740 20:20:00:00:00:aa > 62:43:b0:6c:af:4b, ethertype 802.1Q (0x8100), length 64: vlan 3526, p 6, ethertype ARP (0x0806), Reply 10.26.78.1 is-at 20:20:00:00:00:aa, length 46
```


```
 tcpdump -i veth6d8f73d8 -e -n 'arp' -c 20
tcpdump: verbose output suppressed, use -v[v]... for full protocol decode
listening on veth6d8f73d8, link-type EN10MB (Ethernet), snapshot length 262144 bytes
09:50:29.165856 62:43:b0:6c:af:4b > ff:ff:ff:ff:ff:ff, ethertype ARP (0x0806), length 42: Request who-has 10.26.78.1 tell 10.26.78.103, length 28
09:50:29.165927 62:43:b0:6c:af:4b > ff:ff:ff:ff:ff:ff, ethertype ARP (0x0806), length 60: Request who-has 10.26.78.1 tell 10.26.78.103, length 46
09:50:30.189889 62:43:b0:6c:af:4b > ff:ff:ff:ff:ff:ff, ethertype ARP (0x0806), length 42: Request who-has 10.26.78.1 tell 10.26.78.103, length 28
09:50:30.189965 62:43:b0:6c:af:4b > ff:ff:ff:ff:ff:ff, ethertype ARP (0x0806), length 60: Request who-has 10.26.78.1 tell 10.26.78.103, length 46
```


The duplication happens BEFORE the bridge - at the veth interface itself.


here are the details from the pod

```
kubectl get pods -n infralab -o name | grep vm-test | head -1
pod/virt-launcher-vm-test-jfzch

 kubectl exec -it pod/virt-launcher-vm-test-jfzch -n infralab -c compute -- sh        
               
sh-4.4$ ip link show
1: lo: <LOOPBACK,UP,LOWER_UP> mtu 65536 qdisc noqueue state UNKNOWN mode DEFAULT group default qlen 1000
    link/loopback 00:00:00:00:00:00 brd 00:00:00:00:00:00
2: eth0@if78: <BROADCAST,MULTICAST,UP,LOWER_UP> mtu 1450 qdisc noqueue state UP mode DEFAULT group default qlen 1000
    link/ether 3e:15:e5:a3:83:ec brd ff:ff:ff:ff:ff:ff link-netnsid 0
3: 37a8eec1ce1-nic@if79: <BROADCAST,MULTICAST,UP,LOWER_UP> mtu 1500 qdisc noqueue master k6t-37a8eec1ce1 state UP mode DEFAULT group default qlen 1000
    link/ether 72:81:c8:d8:20:72 brd ff:ff:ff:ff:ff:ff link-netnsid 0
4: k6t-37a8eec1ce1: <BROADCAST,MULTICAST,UP,LOWER_UP> mtu 1500 qdisc noqueue state UP mode DEFAULT group default qlen 1000
    link/ether 6e:b7:eb:90:fa:a6 brd ff:ff:ff:ff:ff:ff
5: tap37a8eec1ce1: <BROADCAST,MULTICAST,UP,LOWER_UP> mtu 1500 qdisc pfifo_fast master k6t-37a8eec1ce1 state UP mode DEFAULT group default qlen 1000
    link/ether 6e:b7:eb:90:fa:a6 brd ff:ff:ff:ff:ff:ff
6: pod37a8eec1ce1: <BROADCAST,NOARP> mtu 1500 qdisc noop state DOWN mode DEFAULT group default qlen 1000
    link/ether 62:43:b0:6c:af:4b brd ff:ff:ff:ff:ff:ff

sh-4.4$ bridge link show 2>/dev/null || echo "No bridge in pod"
3: 37a8eec1ce1-nic@if79: <BROADCAST,MULTICAST,UP,LOWER_UP> mtu 1500 master k6t-37a8eec1ce1 state forwarding priority 32 cost 2 
5: tap37a8eec1ce1: <BROADCAST,MULTICAST,UP,LOWER_UP> mtu 1500 master k6t-37a8eec1ce1 state forwarding priority 32 cost 100 
sh-4.4$ ip link show type bridge
4: k6t-37a8eec1ce1: <BROADCAST,MULTICAST,UP,LOWER_UP> mtu 1500 qdisc noqueue state UP mode DEFAULT group default qlen 1000
    link/ether 6e:b7:eb:90:fa:a6 brd ff:ff:ff:ff:ff:ff
```

**Interfaces Inside Pod**

```
1. lo                     - Loopback
2. eth0@if78              - Pod network (Calico/Canal) - 10.52.x.x
3. 37a8eec1ce1-nic@if79   - Veth to host (Multus attachment)
4. k6t-37a8eec1ce1        - Bridge inside pod (Kubevirt bridge)
5. tap37a8eec1ce1         - TAP device connected to QEMU/VM
6. pod37a8eec1ce1         - Multus pod interface (DOWN)
```

**Network path:**
```
VM → virtio → tap37a8eec1ce1 → k6t-37a8eec1ce1 (pod bridge) → 
     37a8eec1ce1-nic (veth pod side) → veth6d8f73d8 (veth host side) → 
     mgmt-br → mgmt-bo

```

The ARP duplication occurs before the host veth interface, suggesting it originates in the QEMU/virtio-net layer or pod bridge. Both the 42-byte (minimal) and 60-byte (padded) ARP requests already exist at the host veth interface before reaching mgmt-br.


```
sh-4.4$ bridge -d link show dev tap37a8eec1ce1
5: tap37a8eec1ce1: <BROADCAST,MULTICAST,UP,LOWER_UP> mtu 1500 master k6t-37a8eec1ce1 state forwarding priority 32 cost 100 
    hairpin off guard off root_block off fastleave off learning on flood on mcast_flood on bcast_flood on mcast_router 1 mcast_to_unicast off neigh_suppress off vlan_tunnel off isolated off 
sh-4.4$ bridge -d link show dev 37a8eec1ce1-nic
3: 37a8eec1ce1-nic@if79: <BROADCAST,MULTICAST,UP,LOWER_UP> mtu 1500 master k6t-37a8eec1ce1 state forwarding priority 32 cost 2 
    hairpin off guard off root_block off fastleave off learning off flood on mcast_flood on bcast_flood on mcast_router 1 mcast_to_unicast off neigh_suppress off vlan_tunnel off isolated off


tap37a8eec1ce1:     learning on   ← VM-facing port (correct)
37a8eec1ce1-nic:    learning off  ← Uplink to host (correct!)

```

**Network topology:**
```
VM → tap (learning on) → k6t-bridge → veth-to-host (learning off) ✅
                                          ↓
                    Host: veth (learning on) → mgmt-br → mgmt-bo (learning on) ❌
                                                                      ↓
                                                               Physical network
```

SInce i can't run tcpdump from pod i have ran tcpdump  from pod's network namespace from the harvester node

```
nsenter -t 22959 -n tcpdump -i tap37a8eec1ce1 -e -n arp -c 20
tcpdump: verbose output suppressed, use -v[v]... for full protocol decode
listening on tap37a8eec1ce1, link-type EN10MB (Ethernet), snapshot length 262144 bytes
10:04:03.245769 62:43:b0:6c:af:4b > ff:ff:ff:ff:ff:ff, ethertype ARP (0x0806), length 42: Request who-has 10.26.78.1 tell 10.26.78.103, length 28
10:04:03.245847 62:43:b0:6c:af:4b > ff:ff:ff:ff:ff:ff, ethertype ARP (0x0806), length 60: Request who-has 10.26.78.1 tell 10.26.78.103, length 46
10:04:04.269754 62:43:b0:6c:af:4b > ff:ff:ff:ff:ff:ff, ethertype ARP (0x0806), length 42: Request who-has 10.26.78.1 tell 10.26.78.103, length 28
10:04:04.269861 62:43:b0:6c:af:4b > ff:ff:ff:ff:ff:ff, ethertype ARP (0x0806), length 60: Request who-has 10.26.78.1 tell 10.26.78.103, length 46
10:04:05.294224 62:43:b0:6c:af:4b > ff:ff:ff:ff:ff:ff, ethertype ARP (0x0806), length 42: Request who-has 10.26.78.1 tell 10.26.78.103, length 28
10:04:05.294333 62:43:b0:6c:af:4b > ff:ff:ff:ff:ff:ff, ethertype ARP (0x0806), length 60: Request who-has 10.26.78.1 tell 10.26.78.103, length 46
10:04:06.317739 62:43:b0:6c:af:4b > ff:ff:ff:ff:ff:ff, ethertype ARP (0x0806), length 42: Request who-has 10.26.78.1 tell 10.26.78.103, length 28
10:04:06.317841 62:43:b0:6c:af:4b > ff:ff:ff:ff:ff:ff, ethertype ARP (0x0806), length 60: Request who-has 10.26.78.1 tell 10.26.78.103, length 46
10:04:07.341749 62:43:b0:6c:af:4b > ff:ff:ff:ff:ff:ff, ethertype ARP (0x0806), length 42: Request who-has 10.26.78.1 tell 10.26.78.103, length 28
10:04:07.341847 62:43:b0:6c:af:4b > ff:ff:ff:ff:ff:ff, ethertype ARP (0x0806), length 60: Request who-has 10.26.78.1 tell 10.26.78.103, length 46

```

The duplication originates at the TAP interface (78 microseconds apart), confirming this is QEMU/virtio-net behavior. QEMU creates both minimal (42-byte) and padded (60-byte) versions of each ARP request, likely for compatibility with different network stack implementations.

But i think This is unrelated to the bridge FDB learning issue and doesn't impact connectivity

**Comment by w13915984028** [comment]
@vishrm I setup a Harvester v1.6.1 environment:

It sets up vm network vid 100 on top of mgmt cluster network, and spin up two VMs attache to this vm network

```
harv2:~ # bridge vlan show
port              vlan-id  
mgmt-br           1 PVID Egress Untagged
mgmt-bo           1 PVID Egress Untagged
                  100
cn61-bo           1 PVID Egress Untagged
cn61-br           1 PVID Egress Untagged
vethad0ee30f      100 PVID Egress Untagged
vethb1f5822f      100 PVID Egress Untagged
```

while doing ping from one vm to another, everything looks good.

```
harv2:~ # bridge fdb show | grep "aa:7b"
aa:7b:e8:c7:a0:19 dev vethb1f5822f vlan 100 master mgmt-br 

harv2:~ # ip link | grep veth
77: vethad0ee30f@if3: <BROADCAST,MULTICAST,UP,LOWER_UP> mtu 1500 qdisc noqueue master mgmt-br state UP mode DEFAULT group default 
79: vethb1f5822f@if3: <BROADCAST,MULTICAST,UP,LOWER_UP> mtu 1500 qdisc noqueue master mgmt-br state UP mode DEFAULT group default 

harv2:~ # tcpdump -i vethad0ee30f
tcpdump: verbose output suppressed, use -v[v]... for full protocol decode
listening on vethad0ee30f, link-type EN10MB (Ethernet), snapshot length 262144 bytes
12:51:53.202385 IP 0.0.0.0.bootpc > 255.255.255.255.bootps: BOOTP/DHCP, Request from ea:05:05:57:59:66 (oui Unknown), length 291
12:51:56.202198 IP 192.168.100.20 > 192.168.100.10: ICMP echo request, id 2, seq 1, length 64
12:51:56.202546 IP 192.168.100.10 > 192.168.100.20: ICMP echo reply, id 2, seq 1, length 64
12:52:01.328795 ARP, Request who-has 192.168.100.20 tell 192.168.100.10, length 28
12:52:01.329108 ARP, Reply 192.168.100.20 is-at aa:7b:e8:c7:a0:19 (oui Unknown), length 28
```

Even when `mgmt -bo` is enabling learning, it should only learn MAC originates from it's attached device (here means your extern switch), but not from the egress (to external) direction.

I still suspect, your external device is broadcasting back the vm's MAC to `mgmt-bo`.

Could you debug on your external device, to check if there is looping.

Or you can do a similar test like I did, run 2 VMs in the same vm network, manually set IP, route on those two VM, and let one VM Ping other, in this context.

**Comment by w13915984028** [comment]
BTW, I noticed your `mgmt` network is using MTU 9000, but the VM is not having the value.

Please follow https://docs.harvesterhci.io/v1.6/networking/index#annotate-a-non-default-mtu-value-to-mgmt-after-installation to amend the latest MTU and reboot the VMs to get the new MTU working. thanks.

**Comment by w13915984028** [comment]
Another difference, on my env `tcpdump -i mgmt-br -e`, the AR request is using the minimal length.

```
13:25:30.275737 aa:7b:e8:c7:a0:19 (oui Unknown) > ea:05:05:57:59:66 (oui Unknown), ethertype 802.1Q (0x8100), length 46: vlan 100, p 0, ethertype ARP (0x0806), Request who-has 192.168.100.10 tell 192.168.100.20, length 28

13:25:30.275934 ea:05:05:57:59:66 (oui Unknown) > aa:7b:e8:c7:a0:19 (oui Unknown), ethertype 802.1Q (0x8100), length 46: vlan 100, p 0, ethertype ARP (0x0806), Reply 192.168.100.10 is-at ea:05:05:57:59:66 (oui Unknown), length 28
```

**Comment by w13915984028** [comment]
try below:

>tcpdump -i mgmt-br -e -n 'host 10.26.78.103'

->

>tcpdump -i mgmt-br -e | grep "62:43:b0:6c:af:4b"

**Comment by vishrm** [comment]
@w13915984028 you are write there is a loop, we are using balance-rr on harvster node and on netwok switches it is a trunks goign to two switches.  nic1 goes to switch 1 (trunk) and nic2 goes to switch 2 (trunk)
here is the flow i understood correct me if i am wrong

**Step 1: VM Sends ARP Reques**t 
**Step 2: QEMU Creates Duplicates**
-  Packet A: 42 bytes (minimal ARP)                               
- Packet B: 60 bytes (padded ARP)                                
- Both have: Source MAC = 62:43:b0:6c:af:4b  

**Step 3: Packets Reach mgmt-br Bridge, Bridge LEARNS (ingress) 62:43:b0:6c:af:4b → veth6d8f73d8 FDB now: 62:43:b0:6c:af:4b is on veth6d8f73d8**  
 
**Step 4: Bridge Forwards to mgmt-bo**  
- Broadcast → flood to all ports including mgmt-bo 
- Bridge adds VLAN 3526 tag:
- Packet A: 42 bytes → 46 bytes  
- Packet B: 60 bytes → 64 bytes 
-
**Step 5: Balance-RR Splits Packets (THE PROBLEM STARTS!)**   
- mgmt-bo (balance-rr) receives both packets
- Round-robin distribution: 
-    Packet A → ens1f0 → Switch 1
-    Packet B → ens1f1 → Switch 2 

**Step 6: Bridge ALSO Learns on Egress**
As packets EXIT mgmt-bo:

- Bridge sees: Source MAC 62:43:b0:6c:af:4b exiting mgmt-bo 
- Bridge LEARNS (egress - WRONG!): 
-  62:43:b0:6c:af:4b → mgmt-bo 
- FDB OVERWRITTEN: 62:43:b0:6c:af:4b is now on mgmt-bo (WRONG!) 

**Step 7: Both Switches Learn VM MAC** 
 **Step 8: Gateway Receives Request**

**When the ARP request repsone comes to Switch 1 → ens1f0 → mgmt-bo → mgmt-br then Bridge FDB Lookup and then FDB says send TO: mgmt-bo and then Cannot forward to same port packet arrived on DROP PACKE**  

I shutdown one link on every node and immediatlyy everything started working , All VMs are able to pin gateway.

Can you confirm above FLOW , if it is correct can you tell me why in the first place quemu create two arp requests??

**Comment by w13915984028** [comment]
@vishrm 

Thanks for confirming the root caus.

You analysis of the FLOW is correct.   Why QEMU sends two ARPs: it might due to the differences between bare-metal servers (your env) and the KVM based nested virtualization (my cluster), but it does no harm, the `ARP reply` only come once.

If your Harvester node's uplink trunk is crossing multi-devices, the external devices need to run something like `m-lag` to act as a virtual single device to avoid loop.

**Comment by w13915984028** [comment]
BTW: This is not a Harvester bug, but due to the external devices configuration.

**Comment by w13915984028** [comment]
close for now, feel free to add your comments, thanks.
