### ISSUE TITLE
[BUG] Harvester Cluster's status stays Not Ready on the Woker Node created with VLAN

### ISSUE THREAD

**Issue by mingshuoqiu** [harvester/harvester#5302]
**Describe the bug**
When trying to create a new Node from different VLAN to join the existing Harvester Cluster, the Node status is Green `Ready` but the Cluster's status stays `Not Ready` always. HTTP(s) from the node the the management URL fails but ping/ssh at the same direction works OK. 

**To Reproduce**
1. Install Harvester one machine (Node 1) to create a New Cluster w/o VLAN ID
2. Install Harvester on another machine (Node 2) to `Join the existing Cluster` and configure the network w/ VLAN ID to join the created cluster in step 1
3. make sure Node status is `Ready` and the assigned IP belongs to the specified VLAN
4. `ping` from Node2 to Node1 to verify the network connectivity.
5. `curl` from Node2 to Node1 and the timeout would happen

**Expected behavior**
Cluster's status should turn into `Ready` if the worker node can reach the management node from network.

**Environment**
Harvester ISO version: found in 1.2.1 and 1.3.0-rc

**Additional context**
The journal log on the worker node shows. But it's working OK when `Downloading rancher-system-agent-uninstall.sh` in earlier boot stage.
```
Mar 06 05:24:57 mingshuo-porto rancher-system-agent[2370]: time="2024-03-06T05:24:57Z" level=fatal msg="[K8s] encountered an error while attempting to update the secret: Put \"https://172.24.1.52/api/v1/namespaces/fleet-local/secrets/custom-37f8333a5913-machine-plan\": dial tcp 172.24.1.52:443: i/o timeout"
```

**Comment by starbops** [comment]
I can reproduce the issue when placing the first node in VLAN 1 and the second node in VLAN 100. The "Cluster Status" will be "NotReady" indefinitely. This is because some of the Longhorn Pods cannot run on the second node:

![image](https://github.com/harvester/harvester/assets/1827717/157eec28-74b4-42cd-a72a-3189953fa354)

With the following one-liner, I observed that the success rate is about 25%:

```shell
# run the following command on any Harvester node
VIP=10.172.0.240; success=0; fail=0; for i in $(seq 1 100); do echo -n "$i: "; curl -m 1 -s -o /dev/null -k https://$VIP; if [ $? -eq 0 ]; then echo success; success=$((success+1)); else echo fail; fail=$((fail+1)); fi; done; echo total success $success; echo total failure $fail
```

However, such issue cannot be reproduced when they are both in non-VLAN-1 network, e.g., the first node in VLAN 100 and the second node in VLAN 101.

**Comment by starbops** [comment]
BTW, I think it is a hard requirement for all the management nodes to be in the same subnet from the VIP address point of view. On the other hand, it could be possible to put additional worker nodes in other subnets (but must be routable and able to communicate with management nodes). We need to explicitly state this network requirement in the documentation.

**Comment by mingshuoqiu** [comment]
The http(s) from Node2 would be wrapped as a VxLAN packet in VLAN200 in my test environment. So it's sent out from the Node2's bonding interface

The `tcpdump -eni mgmt-bo  -p udp port 8472`
```
de:d3:9a:60:ae:07 > 0e:8a:81:58:47:46, ethertype IPv4 (0x0800), length 74: **10.52.5.0.61201** > **10.52.0.45.443**: Flags [S], seq 3205210373, win 64240, options [mss 1460,sackOK,TS val 1439982275 ecr 0,nop,wscale 7], length 0
04:01:10.765151 00:50:b6:58:58:5a > 74:83:c2:dd:42:56, ethertype 802.1Q (0x8100), length 128: vlan 200, p 0, ethertype IPv4 (0x0800), **192.168.200.56.6668** > **172.24.1.50.8472**: OTV, flags [I] (0x08), overlay 0, instance 1
```

In Mangement Node side, I can also see the VxLAN packet from tcpdump. I can see the packet in the `mgmt-br` but it's expected to be seen in `flannel.1` too. We don't see that. Need to check what happens
```
03:55:54.607899 enp1s0 In  ifindex 2 74:83:c2:dd:42:56 ethertype IPv4 (0x0800), length 130: **192.168.200.56.25367** > **172.24.1.50.8472**: OTV, flags [I] (0x08), overlay 0, instance 1
de:d3:9a:60:ae:07 > 0e:8a:81:58:47:46, ethertype IPv4 (0x0800), length 74: **10.52.5.0.6467** > **10.52.0.42.444**: Flags [S], seq 3715339192, win 64240, options [mss 1460,sackOK,TS val 1826231310 ecr 0,nop,wscale 7], length 0
03:55:54.607902 mgmt-bo In  ifindex 5 74:83:c2:dd:42:56 ethertype IPv4 (0x0800), length 130: 192.168.200.56.25367 > 172.24.1.50.8472: OTV, flags [I] (0x08), overlay 0, instance 1
de:d3:9a:60:ae:07 > 0e:8a:81:58:47:46, ethertype IPv4 (0x0800), length 74: 10.52.5.0.6467 > 10.52.0.42.444: Flags [S], seq 3715339192, win 64240, options [mss 1460,sackOK,TS val 1826231310 ecr 0,nop,wscale 7], length 0
03:55:54.607910 **mgmt-br** In  ifindex 4 74:83:c2:dd:42:56 ethertype IPv4 (0x0800), length 130: 192.168.200.56.25367 > 172.24.1.50.8472: OTV, flags [I] (0x08), overlay 0, instance 1
de:d3:9a:60:ae:07 > 0e:8a:81:58:47:46, ethertype IPv4 (0x0800), length 74: 10.52.5.0.6467 > 10.52.0.42.444: Flags [S], seq 3715339192, win 64240, options [mss 1460,sackOK,TS val 1826231310 ecr 0,nop,wscale 7], length 0
```

**Comment by mingshuoqiu** [comment]
Not sure about the reason but the some bytes of the payload would change when wrap into vxlan packet. It's about 50% happen rate.

for example: the original vxlan packet would be like this. The dest port is `80` and the seq is `2369016384`
```
10:33:05.871217 mgmt-br Out ifindex 5 00:50:b6:58:58:5a ethertype IPv4 (0x0800), length 130: 192.168.200.56.35694 > 172.24.1.50.8472: OTV, flags [I] (0x08), overlay 0, instance 1
5a:70:ad:45:1a:7d > 0e:8a:81:58:47:46, ethertype IPv4 (0x0800), length 74: 10.52.5.0.7394 > 10.52.0.45.80: Flags [S], seq 2369016384, win 64240, options [mss 1460,sackOK,TS val 325951958 ecr 0,nop,wscale 7], length 0
```

but the significant few bytes changed, cause the destination port  and TCP seq change  when the same packet been resent.
```
0:33:17.012321 mgmt-br Out ifindex 5 00:50:b6:58:58:5a ethertype IPv4 (0x0800), length 130: 192.168.200.56.61408 > 172.24.1.50.8472: OTV, flags [I] (0x08), overlay 0, instance 1
5a:70:ad:45:1a:7d > 0e:8a:81:58:47:46, ethertype IPv4 (0x0800), length 74: 10.52.5.0.57018 > 10.52.0.45.443: Flags [S], seq 3377280572, win 64240, options [mss 1460,sackOK,TS val 325963099 ecr 0,nop,wscale 7], length 0
```

in this case, port `80`  changed to `443` and the seq change from `2369016384` to `3377280572`.

```
        0x0000:  4500 006e f589 0000 4011 4eca c0a8 c838  E..n....@.N....8
        0x0010:  ac18 0132 7959 2118 005a f1ce 0800 0000  ...2yY!..Z......
        0x0020:  0000 0100 0e8a 8158 4746 5a70 ad45 1a7d  .......XGFZp.E.}
        0x0030:  0800 4500 003c c7e8 4000 4006 593f 0a34  ..E..<..@.@.Y?.4
        0x0040:  0500 0a34 002d 1ce2 0050 8d34 5240 0000  ...4.-...P.4R@..
        0x0050:  0000 a002 faf0 6507 0000 0204 05b4 0402  ......e.........
        0x0060:  080a 136d be5f 0000 0000 0103 0307       ...m._........
```
to 
```
        0x0000:  4500 006e f5a4 0000 4011 4eaf c0a8 c838  E..n....@.N....8
        0x0010:  ac18 0132 efe0 2118 005a 1ea6 0800 0000  ...2..!..Z......
        0x0020:  0000 0100 0e8a 8158 4746 5a70 ad45 1a7d  .......XGFZp.E.}
        0x0030:  0800 4500 003c 210a 4000 4006 001e 0a34  ..E..<!.@.@....4
        0x0040:  0500 0a34 002d deba 01bb c94d 363c 0000  ...4.-.....M6<..
        0x0050:  0000 a002 faf0 72b2 0000 0204 05b4 0402  ......r.........
        0x0060:  080a 136d cd5b 0000 0000 0103 0307       ...m.[........
```

**Comment by mingshuoqiu** [comment]
I'll create `vxlan0` interface to see if the same thing happens.

**Comment by mingshuoqiu** [comment]
Created vxlan interface on my Node2 (VLAN 200), and the other vxlan interface on my Management Node (non-VLAN), I didn't observe any bytes been changed after packing the original packet with vxlan header. It might be caused by the flannel interface. Need further investigation. At least vxlan wouldn't be blocked by this issue

**Comment by mingshuoqiu** [comment]
An interesting finding, 
if the first Node is VLAN, then 2nd node can communicate with it either w/ or w/o VLAN. ex. Node 1 in VLAN 100, Node 2 in non-VLAN has no problem. Node 1 in VLAN 200, Node 2 in VLAN 100 also works.

So the only problematic scenario is when Node 1 in non-VLAN and Node 2 in VLAN.

**Comment by mingshuoqiu** [comment]
Can't reproduce with Harvester v1.3.1 anymore. Install worker node from VLAN 100 to connect mgmt url in untagged. fail rate 0/6 times.

**Comment by bk201** [comment]
Close due to can't reproduce.
