### ISSUE TITLE
[BUG/FEATURE] Harvester mgmt network blocks specific HTTPS traffic on attached VLANs

### ISSUE THREAD

**Issue by bcdurden** [harvester/harvester#4359]
**Describe the bug**
Harvester's networking configuration at the node OS level is blocking HTTPS-based traffic coming from an attached VLAN/VM-Network on the Mgmt cluster network when the request occurs from a VM running on the same node. Guest to Host IP traffic blocks 443/https. ICMP/ping is not affected. This issue has been in Harvester since 1.0.3 and I have finally narrowed down where it is being blocked.

I have found that this issue does NOT exist when a second cluster network is added and bound to a second physical device. Traffic doesn't even need to route over this interface, the HTTPS blocking just ceases when this configuration is in play.

**To Reproduce**
1. Install Harvester with only one NIC (the management network)
2. Add a VM/VLAN network and attach it to the management cluster network
3. Create and start a VM (any OS with ping/curl pre-installed is fine) attached to that network
4. SSH/shell into that VM, attempt to curl the Harvester node's IP endpoint that the VM is assigned to (if a multi-node harvester install) see it time out. 
5. Ping the Harvester node's IP and see it succeed.
6. Using TCPdump, view both types of traffic across all interfaces. The curl request fails after the veth, the ping traffic transits the veth, mgmt-bo, mgmt-br, and finally hits the physical device at eno1 where it transits back again.

**Expected behavior**
HTTPS traffic correctly flows when reaching out to the Harvester Node's IP from a VM running on the same Harvester node.

**Support bundle**
Will provide in Slack

**Environment**
 - Harvester ISO version: found in 1.0.3, 1.1.0, 1.1.1, 1.1.2, 1.2.0-rc3
 - Underlying Infrastructure: Present on Minisforum HX90, UM690 and Dell R815

**Additional context**
Curl requests (2x) from 10.10.5.50 (running on node1) to 10.10.0.11 (IP of node1 host)
```bash
> tcpdump -i any dst 10.10.0.11 and src net 10.10.5.50
20:45:31.412577 veth06e7870c P   IP 10.10.5.50.54852 > harbor.sienarfleet.systems.https: Flags [S], seq 3105812379, win 64240, options [mss 1460,sackOK,TS val 3478618003 ecr 0,nop,wscale 7], length 0
20:45:32.421247 veth06e7870c P   IP 10.10.5.50.54852 > harbor.sienarfleet.systems.https: Flags [S], seq 3105812379, win 64240, options [mss 1460,sackOK,TS val 3478619011 ecr 0,nop,wscale 7], length 0
```

ping (1x) from 10.10.5.50 (running on node1) to 10.10.0.11 (IP of node1 host)
```bash
> tcpdump -i any dst 10.10.0.11 and src net 10.10.5.50
20:45:45.894601 veth06e7870c P   IP 10.10.5.50 > harbor.sienarfleet.systems: ICMP echo request, id 17, seq 1, length 64
20:45:45.894608 mgmt-bo Out IP2 (invalid)
20:45:45.894620 mgmt-br P   IP2 (invalid)
20:45:45.894637 eno1  In  IP 10.10.5.50 > harbor.sienarfleet.systems: ICMP echo request, id 17, seq 1, length 64
20:45:45.894638 mgmt-bo In  IP 10.10.5.50 > harbor.sienarfleet.systems: ICMP echo request, id 17, seq 1, length 64
20:45:45.894642 mgmt-br In  IP 10.10.5.50 > harbor.sienarfleet.systems: ICMP echo request, id 17, seq 1, length 64
```

**Comment by yaocw2020** [comment]
Please try to disable `net.bridge.bridge-nf-call-iptables`.
```
sysctl -w net.bridge.bridge-nf-call-iptables=0
```

Here is the related pending PR https://github.com/harvester/network-controller-harvester/pull/83

**Comment by guangbochen** [comment]
Some CNI plugins like Calico rely on the `net.bridge.bridge-nf-call-iptables` config to enable iptables rules for implementing network policies and handle the communication between pods; disabling this on the Harvester management network could have some potential impacts on further CNI update/pod network design changes, and that's why we didn't enable it by default. 

Also, in production env, we recommend using different VLAN network NICs for better network isolation and performance. We can consider adding this as an option to allow users to turn on and off, but it may require to shutdown all VMs and workloads to take effect. 

Move this to v1.3.0 first as a potential candidate.

**Comment by bcdurden** [comment]
> Please try to disable `net.bridge.bridge-nf-call-iptables`.
> 
> ```
> sysctl -w net.bridge.bridge-nf-call-iptables=0
> ```
> 
> Here is the related pending PR [harvester/network-controller-harvester#83](https://github.com/harvester/network-controller-harvester/pull/83)

Is there a way to make this permanent in the meantime on a test machine? I know due to OS immutability the change will be lost upon reboot of the node.

**Comment by iosifnicolae2** [comment]
In our case, we observed that by disabling `net.bridge.bridge-nf-call-iptables`, TCP fragments were not reconstructed in mgmt-br, and the VLAN-tagged packets were delivered correctly. (context: https://rancher-users.slack.com/archives/C01GKHKAG0K/p1692691256324529)

@guangbochen could you please give us some ideas how to permanently solve this problem?

Thank you!

**Comment by iosifnicolae2** [comment]
In our case, we observed that by setting `net.bridge.bridge-nf-call-iptables=1`, TCP fragments coming from `veth` interfaces were reconstructed in `mgmt-br`, and the ping with size 5000 bytes was failing.

@guangbochen, do you happen to know if there are any iptables rules that are triggering TCP fragment reconstruction?

Thank you!

**Comment by mschiu77** [comment]
I setup the environment per the steps described above and can reproduce the same on Harvester v1.2.1. Since the difference is caused by the datagram type, ICMP and HTTP(s), I'm looking into the iptables and turn on the netfilter TRACE to find the cause.

I created 2 VMs, one attached to the mgmt-Network and get the IP 10.52.0.78. The other is attached to the VLAN (attached to the mgmt-Network) with the IP 172.24.100.8 and VID 100. I then add the `iptables` rule `TRACE` to track which rules are applied to http and icmp packet. (https are always communicating between the dashboard and the Host Node, it causes confusion, ignore it in this case)
1. Management URL IP: 172.24.1.9 and make sure the packet comes from `vethxxxx`.
2. `iptables -t raw -A PREROUTING -p icmp -j TRACE`, `iptables -t raw -A PREROUTING -p tcp -dport 80 -j TRACE` and `iptables -t raw -A PREROUTING -p tcp -sport 80 -j TRACE`
3. check dmesg for the rules on ICMP packet. As you see, it goes to `nat:KUBE-SERVICES:rule:33` and is directed to `nat:KUBE-NODEPORTS`.
```
[17359.319526] TRACE: raw:PREROUTING:policy:3 IN=mgmt-br OUT= PHYSIN=vethdf083d51 MAC=74:83:c2:dd:42:56:d6:d2:d6:86:bb:52:08:00 SRC=172.24.100.8 DST=172.24.1.9 LEN=84 TOS=0x00 PREC=0x00 TTL=64 ID=34190 DF PROTO=ICMP TYPE=8 CODE=0 ID=14 SEQ=1
[17359.319534] TRACE: mangle:PREROUTING:rule:1 IN=mgmt-br OUT= PHYSIN=vethdf083d51 MAC=74:83:c2:dd:42:56:d6:d2:d6:86:bb:52:08:00 SRC=172.24.100.8 DST=172.24.1.9 LEN=84 TOS=0x00 PREC=0x00 TTL=64 ID=34190 DF PROTO=ICMP TYPE=8 CODE=0 ID=14 SEQ=1
[17359.319538] TRACE: mangle:cali-PREROUTING:rule:3 IN=mgmt-br OUT= PHYSIN=vethdf083d51 MAC=74:83:c2:dd:42:56:d6:d2:d6:86:bb:52:08:00 SRC=172.24.100.8 DST=172.24.1.9 LEN=84 TOS=0x00 PREC=0x00 TTL=64 ID=34190 DF PROTO=ICMP TYPE=8 CODE=0 ID=14 SEQ=1
[17359.319542] TRACE: mangle:cali-from-host-endpoint:return:1 IN=mgmt-br OUT= PHYSIN=vethdf083d51 MAC=74:83:c2:dd:42:56:d6:d2:d6:86:bb:52:08:00 SRC=172.24.100.8 DST=172.24.1.9 LEN=84 TOS=0x00 PREC=0x00 TTL=64 ID=34190 DF PROTO=ICMP TYPE=8 CODE=0 ID=14 SEQ=1
[17359.319545] TRACE: mangle:cali-PREROUTING:return:5 IN=mgmt-br OUT= PHYSIN=vethdf083d51 MAC=74:83:c2:dd:42:56:d6:d2:d6:86:bb:52:08:00 SRC=172.24.100.8 DST=172.24.1.9 LEN=84 TOS=0x00 PREC=0x00 TTL=64 ID=34190 DF PROTO=ICMP TYPE=8 CODE=0 ID=14 SEQ=1
[17359.319548] TRACE: mangle:PREROUTING:policy:2 IN=mgmt-br OUT= PHYSIN=vethdf083d51 MAC=74:83:c2:dd:42:56:d6:d2:d6:86:bb:52:08:00 SRC=172.24.100.8 DST=172.24.1.9 LEN=84 TOS=0x00 PREC=0x00 TTL=64 ID=34190 DF PROTO=ICMP TYPE=8 CODE=0 ID=14 SEQ=1
[17359.319551] TRACE: nat:PREROUTING:rule:1 IN=mgmt-br OUT= PHYSIN=vethdf083d51 MAC=74:83:c2:dd:42:56:d6:d2:d6:86:bb:52:08:00 SRC=172.24.100.8 DST=172.24.1.9 LEN=84 TOS=0x00 PREC=0x00 TTL=64 ID=34190 DF PROTO=ICMP TYPE=8 CODE=0 ID=14 SEQ=1
[17359.319574] TRACE: nat:cali-PREROUTING:rule:1 IN=mgmt-br OUT= PHYSIN=vethdf083d51 MAC=74:83:c2:dd:42:56:d6:d2:d6:86:bb:52:08:00 SRC=172.24.100.8 DST=172.24.1.9 LEN=84 TOS=0x00 PREC=0x00 TTL=64 ID=34190 DF PROTO=ICMP TYPE=8 CODE=0 ID=14 SEQ=1
[17359.319587] TRACE: nat:cali-fip-dnat:return:1 IN=mgmt-br OUT= PHYSIN=vethdf083d51 MAC=74:83:c2:dd:42:56:d6:d2:d6:86:bb:52:08:00 SRC=172.24.100.8 DST=172.24.1.9 LEN=84 TOS=0x00 PREC=0x00 TTL=64 ID=34190 DF PROTO=ICMP TYPE=8 CODE=0 ID=14 SEQ=1
[17359.319599] TRACE: nat:cali-PREROUTING:return:2 IN=mgmt-br OUT= PHYSIN=vethdf083d51 MAC=74:83:c2:dd:42:56:d6:d2:d6:86:bb:52:08:00 SRC=172.24.100.8 DST=172.24.1.9 LEN=84 TOS=0x00 PREC=0x00 TTL=64 ID=34190 DF PROTO=ICMP TYPE=8 CODE=0 ID=14 SEQ=1
[17359.319601] TRACE: nat:PREROUTING:rule:2 IN=mgmt-br OUT= PHYSIN=vethdf083d51 MAC=74:83:c2:dd:42:56:d6:d2:d6:86:bb:52:08:00 SRC=172.24.100.8 DST=172.24.1.9 LEN=84 TOS=0x00 PREC=0x00 TTL=64 ID=34190 DF PROTO=ICMP TYPE=8 CODE=0 ID=14 SEQ=1
[17359.319611] TRACE: nat:KUBE-SERVICES:rule:33 IN=mgmt-br OUT= PHYSIN=vethdf083d51 MAC=74:83:c2:dd:42:56:d6:d2:d6:86:bb:52:08:00 SRC=172.24.100.8 DST=172.24.1.9 LEN=84 TOS=0x00 PREC=0x00 TTL=64 ID=34190 DF PROTO=ICMP TYPE=8 CODE=0 ID=14 SEQ=1
```
4. check the TRACE of the HTTP packet. It goes to `nat:KUBE-SERVICES:rule:8` instead. And the rules applied after looks unknown to me. 
```
[16526.083663] TRACE: raw:PREROUTING:policy:4 IN=mgmt-br OUT= PHYSIN=vethdf083d51 MAC=74:83:c2:dd:42:56:d6:d2:d6:86:bb:52:08:00 SRC=172.24.100.8 DST=172.24.1.9 LEN=60 TOS=0x00 PREC=0x00 TTL=64 ID=12992 DF PROTO=TCP SPT=36044 DPT=80 SEQ=1680632810 ACK=0 WINDOW=64240 RES=0x00 SYN URGP=0 OPT (020405B40402080AAE2C44780000000001030307)
[16526.083683] TRACE: mangle:PREROUTING:rule:1 IN=mgmt-br OUT= PHYSIN=vethdf083d51 MAC=74:83:c2:dd:42:56:d6:d2:d6:86:bb:52:08:00 SRC=172.24.100.8 DST=172.24.1.9 LEN=60 TOS=0x00 PREC=0x00 TTL=64 ID=12992 DF PROTO=TCP SPT=36044 DPT=80 SEQ=1680632810 ACK=0 WINDOW=64240 RES=0x00 SYN URGP=0 OPT (020405B40402080AAE2C44780000000001030307)
[16526.083693] TRACE: mangle:cali-PREROUTING:rule:3 IN=mgmt-br OUT= PHYSIN=vethdf083d51 MAC=74:83:c2:dd:42:56:d6:d2:d6:86:bb:52:08:00 SRC=172.24.100.8 DST=172.24.1.9 LEN=60 TOS=0x00 PREC=0x00 TTL=64 ID=12992 DF PROTO=TCP SPT=36044 DPT=80 SEQ=1680632810 ACK=0 WINDOW=64240 RES=0x00 SYN URGP=0 OPT (020405B40402080AAE2C44780000000001030307)
[16526.083701] TRACE: mangle:cali-from-host-endpoint:return:1 IN=mgmt-br OUT= PHYSIN=vethdf083d51 MAC=74:83:c2:dd:42:56:d6:d2:d6:86:bb:52:08:00 SRC=172.24.100.8 DST=172.24.1.9 LEN=60 TOS=0x00 PREC=0x00 TTL=64 ID=12992 DF PROTO=TCP SPT=36044 DPT=80 SEQ=1680632810 ACK=0 WINDOW=64240 RES=0x00 SYN URGP=0 OPT (020405B40402080AAE2C44780000000001030307)
[16526.083709] TRACE: mangle:cali-PREROUTING:return:5 IN=mgmt-br OUT= PHYSIN=vethdf083d51 MAC=74:83:c2:dd:42:56:d6:d2:d6:86:bb:52:08:00 SRC=172.24.100.8 DST=172.24.1.9 LEN=60 TOS=0x00 PREC=0x00 TTL=64 ID=12992 DF PROTO=TCP SPT=36044 DPT=80 SEQ=1680632810 ACK=0 WINDOW=64240 RES=0x00 SYN URGP=0 OPT (020405B40402080AAE2C44780000000001030307)
[16526.083716] TRACE: mangle:PREROUTING:policy:2 IN=mgmt-br OUT= PHYSIN=vethdf083d51 MAC=74:83:c2:dd:42:56:d6:d2:d6:86:bb:52:08:00 SRC=172.24.100.8 DST=172.24.1.9 LEN=60 TOS=0x00 PREC=0x00 TTL=64 ID=12992 DF PROTO=TCP SPT=36044 DPT=80 SEQ=1680632810 ACK=0 WINDOW=64240 RES=0x00 SYN URGP=0 OPT (020405B40402080AAE2C44780000000001030307)
[16526.083725] TRACE: nat:PREROUTING:rule:1 IN=mgmt-br OUT= PHYSIN=vethdf083d51 MAC=74:83:c2:dd:42:56:d6:d2:d6:86:bb:52:08:00 SRC=172.24.100.8 DST=172.24.1.9 LEN=60 TOS=0x00 PREC=0x00 TTL=64 ID=12992 DF PROTO=TCP SPT=36044 DPT=80 SEQ=1680632810 ACK=0 WINDOW=64240 RES=0x00 SYN URGP=0 OPT (020405B40402080AAE2C44780000000001030307)
[16526.083763] TRACE: nat:cali-PREROUTING:rule:1 IN=mgmt-br OUT= PHYSIN=vethdf083d51 MAC=74:83:c2:dd:42:56:d6:d2:d6:86:bb:52:08:00 SRC=172.24.100.8 DST=172.24.1.9 LEN=60 TOS=0x00 PREC=0x00 TTL=64 ID=12992 DF PROTO=TCP SPT=36044 DPT=80 SEQ=1680632810 ACK=0 WINDOW=64240 RES=0x00 SYN URGP=0 OPT (020405B40402080AAE2C44780000000001030307)
[16526.083789] TRACE: nat:cali-fip-dnat:return:1 IN=mgmt-br OUT= PHYSIN=vethdf083d51 MAC=74:83:c2:dd:42:56:d6:d2:d6:86:bb:52:08:00 SRC=172.24.100.8 DST=172.24.1.9 LEN=60 TOS=0x00 PREC=0x00 TTL=64 ID=12992 DF PROTO=TCP SPT=36044 DPT=80 SEQ=1680632810 ACK=0 WINDOW=64240 RES=0x00 SYN URGP=0 OPT (020405B40402080AAE2C44780000000001030307)
[16526.083814] TRACE: nat:cali-PREROUTING:return:2 IN=mgmt-br OUT= PHYSIN=vethdf083d51 MAC=74:83:c2:dd:42:56:d6:d2:d6:86:bb:52:08:00 SRC=172.24.100.8 DST=172.24.1.9 LEN=60 TOS=0x00 PREC=0x00 TTL=64 ID=12992 DF PROTO=TCP SPT=36044 DPT=80 SEQ=1680632810 ACK=0 WINDOW=64240 RES=0x00 SYN URGP=0 OPT (020405B40402080AAE2C44780000000001030307)
[16526.083821] TRACE: nat:PREROUTING:rule:2 IN=mgmt-br OUT= PHYSIN=vethdf083d51 MAC=74:83:c2:dd:42:56:d6:d2:d6:86:bb:52:08:00 SRC=172.24.100.8 DST=172.24.1.9 LEN=60 TOS=0x00 PREC=0x00 TTL=64 ID=12992 DF PROTO=TCP SPT=36044 DPT=80 SEQ=1680632810 ACK=0 WINDOW=64240 RES=0x00 SYN URGP=0 OPT (020405B40402080AAE2C44780000000001030307)
```
5. List rules in `nat:KUBE-SERVICES` (`iptables -t nat -L KUBE-SERVICES`), the comment seems meaningful. There're lots of rules for port 80 and 443. Pick up the rule:8 and rule:33 which are applied for our cases. The packet toward 172.24.1.9:80 seems to be redirected to kube loadbalancer. But the ICMP goes with normal path.
```
8    KUBE-EXT-Y6PMQSYEOYJHKCKV  tcp  --  0.0.0.0/0            172.24.1.9           /* kube-system/ingress-expose:http loadbalancer IP */ tcp dpt:80
33   KUBE-NODEPORTS  all  --  0.0.0.0/0            0.0.0.0/0            /* kubernetes service nodeports; NOTE: this must be the last rule in this chain */ ADDRTYPE match dst-type LOCAL
```

Thus the management http server does not receive the request and there's only TCP SYNC from the VM in `tcpdump`.

Don't know the importance of the loadbalancer and how/where the rule:8 be configured. I'll do the same and check why the VM attached to mgmt-Network (w/o VLAN) has no such problem then.

**Comment by mschiu77** [comment]
Observe the VM w/o VLAN and do cross-comparison with the result in https://github.com/harvester/harvester/issues/4359#issuecomment-1855779299, the rules applied on the http traffic from the VM is different. The http packet comes from IN:`calib4a80ade783` instead of IN:`mgmt-br` of VM w/ VLAN. And it's also marked with `0x40000` which should lead to the direction totally different from the VM of the attached VLAN network. 
```
[258184.359252] TRACE: raw:PREROUTING:policy:5 IN=calib4a80ade783 OUT= MAC=ee:ee:ee:ee:ee:ee:a6:68:95:b7:08:f0:08:00 SRC=10.52.0.78 DST=172.24.1.9 LEN=52 TOS=0x00 PREC=0x00 TTL=63 ID=35533 DF PROTO=TCP SPT=35466 DPT=80 SEQ=4120293635 ACK=3280875852 WINDOW=506 RES=0x00 ACK URGP=0 OPT (0101080A5F2F89ED355E64EA) MARK=0x40000 
[258184.359257] TRACE: mangle:PREROUTING:rule:1 IN=calib4a80ade783 OUT= MAC=ee:ee:ee:ee:ee:ee:a6:68:95:b7:08:f0:08:00 SRC=10.52.0.78 DST=172.24.1.9 LEN=52 TOS=0x00 PREC=0x00 TTL=63 ID=35533 DF PROTO=TCP SPT=35466 DPT=80 SEQ=4120293635 ACK=3280875852 WINDOW=506 RES=0x00 ACK URGP=0 OPT (0101080A5F2F89ED355E64EA) MARK=0x40000 
[258184.359262] TRACE: mangle:cali-PREROUTING:rule:1 IN=calib4a80ade783 OUT= MAC=ee:ee:ee:ee:ee:ee:a6:68:95:b7:08:f0:08:00 SRC=10.52.0.78 DST=172.24.1.9 LEN=52 TOS=0x00 PREC=0x00 TTL=63 ID=35533 DF PROTO=TCP SPT=35466 DPT=80 SEQ=4120293635 ACK=3280875852 WINDOW=506 RES=0x00 ACK URGP=0 OPT (0101080A5F2F89ED355E64EA) MARK=0x40000
```

As you see the next applied rule comes with the DST changed from `10.52.0.78` to `10.52.0.26`, which means the DNAT are triggered to mangle the packet.
```
[258184.359267] TRACE: mangle:FORWARD:policy:1 IN=calib4a80ade783 OUT=cali84ca8802d73 MAC=ee:ee:ee:ee:ee:ee:a6:68:95:b7:08:f0:08:00 SRC=10.52.0.78 DST=10.52.0.26 LEN=52 TOS=0x00 PREC=0x00 TTL=62 ID=35533 DF PROTO=TCP SPT=35466 DPT=80 SEQ=4120293635 ACK=3280875852 WINDOW=506 RES=0x00 ACK URGP=0 OPT (0101080A5F2F89ED355E64EA) MARK=0x40000
```
The corresponding entry in `conntrack` is `tcp      6 115 TIME_WAIT src=10.52.0.78 dst=172.24.1.9 sport=36310 dport=80 src=10.52.0.26 dst=172.24.1.7 sport=80 dport=7977 [ASSURED] mark=0 use=1`. It was not there in the VM w/ VLAN case. So it will be treated as a packet to the http server of the same subnet of management network and not required to passed to the NAT table. That's why it never goes to the `loadbalancer` rule described in last comment.  

To fix this problem, I think it's required to mark the packet to differentiate the packets for Management and Kubernetes LoadBalancer. Will check what Load Balancer do first.

**Comment by mschiu77** [comment]
Look into the kubernetes internal, the packet from network which is other than mgmt-Network should be examined by the `nat:PREROUTING` rule:2 which is in charge of `kubernetes service portals`. And the packet should be forwarded to the rule for `harvester-system/harvester-network-webhook:https cluster IP` instead of the fail case `kube-system/ingress-expose: http loadbalancer IP`.
So the `nat:PREROUTING` rule:2 should be examined for how it processes the vlan packet.

**Comment by mschiu77** [comment]
I think the packet from the attached network should be tweaked in the path before packet enter `mgmt-br`. Since the rule of the `harvester-system/harvester-network-webhook:https cluster IP` mentioned in the comment above is `-A KUBE-SERVICES -d 10.53.179.159/32 -p tcp -m comment --comment "harvester-system/harvester-network-webhook:https cluster IP" -m tcp --dport 443 -j KUBE-SVC-JPV4NQAYOMUIOT3S`. It means the rule will only be applied when the dest IP is 10.53.179.159. But I can't find any clue in the packet which leads to this IP. The OPTION filed in the IP packet looks weird to me, but I don't know how to parse it. Need more information about `kube-proxy` or k8s network related process.

**Comment by mingshuoqiu** [comment]
The http(s) request from VLAN should be applied with the DNAT rule. Ex rule 3, 6 of the following chain.
```
num  target     prot opt source               destination         
1    CNI-HOSTPORT-SETMARK  tcp  --  10.52.0.165          0.0.0.0/0            tcp dpt:80
2    CNI-HOSTPORT-SETMARK  tcp  --  127.0.0.1            0.0.0.0/0            tcp dpt:80
3    DNAT       tcp  --  0.0.0.0/0            0.0.0.0/0            tcp dpt:80 to:10.52.0.165:80
4    CNI-HOSTPORT-SETMARK  tcp  --  10.52.0.165          0.0.0.0/0            tcp dpt:443
5    CNI-HOSTPORT-SETMARK  tcp  --  127.0.0.1            0.0.0.0/0            tcp dpt:443
6    DNAT       tcp  --  0.0.0.0/0            0.0.0.0/0            tcp dpt:443 to:10.52.0.165:443
```
ex. The destination IP should be changed from the Harvester's nodeIP to CNI IP. (172.24.1.7 to 10.52.0.165)
```
[  754.459632] TRACE: nat:CNI-DN-9216c21b23a3f7e7d95af:rule:3 IN=mgmt-br OUT= PHYSIN=veth18a1824d MAC=b4:45:06:9f:22:7c:76:c6:6d:01:29:7f:08:00 SRC=172.24.1.11 DST=**172.24.1.7** LEN=60 TOS=0x00 PREC=0x00 TTL=64 ID=64208 DF PROTO=TCP SPT=36646 DPT=80 SEQ=2734212741 ACK=0 WINDOW=64240 RES=0x00 SYN URGP=0 OPT (020405B40402080A2D1BDD250000000001030307) 
[  754.459640] TRACE: mangle:FORWARD:policy:1 IN=mgmt-br OUT=cali84ca8802d73 PHYSIN=veth18a1824d MAC=b4:45:06:9f:22:7c:76:c6:6d:01:29:7f:08:00 SRC=172.24.1.11 DST=**10.52.0.165** LEN=60 TOS=0x00 PREC=0x00 TTL=63 ID=64208 DF PROTO=TCP SPT=36646 DPT=80 SEQ=2734212741 ACK=0 WINDOW=64240 RES=0x00 SYN URGP=0 OPT (020405B40402080A2D1BDD250000000001030307) 
```

But the actual result is that `mangle:FORWARD:policy:1` is not applied to the timeout packet for unknown reason.

**Comment by mingshuoqiu** [comment]
Per the tcpdump, the DNAT rule is correctly applied on the TCP SYN packet as the picture attached. It comes from the `veth` interface and the DST ip address has been replaced from `172.24.1.7` (node's IP) to `10.52.0.81` (internal IP of web service). 
<img width="1044" alt="vlan100_packet" src="https://github.com/harvester/harvester/assets/156634163/b1599f97-dc37-4688-b82e-847726276dc4">

However, the packet in `mgmt-br` has the VLAN header `2543 0006`. According to the routing rule, it should be forwarded to `cali84ca8802`. However, this interface has no VLAN capability to do `untag`. That's the cause of this problem.

For next step, I'll try to add a VLAN interface and add a routing rule based on the DST address. The try to roll it in to generate the rules based con VLAN config.

**Comment by mingshuoqiu** [comment]
Tried lots of different ways (majorly `iptables` and `ip route`), but they are all too complicated. Need to enable VLAN on `calixxxx` first and then add routing rules , `iptables mark` to recognize the VLAN packet and forward to the correct path.

I decide to choose the simplest way, `tc`, to remove the specified VLAN ID from the `ingress` of `mgmt-br`. Since per the comment above, the VLAN header was added to the packet from `vethxxxx` to `mgmt-br`. We just need to remove the `2543 0006` header to make it a valid IP packet.

```
sudo tc qdisc add dev mgmt-br ingress
sudo tc filter add dev mgmt-br ingress basic match 'meta(vlan eq 100)' action vlan pop
```
It will remove the VLAN ID 100 for each coming packet to `mgmt-br` as follow.

<img width="1038" alt="截圖 2024-01-29 晚上8 46 35" src="https://github.com/harvester/harvester/assets/156634163/2c7c4d27-761d-4d73-8011-e965944ca2a8">


The next step is to add corresponding `tc command` when creating the `VM Networks` with VLAN ID in `harvester-network-controller`.

**Comment by tjjh89017** [comment]
> Tried lots of different ways (majorly `iptables` and `ip route`), but they are all too complicated. Need to enable VLAN on `calixxxx` first and then add routing rules , `iptables mark` to recognize the VLAN packet and forward to the correct path.
> 
> I decide to choose the simplest way, `tc`, to remove the specified VLAN ID from the `ingress` of `mgmt-br`. Since per the comment above, the VLAN header was added to the packet from `vethxxxx` to `mgmt-br`. We just need to remove the `2543 0006` header to make it a valid IP packet.
> 
> ```
> sudo tc qdisc add dev mgmt-br ingress
> sudo tc filter add dev mgmt-br ingress basic match 'meta(vlan eq 100)' action vlan pop
> ```
> 
> It will remove the VLAN ID 100 for each coming packet to `mgmt-br` as follow.
> 
> <img alt="截圖 2024-01-29 晚上8 46 35" width="1038" src="https://private-user-images.githubusercontent.com/156634163/300457377-2c7c4d27-761d-4d73-8011-e965944ca2a8.png?jwt=eyJhbGciOiJIUzI1NiIsInR5cCI6IkpXVCJ9.eyJpc3MiOiJnaXRodWIuY29tIiwiYXVkIjoicmF3LmdpdGh1YnVzZXJjb250ZW50LmNvbSIsImtleSI6ImtleTUiLCJleHAiOjE3MDY4NjAyNTAsIm5iZiI6MTcwNjg1OTk1MCwicGF0aCI6Ii8xNTY2MzQxNjMvMzAwNDU3Mzc3LTJjN2M0ZDI3LTc2MWQtNGQ3My04MDExLWU5NjU5NDRjYTJhOC5wbmc_WC1BbXotQWxnb3JpdGhtPUFXUzQtSE1BQy1TSEEyNTYmWC1BbXotQ3JlZGVudGlhbD1BS0lBVkNPRFlMU0E1M1BRSzRaQSUyRjIwMjQwMjAyJTJGdXMtZWFzdC0xJTJGczMlMkZhd3M0X3JlcXVlc3QmWC1BbXotRGF0ZT0yMDI0MDIwMlQwNzQ1NTBaJlgtQW16LUV4cGlyZXM9MzAwJlgtQW16LVNpZ25hdHVyZT1lNzc1MzEyNjY3MDE0ZTkyN2YyYmY1MzI0ODIxYzc5N2JhZmFlNDdiZTAwNGM4YTgxMTQxMzllNDcyNzJlNDg5JlgtQW16LVNpZ25lZEhlYWRlcnM9aG9zdCZhY3Rvcl9pZD0wJmtleV9pZD0wJnJlcG9faWQ9MCJ9.I2EgGYZLbEmYZ3Wm682tmSOrFoNwIhfyPdo6lsKfKKg">
> The next step is to add corresponding `tc command` when creating the `VM Networks` with VLAN ID in `harvester-network-controller`.

Hi @mingshuoqiu 
Could you check the flow is correct?
mgmt-br should be always "untagged" and "vlan-access 1" which means VLAN100 should not directly go to mgmt-br via L2 bridging.
It should go to VLAN100's gateway first, and gateway helps to forward to mgmt-br's IP address.

**Comment by mingshuoqiu** [comment]
@tjjh89017 As you said, the `mgmt-br` should be always untagged. In this case, the packet from `vethxxx` goes to `mgmt-br` and should be routed according to the routing policy, which we expect to be the physical port of VIP. However, the dst IP is replaced with 10.52.x.x, the packet will then goes to the default gateway, by default it should be forwarded to the trunk port with VLAN header removed. That's what `tc filter add dev mgmt-br ingress basic match 'meta(vlan eq 100)' action vlan pop` dose.  And that's why there's no problem in `ping` and `ssh` case since the dst IP address won't be replaced.

**Comment by tjjh89017** [comment]
> @tjjh89017 As you said, the `mgmt-br` should be always untagged. In this case, the packet from `vethxxx` goes to `mgmt-br` and should be routed according to the routing policy, which we expect to be the physical port of VIP. However, the dst IP is replaced with 10.52.x.x, the packet will then goes to the default gateway, by default it should be forwarded to the trunk port with VLAN header removed. That's what `tc filter add dev mgmt-br ingress basic match 'meta(vlan eq 100)' action vlan pop` dose.  And that's why there's no problem in `ping` and `ssh` case since the dst IP address won't be replaced.

Current issue is bridge should not perform vlan change in the state. (You should consider mgmt-br is under VLAN 1 by default.)
So if you use tc to pop vlan header, you will break the flow.

Vlan 100 header should be removed by vlan aware bridge itself with pvid untagged setup.

Those traffic from vlan100 to k8s node itself should be constructed with vlan100 gateway's mac address in dst mac and node ip/vip in dst ip. (because of different subnet)
The flow should be go throught the gateway.

Another thing, harvester allow to setup vlan on node interface which will create mgmt-br.10 with VLAN10
You should consider this as well.

**Comment by mingshuoqiu** [comment]
I agree the additional mgmt-br.${vlan_id} is a correct choice and the vethxxxx created with the same ${vlan_id} should be added to it. But it's easier to use `bridge` command to complete all VLAN settings in a single bridge instead of traditional VLAN sub interfaces with multiple bridge interface.

Also tried same thing before, but it brings more complicated changes, and also introduces some minor inconvenience while user trying to access VMs located at different VLANs from a client w/o multiple VLANs well configured .

As such, the original idea is to `tc vlan pop` on specified traffic targeting to management network to minimize the change/impact, not just removing VLAN headers for all packets coming from different VLANs.

Per your suggestion, I found a simpler command `bridge vlan add vid 100 dev mgmt-br untagged self` to achieve the same. The PVID is still 1, just add vlan id 100 to inform the bridge about how to respond with it. Please advice if there's any concern which is not well considered and addressed. Thanks. 
The VLAN setting would be like as follows
```
port              vlan-id
mgmt-br           1 PVID Egress Untagged
                    state forwarding
                  2-99
                    state forwarding
                  100 Egress Untagged
                    state forwarding
                  101-4094
                    state forwarding
mgmt-bo           1 PVID Egress Untagged
                    state forwarding
                  2-4094
                    state forwarding
veth9b34f481      1 PVID Egress Untagged
                    state forwarding
vethe7e4bc1d      1 Egress Untagged
                    state forwarding
                  100 PVID Egress Untagged
                    state forwarding
```

**Comment by tjjh89017** [comment]
> I agree the additional mgmt-br.${vlan_id} is a correct choice and the vethxxxx created with the same ${vlan_id} should be added to it. But it's easier to use `bridge` command to complete all VLAN settings in a single bridge instead of traditional VLAN sub interfaces with multiple bridge interface.

mgmt-br.X will only be created while installing harvester.
There is only one interface will have Node IP/VIP on the node.
I didn't mean you should create mgmt-br.100 in this case for VLAN 100 traffic.
You should consider that VLAN 100 traffic is not direct connected to the same subnet of mgmt-br.
VLAN 100 traffic to mgmt-br should go through VLAN 100's gateway and gateway help you to forward the traffic to the subnet of mgmt-br.
And this gateway is not implemented in Harvester.
Harvester only provide L2 connectivity for the bridge and VLAN.
Currently, routing part is external gateway's duty.

So the common flow will be 
```
vethe7e4bc1d -> mgmt-br -> ethX -> gateway -> gateway inter-vlan routing -> ethX -> mgmt-br -> mgmt-br's IP address.
```

I think you use nested-VM to test Harvester.
You could try to tcpdump the interfaces of host side.
I think you will get nothing from VLAN100 or vethe7e4bc1d VM.

If you got nothing from the host gateway, and that means SNAT/DNAT is performed too early in bridge.
And that will be related what @yaocw2020 mentioned before.
```
sysctl -w net.bridge.bridge-nf-call-iptables=0
sysctl -w net.bridge.bridge-nf-call-ip6tables=0
```

> Per your suggestion, I found a simpler command bridge vlan add vid 100 dev mgmt-br untagged self to achieve the same. The PVID is still 1, just add vlan id 100 to inform the bridge about how to respond with it. Please advice if there's any concern which is not well considered and addressed. Thanks.
The VLAN setting would be like as follows

You should not setup 2 or more untagged vlan in one port.
In this case, because bridge CNI has an issue, they didn't clean up the "1 Egress Untagged" in the slave port.
So it may work because they will send the traffic all via the vlan1 (not vlan100)
I discussed with CNI maintainer, they will consider to remove the "1 Egress Untagged" issue in the future release.
According to this (https://github.com/containernetworking/plugins/issues/939#issuecomment-1743990957), you better not to rely on this one.

In this case, `vethe7e4bc1d -> mgmt-br` traffic will remove the VLAN100 and treat as VLAN1.
In the reverse path, mgmt-br will use VLAN1 to communicate with vethe7e4bc1d because of PVID=1

**Comment by tjjh89017** [comment]
I used single harvester to test

I create a VM with VLAN 100 (192.168.0.2), Gateway is 192.168.0.1.
Node IP is 172.30.0.132
VIP is 172.30.0.158
test command in VM: `wget 'http://172.30.0.158'`

You could see, in bridge forwarding stage, DNAT have been performed. (please check mgmt-br tcpdump)
DST IP have been change to 10.52.0.25
This is incorrect behavior.
Tcpdump of Gateway will get nothing traffic.

Egress of `veth6cbda250 ` which is VM veth.
You could see the DST IP is still 172.30.0.158

TCPDUMP in Node
````
h1:/home/rancher # tcpdump -vv -n -e -i veth6cbda250 src 192.168.0.2
tcpdump: listening on veth6cbda250, link-type EN10MB (Ethernet), snapshot length 262144 bytes
18:58:10.277046 22:88:c4:b6:35:52 > 00:11:22:33:44:55, ethertype IPv4 (0x0800), length 74: (tos 0x0, ttl 64, id 11758, offset 0, flags [DF], proto TCP (6), length 60)
    192.168.0.2.35922 > 172.30.0.158.80: Flags [S], cksum 0x6d95 (incorrect -> 0x7835), seq 299128905, win 64240, options [mss 1460,sackOK,TS val 3517357836 ecr 0,nop,wscale 7], length 0
18:58:11.295751 22:88:c4:b6:35:52 > 00:11:22:33:44:55, ethertype IPv4 (0x0800), length 74: (tos 0x0, ttl 64, id 11759, offset 0, flags [DF], proto TCP (6), length 60)
    192.168.0.2.35922 > 172.30.0.158.80: Flags [S], cksum 0x6d95 (incorrect -> 0x743b), seq 299128905, win 64240, options [mss 1460,sackOK,TS val 3517358854 ecr 0,nop,wscale 7], length 0
18:58:13.316293 22:88:c4:b6:35:52 > 00:11:22:33:44:55, ethertype IPv4 (0x0800), length 74: (tos 0x0, ttl 64, id 11760, offset 0, flags [DF], proto TCP (6), length 60)
    192.168.0.2.35922 > 172.30.0.158.80: Flags [S], cksum 0x6d95 (incorrect -> 0x6c57), seq 299128905, win 64240, options [mss 1460,sackOK,TS val 3517360874 ecr 0,nop,wscale 7], length 0
^C
3 packets captured
3 packets received by filter
0 packets dropped by kernel
h1:/home/rancher #
h1:/home/rancher # tcpdump -vv -n -e -i mgmt-br src 192.168.0.2
tcpdump: listening on mgmt-br, link-type EN10MB (Ethernet), snapshot length 262144 bytes
18:54:55.587329 22:88:c4:b6:35:52 > 00:0c:29:ad:c6:55, ethertype 802.1Q (0x8100), length 78: vlan 100, p 0, ethertype IPv4 (0x0800), (tos 0x0, ttl 64, id 37760, offset 0, flags [DF], proto TCP (6), length 60)
    192.168.0.2.40582 > 10.52.0.25.80: Flags [S], cksum 0xcb25 (incorrect -> 0x1d93), seq 1994444237, win 64240, options [mss 1460,sackOK,TS val 1081098384 ecr 0,nop,wscale 7], length 0
18:54:56.611773 22:88:c4:b6:35:52 > 00:0c:29:ad:c6:55, ethertype 802.1Q (0x8100), length 78: vlan 100, p 0, ethertype IPv4 (0x0800), (tos 0x0, ttl 64, id 37761, offset 0, flags [DF], proto TCP (6), length 60)
    192.168.0.2.40582 > 10.52.0.25.80: Flags [S], cksum 0xcb25 (incorrect -> 0x1993), seq 1994444237, win 64240, options [mss 1460,sackOK,TS val 1081099408 ecr 0,nop,wscale 7], length 0
18:54:58.623813 22:88:c4:b6:35:52 > 00:0c:29:ad:c6:55, ethertype 802.1Q (0x8100), length 78: vlan 100, p 0, ethertype IPv4 (0x0800), (tos 0x0, ttl 64, id 37762, offset 0, flags [DF], proto TCP (6), length 60)
    192.168.0.2.40582 > 10.52.0.25.80: Flags [S], cksum 0xcb25 (incorrect -> 0x11b6), seq 1994444237, win 64240, options [mss 1460,sackOK,TS val 1081101421 ecr 0,nop,wscale 7], length 0
18:55:02.723771 22:88:c4:b6:35:52 > 00:0c:29:ad:c6:55, ethertype 802.1Q (0x8100), length 78: vlan 100, p 0, ethertype IPv4 (0x0800), (tos 0x0, ttl 64, id 37763, offset 0, flags [DF], proto TCP (6), length 60)
    192.168.0.2.40582 > 10.52.0.25.80: Flags [S], cksum 0xcb25 (incorrect -> 0x01b3), seq 1994444237, win 64240, options [mss 1460,sackOK,TS val 1081105520 ecr 0,nop,wscale 7], length 0
^C
4 packets captured
4 packets received by filter
0 packets dropped by kernel
````

---

If we config `sysctl -w net.bridge.bridge-nf-call-iptables=0`
and you will see DNAT will not performed in bridge forwarding stage and the DST MAC is the Gateway MAC address (00:11:22:33:44:55). It will send the traffic to the gateway, and gateway will help you to send it to mgmt-br back.

TCPDUMP in Node (`sysctl -w net.bridge.bridge-nf-call-iptables=0`)
````
h1:/home/rancher # tcpdump -vv -n -e -i veth6cbda250 src 192.168.0.2
tcpdump: listening on veth6cbda250, link-type EN10MB (Ethernet), snapshot length 262144 bytes
18:59:48.927924 22:88:c4:b6:35:52 > 00:11:22:33:44:55, ethertype ARP (0x0806), length 42: Ethernet (len 6), IPv4 (len 4), Reply 192.168.0.2 is-at 22:88:c4:b6:35:52, length 28
18:59:50.455285 22:88:c4:b6:35:52 > 00:11:22:33:44:55, ethertype IPv4 (0x0800), length 74: (tos 0x0, ttl 64, id 18097, offset 0, flags [DF], proto TCP (6), length 60)
    192.168.0.2.48668 > 172.30.0.158.80: Flags [S], cksum 0x6d95 (incorrect -> 0x32e5), seq 1933869835, win 64240, options [mss 1460,sackOK,TS val 3517458014 ecr 0,nop,wscale 7], length 0
18:59:51.455743 22:88:c4:b6:35:52 > 00:11:22:33:44:55, ethertype IPv4 (0x0800), length 74: (tos 0x0, ttl 64, id 18098, offset 0, flags [DF], proto TCP (6), length 60)
    192.168.0.2.48668 > 172.30.0.158.80: Flags [S], cksum 0x6d95 (incorrect -> 0x2efc), seq 1933869835, win 64240, options [mss 1460,sackOK,TS val 3517459015 ecr 0,nop,wscale 7], length 0
^C
3 packets captured
3 packets received by filter
0 packets dropped by kernel
h1:/home/rancher # tcpdump -vv -n -e -i mgmt-br src 192.168.0.2
tcpdump: listening on mgmt-br, link-type EN10MB (Ethernet), snapshot length 262144 bytes
18:59:55.587892 22:88:c4:b6:35:52 > 00:11:22:33:44:55, ethertype 802.1Q (0x8100), length 46: vlan 100, p 0, ethertype ARP (0x0806), Ethernet (len 6), IPv4 (len 4), Request who-has 192.168.0.1 tell 192.168.0.2, length 28
18:59:56.512516 22:88:c4:b6:35:52 > 00:11:22:33:44:55, ethertype 802.1Q (0x8100), length 78: vlan 100, p 0, ethertype IPv4 (0x0800), (tos 0x0, ttl 64, id 24213, offset 0, flags [DF], proto TCP (6), length 60)
    192.168.0.2.47410 > 172.30.0.158.80: Flags [S], cksum 0x6d95 (incorrect -> 0x99ad), seq 2399268294, win 64240, options [mss 1460,sackOK,TS val 3517464071 ecr 0,nop,wscale 7], length 0
18:59:57.535900 22:88:c4:b6:35:52 > 00:11:22:33:44:55, ethertype 802.1Q (0x8100), length 78: vlan 100, p 0, ethertype IPv4 (0x0800), (tos 0x0, ttl 64, id 24214, offset 0, flags [DF], proto TCP (6), length 60)
    192.168.0.2.47410 > 172.30.0.158.80: Flags [S], cksum 0x6d95 (incorrect -> 0x95ae), seq 2399268294, win 64240, options [mss 1460,sackOK,TS val 3517465094 ecr 0,nop,wscale 7], length 0
^C
3 packets captured
3 packets received by filter
0 packets dropped by kernel
h1:/home/rancher #
````

**Comment by mingshuoqiu** [comment]
Could you brief how you setup your VLAN testing environment?
In my setup, I have a external gateway to handle different VLAN and DHCP server serves different VLANs. Basically the VLAN routing is handled by the gateway.
In my test case, I simply created 2 `VM Network`s attached to the same mgmt network. The HTTP(S) will be treated specially by `DNAT` based on the `iptables` rules. To achieve what you suggest (different subnet), I should create another cluster network (this should generate mgmt-br.X?) and attach different VLAN on it, then try the same use case again, right?

**Comment by mingshuoqiu** [comment]
This is the tcpdump flow of the VLAN 100 after applying `bridge vlan add vid 100 dev mgmt-br untagged self`. 

```
listening on any, link-type LINUX_SLL2 (Linux cooked v2), snapshot length 262144 bytes
02:53:37.386331 vethb11cd5d4 P   IP 172.24.100.10.35732 > 172.24.1.7.80: Flags [S], seq 507374968, win 64240, options [mss 1460,sackOK,TS val 1682272090 ecr 0,nop,wscale 7], length 0
02:53:37.386371 mgmt-br In  IP 172.24.100.10.35732 > 10.52.0.203.80: Flags [S], seq 507374968, win 64240, options [mss 1460,sackOK,TS val 1682272090 ecr 0,nop,wscale 7], length 0
02:53:37.386395 cali84ca8802d73 Out IP 172.24.100.10.35732 > 10.52.0.203.80: Flags [S], seq 507374968, win 64240, options [mss 1460,sackOK,TS val 1682272090 ecr 0,nop,wscale 7], length 0
02:53:37.386425 cali84ca8802d73 In  IP 10.52.0.203.80 > 172.24.100.10.35732: Flags [S.], seq 3120895161, ack 507374969, win 64308, options [mss 1410,sackOK,TS val 1619845816 ecr 1682272090,nop,wscale 7], length 0
02:53:37.386439 mgmt-br Out IP 172.24.1.7.80 > 172.24.100.10.35732: Flags [S.], seq 3120895161, ack 507374969, win 64308, options [mss 1410,sackOK,TS val 1619845816 ecr 1682272090,nop,wscale 7], length 0
02:53:37.386445 mgmt-bo Out IP 172.24.1.7.80 > 172.24.100.10.35732: Flags [S.], seq 3120895161, ack 507374969, win 64308, options [mss 1410,sackOK,TS val 1619845816 ecr 1682272090,nop,wscale 7], length 0
02:53:37.386448 enp1s0 Out IP 172.24.1.7.80 > 172.24.100.10.35732: Flags [S.], seq 3120895161, ack 507374969, win 64308, options [mss 1410,sackOK,TS val 1619845816 ecr 1682272090,nop,wscale 7], length 0
02:53:37.386704 enp1s0 P   IP bad-hlen 8
02:53:37.386706 mgmt-bo P   IP bad-hlen 8
02:53:37.386713 vethb11cd5d4 Out IP 172.24.1.7.80 > 172.24.100.10.35732: Flags [S.], seq 3120895161, ack 507374969, win 64308, options [mss 1410,sackOK,TS val 1619845816 ecr 1682272090,nop,wscale 7], length 0
02:53:37.386716 mgmt-br P   IP 172.24.1.7.80 > 172.24.100.10.35732: Flags [S.], seq 3120895161, ack 507374969, win 64308, options [mss 1410,sackOK,TS val 1619845816 ecr 1682272090,nop,wscale 7], length 0
```

**Comment by tjjh89017** [comment]
> Could you brief how you setup your VLAN testing environment?
In my setup, I have a external gateway to handle different VLAN and DHCP server serves different VLANs. Basically the VLAN routing is handled by the gateway.

According your description, your setup is correct.

> In my test case, I simply created 2 VM Networks attached to the same mgmt network. The HTTP(S) will be treated specially by DNAT based on the iptables rules. To achieve what you suggest (different subnet), I should create another cluster network (this should generate mgmt-br.X?) and attach different VLAN on it, then try the same use case again, right?

About mgmt-br.X
Please refer this issue https://github.com/harvester/harvester/issues/1390#issuecomment-1260993766 and PR https://github.com/harvester/harvester-installer/pull/278
mgmt-br.X is not related to clusterNetwork.
That is installation stage's mgmt interface.
If you are confused, please ignore mgmt-br.X case first.

**Comment by mingshuoqiu** [comment]
Since the `mgmt-br` is not simply a layer 2 bridge, k8s tries to implement full-funtion networking in the `mgmt-br` which contains the functions of `router`, `switch`, `endpoint`. That's why I still need `iptables` hook in the bridge to simulate routing. The `mgmt-br` interface should be considered as a gateway between the VM networks and the real-world external network. So I think every egress packet of mgmt-br should be VLAN free and the routing should be determine by the outside world. 

Also setup another Cluster (Cluster2) with the VLAN tagged interface as the management interface (vid 200). I can http(s) the Cluster1's management URL from the VM in the Cluster 2.

VM1 of Cluster1: 172.24.100.16 (vid 100)
Node's IP of Cluster2: 192.168.200.29 (vid 200)
request:
```
VM1 (Cluster1 vid 100) -> external switch/gateway -> ethX (Cluster2 vlan 200 tagged) -> mgmt-bo (vlan 200 tagged) -> mgmt-br (vlan 200 tagged) ->  mgmt-br.200 (vlan untagged) -> calixxx (dst IP DNAT'd 192.168.200.29 -> 10.52.x.x)
```

response:
```
calixxx -> mgmt-br.200 (src IP SNAT'd 10.52.x.x -> 192.168.200.29) -> mgmt-br (Cluster 2 vlan 200 tagged) -> mgmt-bo (vlan 200 tagged) -> ethX (vlan 200 tagged) -> external switch/gateway -> VM1 (Cluster 1 vid 100) 
```

But I still fail to http(s) the Cluster 2's management URL from the VM of Cluster2. The http(s) request comes from `veth`, and is applied with the iptable rule of DNAT. The `mgmt-br` should use PVID 200 to tag the packet and forward to mgmt-br, but it's not seen from `tcpdump -i mgmt-br` for unknown reason. In the case of https://github.com/harvester/harvester/issues/4359#issuecomment-1914628361, I can at least see the tagged packet in the `mgmt-br`. I also expect to see the tagged packet in Cluster2's mgmt-br since the `veth` is already configured as a port of mgmt-br with PVID 200. Need to find out where the packet goes.

**Comment by tjjh89017** [comment]
By the way, please mind that Harvester enable "promiscMode" in CNI config by default.

**Comment by mingshuoqiu** [comment]
Need the https://github.com/harvester/network-controller-harvester/pull/83 to be approved. We may need to evaluate the risk first.

**Comment by mingshuoqiu** [comment]
The solution in https://github.com/harvester/network-controller-harvester/pull/119 
 doesn't fix the issue and introduce another https://github.com/harvester/harvester/issues/6747. Need to fix it for the issue.

**Comment by bcdurden** [comment]
Another issue introduced with the fix above is the cluster cidr subnet used within Harvester for VMs (10.52.0.0/24 as opposed to 10.52.0.0/16) is failing to delete/remove IP reservations.

I ran into an issue last week where I ran out of IPs in the 10.52.0.0/24 range. Inspecting the `/var/lib/cni` directory on the nodes showed me all IPs had been reserved and persisted through reboots despite many services not using them. Many of the IP reservations had been there for months.

**Comment by starbops** [comment]
@bcdurden Would you please elaborate why you think this is related to setting bridge-nf-call-iptables to 0? Thanks.

**Comment by bcdurden** [comment]
Nearly all of the chatter I saw regarding this issue had to do with issues
in iptables. It's possible that the need for applying the command on every
restart caused some thrashing that affected Harvester's ability to do
proper CRUD operations on the node host volume.

I never got the setting into a proper sysctl config due to the immutable
nature of sle micro, even when using elemental the command/setting seemed
to get overridden at some stage. I never ran into this issue on my edge kit
which is rebuilt every few weeks, only in my lab which is more permanent
(but still shutdown at night for power savings).

**Comment by starbops** [comment]
This one is a bit tricky. Not only does the immutable nature of SLE Micro reset every configuration you've made, but RKE2 itself also sets the kernel tunable to `1` at every start. We know this is frustrating, but we're planning to fix this as a whole in future releases. Hopefully, you won't be bothered by this issue anymore. Please refer to [this issue](https://github.com/harvester/harvester/issues/7041) for more details.

As for the workaround (and to persist the changes), here's some suggestions: https://github.com/harvester/harvester/issues/7097#issuecomment-2522075054

**Comment by bcdurden** [comment]
> @bcdurden Would you please elaborate why you think this is related to setting bridge-nf-call-iptables to 0? Thanks.

After returning from Christmas break, I've found my lab is now back in this state again. Calico cannot reserve IPs and so random services cannot run. The support bundle is not generating and I suspect it is due to a pod not running. Apologies for the long comment but I figure you want logs at least.

Here is events from a longhorn backing image manager instance that will not start (preventing VMs and services from starting):

```console
  Warning  FailedCreatePodSandBox  90s   kubelet  Failed to create pod sandbox: rpc error: code = Unknown desc = failed to setup network for sandbox "420a853cb23f48ead1f4ddeb3bf886d33062856078722506e8d7c92108161d51": plugin type="multus" name="multus-cni-network" failed (add): [longhorn-system/backing-image-manager-5ae6-6160/7e742673-3ea4-4dcf-9221-75035f172cbc:k8s-pod-network]: error adding container to network "k8s-pod-network": plugin type="calico" failed (add): failed to allocate for range 0: no IP addresses available in range set: 10.52.0.1-10.52.0.254
  Warning  FailedCreatePodSandBox  90s   kubelet  Failed to create pod sandbox: rpc error: code = Unknown desc = failed to setup network for sandbox "26afc5ecffb10f19317a023f9240f37425c88760ad051ee9e3defb340d638042": plugin type="multus" name="multus-cni-network" failed (add): [longhorn-system/backing-image-manager-5ae6-6160/7e742673-3ea4-4dcf-9221-75035f172cbc:k8s-pod-network]: error adding container to network "k8s-pod-network": plugin type="calico" failed (add): failed to allocate for range 0: no IP addresses available in range set: 10.52.0.1-10.52.0.254
  Warning  FailedCreatePodSandBox  75s   kubelet  Failed to create pod sandbox: rpc error: code = Unknown desc = failed to setup network for sandbox "7e1fb949f21743aafaa6808a5be69baf4323d1b83c46f86623aa51e5ef8704fa": plugin type="multus" name="multus-cni-network" failed (add): [longhorn-system/backing-image-manager-5ae6-6160/7e742673-3ea4-4dcf-9221-75035f172cbc:k8s-pod-network]: error adding container to network "k8s-pod-network": plugin type="calico" failed (add): failed to allocate for range 0: no IP addresses available in range set: 10.52.0.1-10.52.0.254
  Warning  FailedCreatePodSandBox  61s   kubelet  Failed to create pod sandbox: rpc error: code = Unknown desc = failed to setup network for sandbox "3720beeae51061be22d681260441008d64005c423d299e28ec1227696e0f0889": plugin type="multus" name="multus-cni-network" failed (add): [longhorn-system/backing-image-manager-5ae6-6160/7e742673-3ea4-4dcf-9221-75035f172cbc:k8s-pod-network]: error adding container to network "k8s-pod-network": plugin type="calico" failed (add): failed to allocate for range 0: no IP addresses available in range set: 10.52.0.1-10.52.0.254
  Warning  FailedCreatePodSandBox  50s   kubelet  Failed to create pod sandbox: rpc error: code = Unknown desc = failed to setup network for sandbox "ac42e829584b718720cff595fa6f74c1e549c36d9b620c29c67676800a961e9e": plugin type="multus" name="multus-cni-network" failed (add): [longhorn-system/backing-image-manager-5ae6-6160/7e742673-3ea4-4dcf-9221-75035f172cbc:k8s-pod-network]: error adding container to network "k8s-pod-network": plugin type="calico" failed (add): failed to allocate for range 0: no IP addresses available in range set: 10.52.0.1-10.52.0.254
  Warning  FailedCreatePodSandBox  38s   kubelet  Failed to create pod sandbox: rpc error: code = Unknown desc = failed to setup network for sandbox "8bc1e3db8460ab63520250ae6b766a14e8a50215498e3715297ad55a6d822ba5": plugin type="multus" name="multus-cni-network" failed (add): [longhorn-system/backing-image-manager-5ae6-6160/7e742673-3ea4-4dcf-9221-75035f172cbc:k8s-pod-network]: error adding container to network "k8s-pod-network": plugin type="calico" failed (add): failed to allocate for range 0: no IP addresses available in range set: 10.52.0.1-10.52.0.254
  Warning  FailedCreatePodSandBox  22s   kubelet  Failed to create pod sandbox: rpc error: code = Unknown desc = failed to setup network for sandbox "dcd7d942940825714a286a211e3459fe21c36466fe492993aa3c1a3f2409b5ac": plugin type="multus" name="multus-cni-network" failed (add): [longhorn-system/backing-image-manager-5ae6-6160/7e742673-3ea4-4dcf-9221-75035f172cbc:k8s-pod-network]: error adding container to network "k8s-pod-network": plugin type="calico" failed (add): failed to allocate for range 0: no IP addresses available in range set: 10.52.0.1-10.52.0.254
  Warning  FailedCreatePodSandBox  8s    kubelet  Failed to create pod sandbox: rpc error: code = Unknown desc = failed to setup network for sandbox "e2c6ef5523a99549847d35c44aab1557fe767f830582520eeec9aeedb2b082e2": plugin type="multus" name="multus-cni-network" failed (add): [longhorn-system/backing-image-manager-5ae6-6160/7e742673-3ea4-4dcf-9221-75035f172cbc:k8s-pod-network]: error adding container to network "k8s-pod-network": plugin type="calico" failed (add): failed to allocate for range 0: no IP addresses available in range set: 10.52.0.1-10.52.0.254
```

Here's the contents of my `/var/lib/cni` directory on one of my nodes. Note the dates. These nodes shut down at 11pm every night and are started at 7am in the morning to conserve power.
```console
lab0:/var/lib/cni/networks/k8s-pod-network # ls -l
total 1016
-rw------- 1 root root 70 Dec  2 12:05 10.52.0.10
-rw------- 1 root root 70 Dec 24 12:05 10.52.0.100
-rw------- 1 root root 70 Nov 27 12:03 10.52.0.101
-rw------- 1 root root 70 Nov 27 12:03 10.52.0.102
-rw------- 1 root root 70 Nov 27 12:04 10.52.0.103
-rw------- 1 root root 70 Nov 27 12:04 10.52.0.104
-rw------- 1 root root 70 Nov 27 12:04 10.52.0.105
-rw------- 1 root root 70 Nov 27 12:04 10.52.0.106
-rw------- 1 root root 70 Nov 27 12:04 10.52.0.107
-rw------- 1 root root 70 Nov 27 12:04 10.52.0.108
-rw------- 1 root root 70 Nov 27 12:04 10.52.0.109
-rw------- 1 root root 70 Dec 28 12:04 10.52.0.11
-rw------- 1 root root 70 Nov 27 12:04 10.52.0.110
-rw------- 1 root root 70 Nov 27 12:04 10.52.0.111
-rw------- 1 root root 70 Nov 27 12:04 10.52.0.112
-rw------- 1 root root 70 Nov 27 12:04 10.52.0.113
-rw------- 1 root root 70 Nov 27 12:04 10.52.0.114
-rw------- 1 root root 70 Nov 27 12:04 10.52.0.115
-rw------- 1 root root 70 Nov 27 12:04 10.52.0.116
-rw------- 1 root root 70 Nov 27 12:04 10.52.0.117
-rw------- 1 root root 70 Nov 27 12:04 10.52.0.118
-rw------- 1 root root 70 Nov 27 12:04 10.52.0.119
-rw------- 1 root root 70 Jan  6 12:05 10.52.0.12
-rw------- 1 root root 70 Dec 24 12:05 10.52.0.120
-rw------- 1 root root 70 Nov 27 12:04 10.52.0.121
-rw------- 1 root root 70 Nov 27 12:04 10.52.0.122
-rw------- 1 root root 70 Dec 14 12:52 10.52.0.123
-rw------- 1 root root 70 Nov 27 12:04 10.52.0.124
-rw------- 1 root root 70 Nov 27 12:04 10.52.0.125
-rw------- 1 root root 70 Jan  6 12:05 10.52.0.126
-rw------- 1 root root 70 Nov 27 12:04 10.52.0.127
-rw------- 1 root root 70 Nov 27 12:04 10.52.0.128
-rw------- 1 root root 70 Nov 27 12:04 10.52.0.129
-rw------- 1 root root 70 Dec 27 12:04 10.52.0.13
-rw------- 1 root root 70 Nov 27 12:04 10.52.0.130
-rw------- 1 root root 70 Jan  6 12:05 10.52.0.131
-rw------- 1 root root 70 Nov 17 12:06 10.52.0.132
-rw------- 1 root root 70 Nov 17 12:06 10.52.0.133
-rw------- 1 root root 70 Nov 17 12:06 10.52.0.134
-rw------- 1 root root 70 Nov 27 12:04 10.52.0.135
-rw------- 1 root root 70 Dec 17 12:05 10.52.0.136
-rw------- 1 root root 70 Nov 27 12:04 10.52.0.137
-rw------- 1 root root 70 Nov 27 12:04 10.52.0.138
-rw------- 1 root root 70 Nov 27 12:04 10.52.0.139
-rw------- 1 root root 70 Dec 27 12:04 10.52.0.14
-rw------- 1 root root 70 Nov 27 12:04 10.52.0.140
-rw------- 1 root root 70 Nov 27 12:04 10.52.0.141
-rw------- 1 root root 70 Dec 17 12:05 10.52.0.142
-rw------- 1 root root 70 Dec 17 12:05 10.52.0.143
-rw------- 1 root root 70 Nov 27 12:04 10.52.0.144
-rw------- 1 root root 70 Dec 28 12:04 10.52.0.145
-rw------- 1 root root 70 Nov 27 12:04 10.52.0.146
-rw------- 1 root root 70 Nov 27 12:04 10.52.0.147
-rw------- 1 root root 70 Dec 28 12:04 10.52.0.148
-rw------- 1 root root 70 Dec 28 12:04 10.52.0.149
-rw------- 1 root root 70 Dec 26 12:05 10.52.0.15
-rw------- 1 root root 70 Jan  6 12:05 10.52.0.150
-rw------- 1 root root 70 Jan  6 12:05 10.52.0.151
-rw------- 1 root root 70 Jan  6 12:05 10.52.0.152
-rw------- 1 root root 70 Nov 30 12:05 10.52.0.153
-rw------- 1 root root 70 Nov 30 12:05 10.52.0.154
-rw------- 1 root root 70 Nov 30 12:05 10.52.0.155
-rw------- 1 root root 70 Dec 17 20:17 10.52.0.156
-rw------- 1 root root 70 Dec 29 12:05 10.52.0.157
-rw------- 1 root root 70 Dec  6 12:04 10.52.0.158
-rw------- 1 root root 70 Dec  6 12:04 10.52.0.159
-rw------- 1 root root 70 Jan  6 12:04 10.52.0.16
-rw------- 1 root root 70 Nov 27 12:07 10.52.0.160
-rw------- 1 root root 70 Nov 27 12:07 10.52.0.161
-rw------- 1 root root 70 Dec  6 12:04 10.52.0.162
-rw------- 1 root root 70 Jan  6 12:05 10.52.0.163
-rw------- 1 root root 70 Jan  6 12:05 10.52.0.164
-rw------- 1 root root 70 Jan  5 12:05 10.52.0.165
-rw------- 1 root root 70 Jan  6 12:05 10.52.0.166
-rw------- 1 root root 70 Jan  6 12:06 10.52.0.167
-rw------- 1 root root 70 Jan  6 12:05 10.52.0.168
-rw------- 1 root root 70 Nov 30 12:05 10.52.0.169
-rw------- 1 root root 70 Jan  6 12:05 10.52.0.17
-rw------- 1 root root 70 Nov 27 12:07 10.52.0.170
-rw------- 1 root root 70 Nov 27 12:07 10.52.0.171
-rw------- 1 root root 70 Nov 30 12:05 10.52.0.172
-rw------- 1 root root 70 Jan  5 12:05 10.52.0.173
-rw------- 1 root root 70 Jan  6 12:08 10.52.0.174
-rw------- 1 root root 70 Jan  6 12:10 10.52.0.175
-rw------- 1 root root 70 Jan  6 12:05 10.52.0.176
-rw------- 1 root root 70 Jan  6 12:05 10.52.0.177
-rw------- 1 root root 70 Jan  2 12:04 10.52.0.178
-rw------- 1 root root 70 Nov 23 12:04 10.52.0.179
-rw------- 1 root root 70 Dec 26 12:05 10.52.0.18
-rw------- 1 root root 70 Nov 20 12:05 10.52.0.180
-rw------- 1 root root 70 Nov 23 12:04 10.52.0.181
-rw------- 1 root root 70 Nov 20 12:05 10.52.0.182
-rw------- 1 root root 70 Nov 18 12:05 10.52.0.183
-rw------- 1 root root 70 Nov 18 12:05 10.52.0.184
-rw------- 1 root root 70 Nov 20 12:05 10.52.0.185
-rw------- 1 root root 70 Nov 18 12:05 10.52.0.186
-rw------- 1 root root 70 Dec 23 12:05 10.52.0.187
-rw------- 1 root root 70 Nov 23 12:05 10.52.0.188
-rw------- 1 root root 70 Dec 23 12:05 10.52.0.189
-rw------- 1 root root 70 Jan  5 12:05 10.52.0.19
-rw------- 1 root root 70 Dec 16 12:05 10.52.0.190
-rw------- 1 root root 70 Dec 16 12:05 10.52.0.191
-rw------- 1 root root 70 Dec 23 12:05 10.52.0.192
-rw------- 1 root root 70 Dec 16 12:05 10.52.0.193
-rw------- 1 root root 70 Dec 23 12:05 10.52.0.194
-rw------- 1 root root 70 Jan  6 12:05 10.52.0.195
-rw------- 1 root root 70 Dec 28 12:04 10.52.0.196
-rw------- 1 root root 70 Jan  6 12:05 10.52.0.197
-rw------- 1 root root 70 Dec 28 12:04 10.52.0.198
-rw------- 1 root root 70 Dec 28 12:04 10.52.0.199
-rw------- 1 root root 70 Dec 27 12:04 10.52.0.2
-rw------- 1 root root 70 Dec 26 12:05 10.52.0.20
-rw------- 1 root root 70 Dec 28 12:04 10.52.0.200
-rw------- 1 root root 70 Jan  6 12:05 10.52.0.201
-rw------- 1 root root 70 Jan  6 12:06 10.52.0.202
-rw------- 1 root root 70 Dec  1 12:04 10.52.0.203
-rw------- 1 root root 70 Dec  1 12:04 10.52.0.204
-rw------- 1 root root 70 Dec 15 12:04 10.52.0.205
-rw------- 1 root root 70 Dec  1 12:04 10.52.0.206
-rw------- 1 root root 70 Dec 15 12:04 10.52.0.207
-rw------- 1 root root 70 Jan  5 12:05 10.52.0.208
-rw------- 1 root root 70 Dec 15 12:04 10.52.0.209
-rw------- 1 root root 70 Jan  6 12:05 10.52.0.21
-rw------- 1 root root 70 Dec 15 12:04 10.52.0.210
-rw------- 1 root root 70 Dec 28 12:04 10.52.0.211
-rw------- 1 root root 70 Dec 15 00:57 10.52.0.212
-rw------- 1 root root 70 Dec 15 00:57 10.52.0.213
-rw------- 1 root root 70 Dec  1 12:05 10.52.0.214
-rw------- 1 root root 70 Dec  1 12:05 10.52.0.215
-rw------- 1 root root 70 Dec  1 12:05 10.52.0.216
-rw------- 1 root root 70 Jan  2 12:04 10.52.0.217
-rw------- 1 root root 70 Jan  6 12:05 10.52.0.218
-rw------- 1 root root 70 Dec 13 12:05 10.52.0.219
-rw------- 1 root root 70 Jan  6 12:06 10.52.0.22
-rw------- 1 root root 70 Dec  1 12:05 10.52.0.220
-rw------- 1 root root 70 Nov 29 12:04 10.52.0.221
-rw------- 1 root root 70 Nov 29 12:04 10.52.0.222
-rw------- 1 root root 70 Jan  6 12:05 10.52.0.223
-rw------- 1 root root 70 Nov 25 12:05 10.52.0.224
-rw------- 1 root root 70 Nov 25 12:05 10.52.0.225
-rw------- 1 root root 70 Nov 25 12:05 10.52.0.226
-rw------- 1 root root 70 Dec 13 12:06 10.52.0.227
-rw------- 1 root root 70 Dec 13 12:06 10.52.0.228
-rw------- 1 root root 70 Nov 25 12:05 10.52.0.229
-rw------- 1 root root 70 Jan  6 12:06 10.52.0.23
-rw------- 1 root root 70 Dec 14 12:37 10.52.0.230
-rw------- 1 root root 70 Dec 14 12:37 10.52.0.231
-rw------- 1 root root 70 Jan  6 12:05 10.52.0.232
-rw------- 1 root root 70 Jan  6 12:05 10.52.0.233
-rw------- 1 root root 70 Dec  7 12:06 10.52.0.234
-rw------- 1 root root 70 Nov 29 12:06 10.52.0.235
-rw------- 1 root root 70 Dec  7 12:06 10.52.0.236
-rw------- 1 root root 70 Nov 29 12:06 10.52.0.237
-rw------- 1 root root 70 Nov 29 12:06 10.52.0.238
-rw------- 1 root root 70 Dec  7 12:06 10.52.0.239
-rw------- 1 root root 70 Jan  6 12:05 10.52.0.24
-rw------- 1 root root 70 Dec  7 12:06 10.52.0.240
-rw------- 1 root root 70 Nov 19 12:04 10.52.0.241
-rw------- 1 root root 70 Nov 19 12:04 10.52.0.242
-rw------- 1 root root 70 Nov 19 12:04 10.52.0.243
-rw------- 1 root root 70 Nov 19 12:05 10.52.0.244
-rw------- 1 root root 70 Nov 19 12:05 10.52.0.245
-rw------- 1 root root 70 Dec  7 12:06 10.52.0.246
-rw------- 1 root root 70 Jan  6 12:05 10.52.0.247
-rw------- 1 root root 70 Dec 28 12:04 10.52.0.248
-rw------- 1 root root 70 Nov 28 12:35 10.52.0.249
-rw------- 1 root root 70 Dec 13 17:03 10.52.0.25
-rw------- 1 root root 70 Nov 28 12:35 10.52.0.250
-rw------- 1 root root 70 Dec 29 12:05 10.52.0.251
-rw------- 1 root root 70 Jan  6 12:05 10.52.0.252
-rw------- 1 root root 70 Dec 14 12:46 10.52.0.253
-rw------- 1 root root 70 Dec 14 12:46 10.52.0.254
-rw------- 1 root root 70 Dec 13 17:03 10.52.0.26
-rw------- 1 root root 70 Dec  4 12:04 10.52.0.27
-rw------- 1 root root 70 Jan  6 12:05 10.52.0.28
-rw------- 1 root root 70 Dec  4 12:04 10.52.0.29
-rw------- 1 root root 70 Dec  2 12:04 10.52.0.3
-rw------- 1 root root 70 Nov 21 12:04 10.52.0.30
-rw------- 1 root root 70 Dec  4 12:04 10.52.0.31
-rw------- 1 root root 70 Jan  5 12:05 10.52.0.32
-rw------- 1 root root 70 Jan  6 12:05 10.52.0.33
-rw------- 1 root root 70 Dec 29 12:05 10.52.0.34
-rw------- 1 root root 70 Dec 28 12:04 10.52.0.35
-rw------- 1 root root 70 Dec 13 17:03 10.52.0.36
-rw------- 1 root root 70 Jan  6 12:05 10.52.0.37
-rw------- 1 root root 70 Jan  6 12:05 10.52.0.38
-rw------- 1 root root 70 Jan  6 12:05 10.52.0.39
-rw------- 1 root root 70 Dec  2 12:04 10.52.0.4
-rw------- 1 root root 70 Jan  6 12:05 10.52.0.40
-rw------- 1 root root 70 Jan  6 12:05 10.52.0.41
-rw------- 1 root root 70 Jan  6 12:05 10.52.0.42
-rw------- 1 root root 70 Dec 28 12:04 10.52.0.43
-rw------- 1 root root 70 Jan  6 12:05 10.52.0.44
-rw------- 1 root root 70 Dec 29 12:05 10.52.0.45
-rw------- 1 root root 70 Jan  6 12:05 10.52.0.46
-rw------- 1 root root 70 Jan  2 12:04 10.52.0.47
-rw------- 1 root root 70 Jan  6 12:05 10.52.0.48
-rw------- 1 root root 70 Jan  6 12:05 10.52.0.49
-rw------- 1 root root 70 Dec  2 12:04 10.52.0.5
-rw------- 1 root root 70 Jan  6 12:04 10.52.0.50
-rw------- 1 root root 70 Jan  5 12:05 10.52.0.51
-rw------- 1 root root 70 Dec  8 12:05 10.52.0.52
-rw------- 1 root root 70 Dec  8 12:05 10.52.0.53
-rw------- 1 root root 70 Dec  8 12:05 10.52.0.54
-rw------- 1 root root 70 Jan  6 12:05 10.52.0.55
-rw------- 1 root root 70 Dec  8 12:05 10.52.0.56
-rw------- 1 root root 70 Jan  6 12:05 10.52.0.57
-rw------- 1 root root 70 Jan  6 12:06 10.52.0.58
-rw------- 1 root root 70 Dec 25 12:05 10.52.0.59
-rw------- 1 root root 70 Dec 26 12:05 10.52.0.6
-rw------- 1 root root 70 Dec 25 12:05 10.52.0.60
-rw------- 1 root root 70 Nov 26 12:04 10.52.0.61
-rw------- 1 root root 70 Dec 25 12:05 10.52.0.62
-rw------- 1 root root 70 Dec 25 12:05 10.52.0.63
-rw------- 1 root root 70 Nov 26 12:05 10.52.0.64
-rw------- 1 root root 70 Nov 26 12:05 10.52.0.65
-rw------- 1 root root 70 Jan  6 12:05 10.52.0.66
-rw------- 1 root root 70 Dec 25 12:05 10.52.0.67
-rw------- 1 root root 70 Jan  6 12:04 10.52.0.68
-rw------- 1 root root 70 Dec 28 12:04 10.52.0.69
-rw------- 1 root root 70 Dec 27 12:04 10.52.0.7
-rw------- 1 root root 70 Jan  6 12:05 10.52.0.70
-rw------- 1 root root 70 Dec 28 12:04 10.52.0.71
-rw------- 1 root root 70 Jan  6 12:05 10.52.0.72
-rw------- 1 root root 70 Dec  8 12:07 10.52.0.73
-rw------- 1 root root 70 Nov 26 12:06 10.52.0.74
-rw------- 1 root root 70 Dec  8 12:07 10.52.0.75
-rw------- 1 root root 70 Jan  6 12:05 10.52.0.76
-rw------- 1 root root 70 Dec 28 12:04 10.52.0.77
-rw------- 1 root root 70 Nov 26 12:06 10.52.0.78
-rw------- 1 root root 70 Jan  6 12:05 10.52.0.79
-rw------- 1 root root 70 Jan  6 12:05 10.52.0.8
-rw------- 1 root root 70 Dec 14 12:52 10.52.0.80
-rw------- 1 root root 70 Jan  6 12:05 10.52.0.81
-rw------- 1 root root 70 Nov 16 12:05 10.52.0.82
-rw------- 1 root root 70 Nov 16 12:05 10.52.0.83
-rw------- 1 root root 70 Nov 16 12:05 10.52.0.84
-rw------- 1 root root 70 Jan  5 12:05 10.52.0.85
-rw------- 1 root root 70 Jan  6 12:05 10.52.0.86
-rw------- 1 root root 70 Dec 24 12:05 10.52.0.87
-rw------- 1 root root 70 Nov 27 12:03 10.52.0.88
-rw------- 1 root root 70 Nov 27 12:03 10.52.0.89
-rw------- 1 root root 70 Jan  6 12:05 10.52.0.9
-rw------- 1 root root 70 Nov 27 12:03 10.52.0.90
-rw------- 1 root root 70 Nov 27 12:03 10.52.0.91
-rw------- 1 root root 70 Nov 27 12:03 10.52.0.92
-rw------- 1 root root 70 Nov 27 12:03 10.52.0.93
-rw------- 1 root root 70 Nov 27 12:03 10.52.0.94
-rw------- 1 root root 70 Nov 17 12:05 10.52.0.95
-rw------- 1 root root 70 Nov 27 12:03 10.52.0.96
-rw------- 1 root root 70 Nov 27 12:03 10.52.0.97
-rw------- 1 root root 70 Nov 27 12:03 10.52.0.98
-rw------- 1 root root 70 Nov 27 12:03 10.52.0.99
-rw------- 1 root root 11 Jan  6 12:10 last_reserved_ip.0
-rwxr-x--- 1 root root  0 Nov 15 14:55 lock
```

**Comment by mingshuoqiu** [comment]
@bcdurden please help check if this still persists in 1.4.1. The new version should come with the fix for https://github.com/harvester/harvester/issues/7041. We believe it should help for this issue.

**Comment by starbops** [comment]
@bcdurden It seems not related. According to the [doc](https://docs.rke2.io/known_issues#canal-and-ip-exhaustion) and the similar issue rancher/rke2#4385, the part relevant to iptables is due to the missing package, not disable the kernel tunable `bridge-nf-call-iptables`. In Harvester, iptables are shipped by default, so this is not the case. There must be some reasons for the IP addresses being exhausted.

If you have reproducible steps, please let us know. Thank you.

**Comment by bcdurden** [comment]
> @bcdurden It seems not related. According to the [doc](https://docs.rke2.io/known_issues#canal-and-ip-exhaustion) and the similar issue [rancher/rke2#4385](https://github.com/rancher/rke2/issues/4385), the part relevant to iptables is due to the missing package, not disable the kernel tunable `bridge-nf-call-iptables`. In Harvester, iptables are shipped by default, so this is not the case. There must be some reasons for the IP addresses being exhausted.
> 
> If you have reproducible steps, please let us know. Thank you.

This is one of those things that just happens over time. I think it has to do with shutdowns and restarts everyday. I am not the only one that has run into this issue. See the [RKE2 docs](https://docs.rke2.io/known_issues#canal-and-ip-exhaustion) for a description of this problem.

The trouble is, restarting the node, which should resolve this issue, does not work. It might be an RKE2 issue, I don't know. But if the customer does powerdowns of Harvester semi-often, they will eventually run into this problem (Harvester has a large Edge presence, so this is not an outlier case)

**Comment by mingshuo-qiu** [comment]
Does the `systemctl restart rke2-server` or rke2-agent helps when the symptom happens?
And it only happens when running out reserved IPs?

**Comment by mingshuoqiu** [comment]
Seems it's not related to HTTP/HTTPs on VLANs. Could you help create an issue ticket for this? It would be worthy to investigate, and we need to know how to reproduce. Thanks

**Comment by bcdurden** [comment]
Yeah it's very likely not related to that specific issue. It's only related
to the fix you have planned for it in 1.4.1 (disabling iptables on the
bridge).

**Comment by starbops** [comment]
@bcdurden Since the support bundle cannot be collected, could you post the rke2-canal pods' log?

Harvester uses `canal` CNI and the IPAM plugin is `host-local` where the datastore is configured to use the Kubernetes API. So there might be something worth checking in the canal pods. Thank you.

**Comment by HoustonDad** [comment]
As a FYI, I've opened SCC 01568219 to bridge a support bundle and logs from our lab to SURE-9479

**Comment by noahgildersleeve** [comment]
Tested with single node Harvester with Vlan tagged VM network on management interface (cluster network). Validated that I could access HTTPS via imported Rancher on Harvester running on the same node.

Validated with Harvester `v1.5-a09f2519-head` and Rancher:head version `f76c3ae`.
